,PKCosecha,PKCiclo,Fecha,Parcial,CantidadCosechada,PesoPromedio,Dispersion,VentaUSDReal,Usuario,TimeStamp,FechaSiembra,FechaCosecha,cycle_days
0,4133,3402,2021-01-06,0,1108000,0.31999999,0,0.0,17,01/13/21 12:43:36,,,
1,4134,3403,2021-01-07,0,1204469,0.31999999,0,0.0,17,01/13/21 12:44:27,,,
2,4135,3401,2021-01-06,0,1614866,0.98000002,0,0.0,17,01/13/21 14:01:22,,,
3,4136,3398,2021-01-16,1,239708,11.5,0,7125.0,17,02/13/21 15:03:00,,,
4,4137,3404,2021-01-01,0,950000,0.23999999,0,0.0,17,01/27/21 13:26:51,,,
5,4138,3396,2021-02-13,0,275143,24.540001,0,24601.0,17,04/23/21 17:48:41,,,
6,4139,3393,2021-02-10,1,179446,24.18,0,15165.0,17,04/23/21 17:48:15,,,
7,4140,3391,2021-02-15,0,897973,22.200001,0,73737.0,17,04/23/21 17:50:41,,,
8,4141,3390,2021-02-14,0,645319,22.860001,0,51767.0,17,04/23/21 17:49:57,,,
9,4142,3394,2021-02-16,0,376099,25.02,0,35046.0,17,04/23/21 17:51:08,,,
10,4143,3395,2021-02-19,0,621467,23.99,0,53888.0,17,04/23/21 17:51:58,,,
11,4144,3392,2021-02-20,0,755047,24.469999,0,65640.0,17,04/23/21 17:52:30,,,
12,4145,3412,2021-02-20,0,880000,0.80000001,0,0.0,17,02/23/21 14:31:40,2021-01-27,2021-02-20,24.0
13,4146,3413,2021-02-20,0,880000,0.80000001,0,0.0,17,02/23/21 15:12:09,2021-01-27,2021-02-20,24.0
14,4147,3414,2021-02-22,0,352800,1.0,0,0.0,17,03/02/21 01:15:24,2021-01-27,2021-02-22,26.0
15,4148,3415,2021-02-23,0,1480000,1.0,0,0.0,17,03/02/21 01:17:18,2021-01-27,2021-02-23,27.0
16,4149,3416,2021-02-24,0,1134308,0.25999999,0,0.0,17,03/02/21 01:18:22,2021-02-06,2021-02-24,18.0
17,4150,3417,2021-02-25,0,988318,0.44,0,0.0,17,03/02/21 01:19:16,2021-02-06,2021-02-25,19.0
18,4151,3407,2021-02-27,1,157183,17.75,0,9438.0,17,04/23/21 17:52:59,2021-01-01,2021-03-31,57.0
19,4152,3406,2021-03-01,1,195298,15.1,0,9173.0,17,04/23/21 17:53:52,,,
20,4154,3405,2021-02-28,1,157873,14.48,0,9988.0,17,04/23/21 17:53:27,2021-01-06,2021-04-20,53.0
21,4155,3408,2021-03-02,1,178332,14.63,0,7545.0,17,04/23/21 17:54:15,,,
22,4156,3398,2021-03-03,1,142753,24.77,0,14641.0,17,04/23/21 17:54:37,,,
23,4157,3398,2021-03-16,0,588313,27.379999,0,67969.0,17,04/23/21 17:55:20,,,
24,4158,3411,2021-03-24,1,156164,21.74,0,13222.0,17,04/23/21 17:55:53,2021-01-06,2021-04-14,77.0
25,4159,3405,2021-03-25,1,107297,22.200001,0,9058.0,17,04/23/21 17:56:20,2021-01-06,2021-04-20,78.0
26,4160,3409,2021-03-26,1,18558,25.65,0,2005.0,17,04/23/21 18:01:48,2021-01-06,2021-04-12,79.0
27,4161,3410,2021-03-27,0,728923,18.67,0,47179.0,17,04/23/21 18:02:44,2021-01-07,2021-03-27,79.0
28,4162,3393,2021-03-28,0,256993,30.459999,0,37648.0,17,04/23/21 18:03:03,,,
29,4163,3408,2021-03-29,0,636881,18.790001,0,43012.0,17,04/23/21 18:04:45,,,
30,4164,3424,2021-03-22,0,647652,1.3,0,0.0,17,03/30/21 10:26:42,2021-02-27,2021-03-22,23.0
31,4165,3426,2021-04-03,0,1080055,0.64999998,0,0.0,17,04/06/21 14:41:18,2021-03-12,2021-04-03,22.0
32,4166,3425,2021-04-04,0,970170,0.63,0,0.0,17,04/06/21 14:41:50,2021-03-12,2021-04-04,23.0
33,4167,3427,2021-04-05,0,1064000,0.77999997,0,0.0,17,04/06/21 14:42:27,2021-03-12,2021-04-05,24.0
34,4168,3406,2021-03-30,0,503848,21.049999,0,39234.0,17,04/23/21 18:05:11,,,
35,4169,3407,2021-03-31,0,540459,26.57,0,61777.0,17,04/23/21 18:05:51,2021-01-01,2021-03-31,89.0
36,4170,3428,2021-04-06,0,770000,1.01,0,0.0,17,04/13/21 16:26:09,2021-03-13,2021-04-06,24.0
37,4171,3429,2021-04-06,0,910000,0.85000002,0,0.0,17,04/13/21 16:30:07,2021-03-13,2021-04-06,24.0
38,4172,3411,2021-04-14,0,641818,27.5,0,82256.0,17,04/23/21 18:07:52,2021-01-06,2021-04-14,98.0
39,4173,3409,2021-04-12,0,457383,29.120001,0,63311.0,17,04/28/21 09:18:39,2021-01-06,2021-04-12,96.0
40,4174,3405,2021-04-20,0,453839,31.0,0,63996.0,17,04/28/21 09:20:19,2021-01-06,2021-04-20,104.0
41,4175,3431,2021-04-18,0,1709121,0.80000001,0,0.0,17,04/20/21 22:33:38,2021-03-26,2021-04-18,23.0
42,4176,3420,2021-04-15,1,107935,15.5,0,5744.0,17,04/28/21 09:21:23,2021-02-22,2021-05-12,52.0
43,4177,3421,2021-04-21,1,273483,18.290001,0,17192.0,17,04/28/21 09:22:42,2021-02-23,2021-05-21,57.0
44,4178,3422,2021-04-24,1,176688,16.0,0,9038.0,17,04/28/21 09:23:26,2021-02-24,2021-05-27,59.0
45,4179,3423,2021-04-24,1,190638,16.450001,0,10626.0,17,05/06/21 11:49:55,2021-02-25,2021-05-25,58.0
46,4180,3419,2021-04-25,1,209141,16.299999,0,10932.0,17,05/06/21 11:50:13,2021-02-20,2021-05-28,64.0
47,4181,3418,2021-04-26,1,197676,18.5,0,14143.0,17,05/06/21 11:50:31,2021-02-20,2021-05-29,65.0
48,4182,3437,2021-04-28,0,1343750,0.31999999,0,0.0,17,05/06/21 11:04:58,2021-04-13,2021-04-28,15.0
49,4183,3420,2021-05-12,0,254780,23.219999,0,24701.0,17,05/26/21 11:05:42,2021-02-22,2021-05-12,79.0
50,4184,3421,2021-05-11,1,710958,24.0,0,75652.0,17,05/26/21 11:06:34,2021-02-23,2021-05-21,77.0
51,4185,3442,2021-05-18,0,313600,0.46000001,0,0.0,17,05/26/21 11:03:38,2021-04-30,2021-05-18,18.0
52,4186,3421,2021-05-21,0,44074,21.0,0,3822.0,17,05/26/21 11:07:24,2021-02-23,2021-05-21,87.0
53,4187,3423,2021-05-25,0,253378,26.0,0,31487.0,17,05/26/21 11:10:14,2021-02-25,2021-05-25,89.0
54,4188,3418,2021-05-13,1,153702,23.5,0,16907.0,17,05/26/21 11:16:36,2021-02-20,2021-05-29,82.0
55,4189,3441,2021-05-25,0,1254400,1.1,0,0.0,17,06/01/21 10:31:56,2021-04-30,2021-05-25,25.0
56,4190,3422,2021-05-27,0,500875,24.0,0,48889.0,17,06/15/21 18:18:48,2021-02-24,2021-05-27,92.0
57,4191,3419,2021-05-28,0,294217,23.0,0,25422.0,17,06/15/21 18:21:39,2021-02-20,2021-05-28,97.0
58,4192,3418,2021-05-29,0,477745,27.5,0,60614.0,17,06/15/21 18:23:21,2021-02-20,2021-05-29,98.0
59,4193,3430,2021-05-30,1,168822,21.5,0,16622.0,17,06/01/21 11:45:10,2021-03-22,2021-06-13,69.0
60,4194,3443,2021-06-03,0,920889,0.36000001,0,0.0,17,06/08/21 16:23:46,2021-05-12,2021-06-03,22.0
61,4195,3444,2021-06-04,0,821255,0.50999999,0,0.0,17,06/08/21 16:24:25,2021-05-12,2021-06-04,23.0
62,4196,3445,2021-06-05,0,856797,0.63999999,0,0.0,17,06/08/21 16:24:59,2021-05-12,2021-06-05,24.0
63,4197,3446,2021-06-07,0,764400,0.55000001,0,0.0,17,06/08/21 16:25:31,2021-05-12,2021-06-07,26.0
64,4198,3434,2021-06-02,1,289655,16.530001,0,19047.0,17,11/03/21 15:09:30,2021-04-05,2021-07-06,58.0
65,4199,3433,2021-06-02,1,111831,15.13,0,6107.0,17,11/03/21 15:09:51,2021-04-04,2021-06-25,59.0
66,4200,3430,2021-06-13,0,556510,23.040001,0,65609.0,17,11/03/21 15:11:58,2021-03-22,2021-06-13,83.0
67,4201,3432,2021-06-12,1,274072,18.049999,0,22519.0,17,11/03/21 15:11:15,2021-04-03,2021-06-26,70.0
68,4202,3439,2021-06-11,1,273266,17.73,0,21599.0,17,11/03/21 15:10:56,2021-04-18,2021-07-12,54.0
69,4203,3435,2021-06-20,0,410802,18.700001,0,22831.0,17,06/29/21 16:20:46,2021-04-06,2021-06-20,75.0
70,4204,3436,2021-06-23,0,383262,18.700001,0,25829.0,17,06/29/21 16:21:41,2021-04-06,2021-06-23,78.0
71,4205,3449,2021-06-19,0,1020000,0.64999998,0,0.0,17,06/23/21 11:30:12,2021-05-26,2021-06-19,24.0
72,4206,3433,2021-06-25,0,891870,16.360001,0,71199.0,17,11/03/21 15:14:20,2021-04-04,2021-06-25,82.0
73,4207,3432,2021-06-26,0,820408,18.620001,0,74542.0,17,11/03/21 15:13:47,2021-04-03,2021-06-26,84.0
74,4208,3457,2021-06-29,0,669900,0.30000001,0,0.0,17,07/07/21 12:30:00,2021-06-10,2021-06-29,19.0
75,4209,3458,2021-06-30,0,746200,0.30000001,0,0.0,17,07/07/21 12:30:49,2021-06-10,2021-06-30,20.0
76,4210,3455,2021-07-02,0,1130514,0.37,0,0.0,17,07/21/21 15:05:42,2021-06-10,2021-07-02,22.0
77,4211,3456,2021-07-03,0,1107600,0.30000001,0,0.0,17,07/21/21 15:04:43,2021-06-10,2021-07-03,23.0
78,4212,3434,2021-07-06,0,631482,24.49,0,76304.0,17,07/21/21 15:52:32,2021-04-05,2021-07-06,92.0
79,4213,3438,2021-07-10,0,371803,24.01,0,41662.0,17,07/21/21 15:56:17,2021-04-18,2021-07-10,83.0
80,4214,3439,2021-07-12,0,583549,24.01,0,68479.0,17,07/21/21 16:01:05,2021-04-18,2021-07-12,85.0
81,4215,3440,2021-07-08,1,403166,16.74,0,28233.0,17,07/21/21 16:03:41,2021-04-28,2021-08-09,71.0
82,4216,3454,2021-07-08,0,785905,0.74000001,0,0.0,17,07/21/21 15:09:06,2021-06-10,2021-07-08,28.0
83,4217,3464,2021-07-19,0,1488202,0.83999997,0,0.0,17,07/21/21 15:13:30,2021-06-23,2021-07-19,26.0
84,4218,3468,2021-07-21,0,1440000,0.079999998,0,0.0,17,07/21/21 15:45:03,2021-07-10,2021-07-21,11.0
85,4219,3453,2021-07-17,0,366900,11.86,0,0.0,17,07/21/21 23:28:06,2021-06-07,2021-07-17,40.0
86,4220,3448,2021-07-24,1,250922,17.360001,0,18974.0,17,08/03/21 12:57:13,2021-05-25,2021-08-26,60.0
87,4221,3440,2021-07-25,1,204336,21.91,0,21606.0,17,08/03/21 12:57:39,2021-04-28,2021-08-09,88.0
88,4222,3469,2021-08-03,0,1195200,0.5,0,0.0,17,08/16/21 12:41:44,2021-07-21,2021-08-03,13.0
89,4223,3440,2021-08-09,0,474379,24.16,0,58887.0,17,08/16/21 16:03:59,2021-04-28,2021-08-09,103.0
90,4224,3451,2021-08-22,0,385403,24.799999,0,45577.0,17,09/01/21 13:40:53,2021-06-04,2021-08-22,79.0
91,4225,3459,2021-08-21,1,250781,19.200001,0,21627.0,17,09/01/21 13:41:06,2021-06-19,2021-09-08,63.0
92,4226,3472,2021-08-16,0,573302,0.52999997,0,0.0,17,08/24/21 16:32:21,2021-07-23,2021-08-16,24.0
93,4227,3470,2021-08-16,0,477754,0.61000001,0,0.0,17,08/24/21 16:24:36,2021-07-23,2021-08-16,24.0
94,4228,3471,2021-08-22,0,1305571,0.07,0,0.0,17,08/24/21 16:31:28,2021-08-11,2021-08-22,11.0
95,4229,3452,2021-08-24,0,405222,21.639999,0,39427.0,17,11/03/21 15:15:10,2021-06-05,2021-08-24,80.0
96,4230,3448,2021-08-26,0,686282,26.17,0,89592.0,17,11/03/21 15:15:32,2021-05-25,2021-08-26,93.0
97,4231,3447,2021-08-27,0,168619,28.52,0,26800.0,17,11/03/21 15:15:59,2021-05-18,2021-08-27,101.0
98,4232,3475,2021-08-31,0,1462087,0.46000001,0,0.0,17,09/08/21 11:05:42,2021-08-07,2021-08-31,24.0
99,4233,3477,2021-08-31,0,770040,0.25,0,0.0,17,09/08/21 11:13:07,2021-08-22,2021-08-31,9.0
100,4234,3478,2021-09-01,0,636280,0.25,0,0.0,17,09/08/21 11:22:26,2021-08-22,2021-09-01,10.0
101,4235,3459,2021-09-08,0,688053,21.01,0,70358.0,17,11/03/21 15:16:35,2021-06-19,2021-09-08,81.0
102,4236,3474,2021-09-02,0,806846,0.25999999,0,0.0,17,09/15/21 17:28:07,2021-08-11,2021-09-02,22.0
103,4237,3483,2021-09-05,0,2544000,0.15000001,0,0.0,17,09/15/21 17:34:57,2021-08-25,2021-09-05,11.0
104,4238,3450,2021-09-07,0,379484,23.25,0,43923.0,17,11/03/21 15:16:14,2021-06-03,2021-09-07,96.0
105,4239,3461,2021-09-09,1,263061,17.84,0,20560.0,17,11/03/21 15:17:09,2021-06-30,2021-09-30,71.0
106,4240,3462,2021-09-10,1,246678,18.209999,0,20539.0,17,11/03/21 15:17:32,2021-07-02,2021-10-06,70.0
107,4241,3460,2021-09-11,1,191685,18.4,0,16386.0,17,11/03/21 15:17:58,2021-06-29,2021-10-01,74.0
108,4242,3466,2021-09-11,0,152184,20.6,0,14743.0,17,11/03/21 15:18:14,2021-07-19,2021-09-11,54.0
109,4243,3482,2021-09-15,0,1183185,0.27000001,0,0.0,17,09/28/21 09:57:01,2021-08-25,2021-09-15,21.0
110,4244,3485,2021-09-16,0,2129931,0.28999999,0,0.0,17,09/28/21 09:57:52,2021-09-05,2021-09-16,11.0
111,4245,3465,2021-09-24,0,347517,26.98,0,52391.0,17,10/12/21 17:07:45,2021-07-08,2021-09-24,78.0
112,4246,3461,2021-09-30,0,240231,26.0,0,29611.0,17,10/12/21 17:08:18,2021-06-30,2021-09-30,92.0
113,4247,3460,2021-10-01,0,381267,22.26,0,44615.0,17,11/03/21 15:19:08,2021-06-29,2021-10-01,94.0
114,4248,3467,2021-10-03,0,683194,21.6,0,71478.0,17,11/03/21 15:19:30,2021-07-19,2021-10-03,76.0
115,4249,3463,2021-10-04,0,615522,23.0,0,71751.0,17,11/03/21 15:20:32,2021-07-03,2021-10-04,93.0
116,4250,3494,2021-10-02,0,1048964,0.28,0,0.0,17,10/05/21 21:44:03,2021-09-09,2021-10-02,23.0
117,4251,3493,2021-10-14,0,1020000,0.40000001,0,0.0,17,10/20/21 12:04:33,2021-09-23,2021-10-14,21.0
118,4252,3473,2021-10-06,1,379765,14.48,0,21889.0,17,11/03/21 15:20:48,2021-08-03,2021-11-05,64.0
119,4253,3462,2021-10-06,0,520682,24.030001,0,64661.0,17,10/20/21 11:39:19,2021-07-02,2021-10-06,96.0
120,4254,3490,2021-10-11,0,742500,0.30000001,0,0.0,17,10/20/21 11:59:06,2021-09-22,2021-10-11,19.0
121,4255,3492,2021-10-12,0,884000,0.27000001,0,0.0,17,10/20/21 12:00:31,2021-09-23,2021-10-12,19.0
122,4256,3491,2021-10-13,0,1170400,0.30000001,0,0.0,17,10/20/21 12:01:54,2021-09-23,2021-10-13,20.0
123,4257,3489,2021-10-14,0,1100800,0.30000001,0,0.0,17,10/20/21 12:03:05,2021-09-22,2021-10-14,22.0
124,4258,3473,2021-11-05,0,708852,23.610001,0,77148.0,17,11/10/21 14:41:09,2021-08-03,2021-11-05,94.0
125,4259,3481,2021-11-07,1,419225,12.38,0,16961.75,17,11/18/21 11:18:21,2021-08-31,2021-12-21,68.0
126,4260,3501,2021-11-12,0,1314946,0.37,0,0.0,17,11/18/21 11:13:43,2021-10-23,2021-11-12,20.0
127,4261,3476,2021-11-06,0,921018,21.030001,0,75851.49,17,11/18/21 11:16:04,2021-08-16,2021-11-06,82.0
128,4262,3502,2021-11-12,0,1469649,0.37,0,0.0,17,11/18/21 11:30:06,2021-10-23,2021-11-12,20.0
129,4263,3506,2021-11-15,0,1959800,0.050000001,0,0.0,17,11/22/21 18:45:58,2021-11-06,2021-11-15,9.0
130,4264,3486,2021-11-19,1,375785,15.28,0,19474.0,17,12/01/21 09:27:40,2021-09-15,2021-12-16,65.0
131,4265,3487,2021-11-20,1,248920,18.299999,0,16159.0,17,12/01/21 09:30:53,2021-09-16,2021-12-13,65.0
132,4266,3488,2021-11-20,1,421389,14.6,0,18630.0,17,12/01/21 09:28:14,2021-09-16,2021-12-19,65.0
133,4267,3481,2021-11-21,1,329755,15.41,0,19818.0,17,11/22/21 19:02:32,2021-08-31,2021-12-21,82.0
134,4268,3479,2021-11-22,0,296147,23.360001,0,27030.0,17,12/01/21 09:27:04,2021-08-31,2021-11-22,83.0
135,4269,3505,2021-12-01,0,403206,0.34,0,0.0,17,12/06/21 11:25:02,2021-11-11,2021-12-01,20.0
136,4270,3507,2021-12-02,0,992794,0.63,0,0.0,17,12/06/21 11:26:53,2021-11-06,2021-12-02,26.0
137,4271,3484,2021-11-28,0,425788,26.0,0,46496.0,17,12/06/21 13:53:22,2021-09-02,2021-11-28,87.0
138,4272,3480,2021-11-30,0,698539,26.5,0,77748.0,17,12/06/21 13:54:11,2021-08-31,2021-11-30,91.0
139,4273,3487,2021-12-13,0,608078,25.5,0,64622.0,17,12/21/21 09:01:57,2021-09-16,2021-12-13,88.0
140,4274,3495,2021-12-14,1,248247,16.540001,0,13274.0,17,12/15/21 20:27:33,2021-10-02,2022-01-20,73.0
141,4275,3498,2021-12-07,1,285644,13.93,0,13131.0,17,12/15/21 20:28:45,2021-10-13,2022-01-31,55.0
142,4276,3496,2021-12-10,1,204929,14.0,0,8314.0,17,01/06/22 23:06:32,2021-10-11,2022-01-25,60.0
143,4277,3497,2021-12-11,1,136242,16.5,0,7177.0,17,01/06/22 23:07:53,2021-10-12,2022-01-23,60.0
144,4278,3486,2021-12-16,0,717839,23.6,0,68574.0,17,12/21/21 09:03:30,2021-09-15,2021-12-16,92.0
145,4279,3488,2021-12-19,0,636144,23.6,0,56966.0,17,01/06/22 23:04:59,2021-09-16,2021-12-19,94.0
146,4280,3508,2021-12-03,0,1428973,0.75,0,0.0,17,12/21/21 09:42:46,2021-11-15,2021-12-03,18.0
147,4282,3500,2021-12-10,1,237931,15.37,0,10915.0,17,12/28/21 15:32:37,2021-10-14,2022-01-22,57.0
148,4283,3495,2021-12-20,1,150934,20.34,0,11108.0,17,01/06/22 23:08:33,2021-10-02,2022-01-20,79.0
149,4284,3481,2021-12-21,0,630000,23.5,0,63408.0,17,01/06/22 23:05:43,2021-08-31,2021-12-21,112.0
150,4285,3499,2021-12-09,1,271026,14.91,0,10165.0,17,01/06/22 23:10:14,2021-10-14,2022-01-24,56.0
151,4286,3500,2021-12-28,1,189221,19.76,0,13178.0,17,01/06/22 23:09:06,2021-10-14,2022-01-22,75.0
152,4287,3514,2021-12-26,0,2553474,0.38,0,0.0,17,01/06/22 23:00:10,2021-12-05,2021-12-26,21.0
153,4288,3513,2021-12-27,0,1238405,0.37,0,0.0,17,01/06/22 22:58:06,2021-12-04,2021-12-27,23.0
154,4289,3512,2021-12-28,0,1086238,0.41999999,0,0.0,17,01/06/22 23:01:53,2021-12-04,2021-12-28,24.0
155,4290,3499,2022-01-03,1,210765,21.83,0,20409.0,17,01/22/22 10:59:47,2021-10-14,2022-01-24,81.0
156,4291,3498,2021-12-30,1,165810,22.0,0,14591.0,17,01/07/22 09:21:58,2021-10-13,2022-01-31,78.0
157,4292,3503,2022-01-07,1,230967,13.24,0,10422.0,17,01/22/22 11:07:51,2021-11-12,2022-02-04,56.0
158,4293,3496,2022-01-08,1,106958,19.43,0,8919.0,17,01/22/22 11:08:38,2021-10-11,2022-01-25,89.0
159,4294,3504,2022-01-13,1,345546,15.83,0,20960.0,17,01/22/22 11:09:23,2021-11-12,2022-02-13,62.0
160,4295,3495,2022-01-20,0,494967,28.809999,0,63323.0,17,01/24/22 23:02:21,2021-10-02,2022-01-20,110.0
161,4296,3500,2022-01-22,0,540438,25.91,0,62155.0,17,01/28/22 12:09:35,2021-10-14,2022-01-22,100.0
162,4297,3497,2022-01-23,0,314643,28.0,0,32782.0,17,02/08/22 18:08:06,2021-10-12,2022-01-23,103.0
163,4298,3499,2022-01-24,0,495437,26.799999,0,58829.0,17,02/08/22 18:09:06,2021-10-14,2022-01-24,102.0
164,4299,3496,2022-01-25,0,367801,23.450001,0,32500.0,17,02/08/22 18:10:05,2021-10-11,2022-01-25,106.0
165,4300,3503,2022-01-25,1,274646,16.959999,0,18855.0,17,02/08/22 18:14:47,2021-11-12,2022-02-04,74.0
166,4301,3519,2022-01-27,0,720000,0.30000001,0,0.0,17,01/28/22 12:10:15,2022-01-11,2022-01-27,16.0
167,4302,3498,2022-01-31,0,466259,27.83,0,57227.0,17,02/08/22 18:11:53,2021-10-13,2022-01-31,110.0
168,4303,3503,2022-02-04,0,716282,20.82,0,58531.0,17,02/15/22 11:48:03,2021-11-12,2022-02-04,84.0
169,4304,3504,2022-01-26,1,180940,21.639999,0,15439.0,17,02/08/22 18:14:07,2021-11-12,2022-02-13,75.0
170,4305,3504,2022-02-06,1,291779,25.18,0,31808.0,17,02/15/22 11:38:33,2021-11-12,2022-02-13,86.0
171,4306,3511,2022-02-08,1,262587,17.24,0,17787.0,17,03/02/22 16:35:34,2021-12-03,2022-02-19,67.0
172,4307,3521,2022-01-30,0,1324242,0.33000001,0,0.0,17,02/08/22 18:22:34,2022-01-11,2022-01-30,19.0
173,4308,3524,2022-01-30,0,939394,0.33000001,0,0.0,17,02/08/22 18:30:44,2022-01-12,2022-01-30,18.0
174,4309,3523,2022-01-30,0,730000,0.69999999,0,0.0,17,02/08/22 20:11:08,2022-01-12,2022-01-30,18.0
175,4310,3520,2022-02-03,0,1354545,0.55000001,0,0.0,17,02/08/22 20:19:02,2022-01-11,2022-02-03,23.0
176,4311,3522,2022-01-29,0,1324390,0.41,0,0.0,17,02/08/22 20:19:38,2022-01-12,2022-01-29,17.0
177,4313,3504,2022-02-13,0,222960,28.309999,0,27046.0,17,03/02/22 16:32:17,2021-11-12,2022-02-13,93.0
178,4314,3516,2022-02-16,1,228262,18.01,0,16458.0,17,03/02/22 16:47:11,2021-12-27,2022-03-08,51.0
179,4315,3517,2022-02-16,1,283344,15.13,0,15516.0,17,03/02/22 16:46:19,2021-12-27,2022-03-08,51.0
180,4316,3515,2022-02-13,1,162837,15.23,0,9262.0,17,03/02/22 16:45:32,2021-12-26,2022-03-07,49.0
181,4318,3510,2022-02-08,1,153957,23.5,0,15550.0,2,02/18/22 10:32:23,2021-12-02,2022-02-25,68.0
182,4319,3530,2022-02-18,0,1418750,0.47999999,0,0.0,17,03/02/22 16:21:38,2022-02-01,2022-02-18,17.0
183,4330,3515,2022-03-07,0,629779,22.6,0,60895.0,17,03/15/22 16:54:42,2021-12-26,2022-03-07,71.0
184,4320,3536,2022-02-23,0,1355556,0.090000004,0,0.0,17,03/02/22 16:27:29,2022-02-12,2022-02-23,11.0
185,4321,3537,2022-02-23,0,2044444,0.090000004,0,0.0,17,03/02/22 16:28:12,2022-02-12,2022-02-23,11.0
186,4322,3535,2022-02-26,0,580000,0.25,0,0.0,17,03/02/22 16:30:39,2022-02-12,2022-02-26,14.0
187,4323,3511,2022-02-19,0,973744,20.299999,0,80411.0,17,03/02/22 16:33:30,2021-12-03,2022-02-19,78.0
188,4324,3509,2022-02-10,1,90253,18.98,0,7051.0,17,03/02/22 16:34:39,2021-12-01,2022-02-20,71.0
189,4325,3509,2022-02-20,0,245110,24.030001,0,25126.0,17,03/02/22 16:36:39,2021-12-01,2022-02-20,81.0
190,4326,3510,2022-02-08,1,174240,21.389999,0,15678.0,17,03/02/22 16:38:04,2021-12-02,2022-02-25,68.0
191,4327,3510,2022-02-25,0,469950,21.41,0,40848.0,17,03/02/22 16:39:17,2021-12-02,2022-02-25,85.0
192,4328,3515,2022-02-22,1,203151,18.09,0,15063.0,17,03/02/22 20:35:26,2021-12-26,2022-03-07,58.0
193,4329,3529,2022-02-17,0,1383333,0.30000001,0,0.0,17,03/02/22 16:50:45,2022-02-01,2022-02-17,16.0
194,4331,3518,2022-03-04,0,639701,24.76,0,69270.0,17,03/15/22 16:55:41,2021-12-28,2022-03-04,66.0
195,4332,3538,2022-03-02,0,2717143,0.34999999,0,0.0,17,03/08/22 14:39:12,2022-02-23,2022-03-02,7.0
196,4333,3517,2022-03-08,0,618860,25.08,0,65964.0,17,03/15/22 16:52:55,2021-12-27,2022-03-08,71.0
197,4334,3516,2022-03-08,0,588538,24.08,0,61643.0,17,03/15/22 16:54:03,2021-12-27,2022-03-08,71.0
198,4335,3542,2022-03-11,0,1492857,0.14,0,0.0,17,03/15/22 17:00:02,2022-02-27,2022-03-11,12.0
199,4336,3543,2022-03-11,0,1407143,0.14,0,0.0,17,03/15/22 17:00:38,2022-02-27,2022-03-11,12.0
200,4337,3541,2022-03-14,0,1180000,0.25,0,0.0,17,03/15/22 17:07:24,2022-02-27,2022-03-14,15.0
201,4338,3540,2022-03-15,0,1228000,0.25,0,0.0,17,03/23/22 08:37:23,2022-02-27,2022-03-15,16.0
202,4339,3546,2022-03-16,0,2700000,0.43000001,0,0.0,17,03/23/22 08:39:52,2022-03-11,2022-03-16,5.0
203,4340,3528,2022-03-17,1,202834,17.0,0,13722.0,17,03/23/22 08:44:03,2022-01-29,2022-04-13,47.0
204,4341,3525,2022-03-18,1,245500,18.0,0,17586.0,17,03/23/22 08:50:58,2022-01-27,2022-04-17,50.0
205,4342,3527,2022-03-19,1,169628,14.52,0,8766.0,17,04/06/22 11:36:06,2022-01-30,2022-04-12,48.0
206,4343,3531,2022-03-23,1,224654,16.629999,0,14781.0,17,04/06/22 11:36:37,2022-02-03,2022-04-19,48.0
207,4344,3532,2022-03-25,1,210880,14.43,0,11044.0,17,04/06/22 11:37:14,2022-01-30,2022-04-09,54.0
208,4345,3526,2022-03-23,1,320441,13.6,0,15262.0,17,03/29/22 15:01:57,2022-01-30,2022-04-21,52.0
209,4346,3528,2022-03-30,1,229465,22.059999,0,21120.0,17,04/06/22 11:37:52,2022-01-29,2022-04-13,60.0
210,4347,3527,2022-04-01,1,187000,20.0,0,15039.0,17,04/21/22 14:24:16,2022-01-30,2022-04-12,61.0
211,4348,3525,2022-04-02,1,200320,25.0,0,21667.0,17,04/21/22 14:28:17,2022-01-27,2022-04-17,65.0
212,4349,3526,2022-04-04,1,260000,20.0,0,21105.0,17,04/21/22 14:28:50,2022-01-30,2022-04-21,64.0
213,4350,3533,2022-04-11,1,340883,15.85,0,18168.0,17,04/21/22 14:29:36,2022-02-18,2022-05-18,52.0
214,4351,3534,2022-04-09,1,299944,18.0,0,19033.0,17,04/21/22 14:30:18,2022-02-17,2022-05-17,51.0
215,4352,3532,2022-04-09,0,743526,19.0,0,52187.0,17,04/21/22 14:21:02,2022-01-30,2022-04-09,69.0
216,4353,3555,2022-04-15,0,522222,0.090000004,0,0.0,17,04/21/22 14:16:47,2022-04-06,2022-04-15,9.0
217,4354,3556,2022-04-21,0,954545,0.11,0,0.0,17,04/21/22 14:16:24,2022-04-06,2022-04-21,15.0
218,4355,3527,2022-04-12,0,395154,22.700001,0,33206.0,17,04/21/22 14:22:23,2022-01-30,2022-04-12,72.0
219,4356,3545,2022-04-11,1,189049,14.61,0,8855.0,17,04/21/22 14:31:06,2022-03-02,2022-05-11,40.0
220,4357,3528,2022-04-13,0,594818,26.440001,0,64234.0,17,04/25/22 16:40:23,2022-01-29,2022-04-13,74.0
221,4358,3525,2022-04-17,0,512933,27.139999,0,57268.0,17,05/06/22 13:22:59,2022-01-27,2022-04-17,80.0
222,4359,3531,2022-04-19,0,684195,23.6,0,61033.0,17,05/06/22 13:21:24,2022-02-03,2022-04-19,75.0
223,4360,3551,2022-04-20,0,962963,0.54000002,0,0.0,17,04/25/22 16:31:35,2022-03-29,2022-04-20,22.0
224,4361,3552,2022-04-23,0,1154688,0.63999999,0,0.0,17,04/25/22 16:33:38,2022-03-29,2022-04-23,25.0
225,4362,3553,2022-04-23,0,1024615,1.3,0,0.0,17,04/25/22 16:36:09,2022-03-29,2022-04-23,25.0
226,4363,3554,2022-04-24,0,1129167,0.47999999,0,0.0,17,04/25/22 16:38:15,2022-04-05,2022-04-24,19.0
227,4364,3526,2022-04-21,0,691229,24.17,0,65244.0,17,05/06/22 13:22:13,2022-01-30,2022-04-21,81.0
228,4365,3545,2022-04-25,1,374700,20.0,0,21864.0,17,05/06/22 13:18:18,2022-03-02,2022-05-11,54.0
229,4366,3544,2022-04-26,1,387059,17.0,0,17930.0,17,05/06/22 13:18:56,2022-03-02,2022-06-03,55.0
230,4367,3533,2022-04-27,1,323364,22.0,0,22769.0,17,05/06/22 13:19:27,2022-02-18,2022-05-18,68.0
231,4368,3534,2022-04-29,1,295600,25.0,0,24696.0,17,05/16/22 15:58:39,2022-02-17,2022-05-17,71.0
232,4369,3550,2022-04-30,1,510214,14.0,0,19215.0,17,05/31/22 15:35:24,2022-03-16,2022-06-03,45.0
233,4370,3549,2022-05-01,1,488667,15.0,0,20442.0,17,05/31/22 15:35:57,2022-03-16,2022-06-01,46.0
234,4371,3547,2022-05-02,1,388625,16.0,0,15966.0,17,05/31/22 15:36:33,2022-03-14,2022-05-31,49.0
235,4372,3548,2022-05-03,1,343333,16.5,0,16971.0,17,05/16/22 15:59:17,2022-03-15,2022-05-30,49.0
236,4373,3544,2022-05-13,1,362724,20.629999,0,27412.0,17,05/31/22 15:37:10,2022-03-02,2022-06-03,72.0
237,4374,3545,2022-05-11,0,826110,22.52,0,62825.0,17,05/31/22 15:32:31,2022-03-02,2022-05-11,70.0
238,4375,3539,2022-05-16,0,408401,23.57,0,34942.0,17,05/31/22 15:33:15,2022-02-26,2022-05-16,79.0
239,4376,3534,2022-05-17,0,477767,30.0,0,57625.0,17,05/31/22 16:13:43,2022-02-17,2022-05-17,89.0
240,4377,3533,2022-05-18,0,607098,28.6,0,65106.0,17,05/31/22 16:14:34,2022-02-18,2022-05-18,89.0
241,4378,3550,2022-05-23,1,232425,21.280001,0,16470.0,17,06/06/22 17:38:54,2022-03-16,2022-06-03,68.0
242,4379,3563,2022-05-21,0,392857,0.56,0,0.0,17,05/31/22 15:49:53,2022-04-28,2022-05-21,23.0
243,4380,3564,2022-05-22,0,928571,0.56,0,0.0,17,05/31/22 16:05:03,2022-04-28,2022-05-22,24.0
244,4381,3548,2022-05-30,0,743000,26.0,0,63391.0,17,06/19/22 13:23:11,2022-03-15,2022-05-30,76.0
245,4382,3549,2022-05-24,1,159982,22.790001,0,12597.0,17,06/06/22 17:39:15,2022-03-16,2022-06-01,69.0
246,4383,3569,2022-05-24,0,1300000,0.1,0,4.02,17,06/06/22 16:24:06,2022-05-12,2022-05-24,12.0
247,4384,3565,2022-05-22,0,1953846,0.71499997,0,0.0,17,06/06/22 17:35:47,2022-04-29,2022-05-22,23.0
248,4385,3547,2022-05-31,0,636914,25.0,0,53174.0,17,06/19/22 13:24:15,2022-03-14,2022-05-31,78.0
249,4386,3549,2022-06-01,0,621700,25.299999,0,50764.0,17,06/19/22 13:25:13,2022-03-16,2022-06-01,77.0
250,4387,3550,2022-06-03,0,581870,24.709999,0,44420.0,17,06/19/22 13:29:13,2022-03-16,2022-06-03,79.0
251,4388,3571,2022-06-13,0,1320000,0.15000001,0,0.0,17,06/19/22 13:18:30,2022-05-27,2022-06-13,17.0
252,4389,3572,2022-06-13,0,1000000,0.16,0,0.0,17,06/19/22 13:20:29,2022-05-27,2022-06-13,17.0
253,4390,3573,2022-06-14,0,1194444,0.18000001,0,0.0,17,06/19/22 13:21:53,2022-05-28,2022-06-14,17.0
254,4391,3544,2022-06-03,0,361615,30.219999,0,37758.0,17,06/19/22 13:26:43,2022-03-02,2022-06-03,93.0
255,4392,3559,2022-06-08,1,177436,19.190001,0,10285.0,17,06/28/22 13:36:10,2022-04-23,2022-07-19,46.0
256,4393,3557,2022-06-09,1,130260,18.09,0,6094.0,17,06/27/22 17:57:09,2022-04-20,2022-07-11,50.0
257,4394,3562,2022-06-10,1,182059,17.389999,0,8340.0,17,06/27/22 17:58:32,2022-04-16,2022-07-10,55.0
258,4395,3560,2022-06-11,1,203235,17.620001,0,9424.0,17,06/27/22 17:59:25,2022-04-24,2022-07-15,48.0
259,4396,3561,2022-06-15,1,165278,18.0,0,8349.0,17,06/27/22 18:00:18,2022-04-15,2022-07-21,61.0
260,4397,3558,2022-06-20,1,89910,18.83,0,5037.0,17,06/28/22 13:36:43,2022-04-23,2022-07-20,58.0
261,4398,3574,2022-06-14,0,2747619,0.20999999,0,0.0,17,06/28/22 13:32:38,2022-05-28,2022-06-14,17.0
262,4399,3561,2022-06-25,1,132665,21.0,0,9599.0,17,07/12/22 22:39:03,2022-04-15,2022-07-21,71.0
263,4400,3562,2022-07-10,0,486856,23.98,0,43464.0,17,07/24/22 21:32:41,2022-04-16,2022-07-10,85.0
264,4401,3557,2022-07-11,0,455337,27.299999,0,54055.0,17,07/24/22 21:33:15,2022-04-20,2022-07-11,82.0
265,4402,3560,2022-06-26,1,158918,22.0,0,12194.0,17,07/12/22 22:39:47,2022-04-24,2022-07-15,63.0
266,4403,3558,2022-06-27,1,157525,23.0,0,12446.0,17,07/12/22 22:40:35,2022-04-23,2022-07-20,65.0
267,4404,3559,2022-06-28,1,138260,26.6,0,14214.0,17,07/12/22 22:41:25,2022-04-23,2022-07-19,66.0
268,4405,3557,2022-06-30,1,130315,26.4,0,13707.0,17,07/12/22 22:43:05,2022-04-20,2022-07-11,71.0
269,4406,3562,2022-06-30,1,126231,23.379999,0,10372.0,17,07/12/22 22:43:51,2022-04-16,2022-07-10,75.0
270,4407,3560,2022-07-15,0,428275,27.02,0,50228.0,17,07/24/22 21:33:45,2022-04-24,2022-07-15,82.0
271,4408,3568,2022-07-13,1,342420,13.24,0,14624.0,17,07/24/22 21:35:18,2022-05-22,2022-08-16,52.0
272,4409,3559,2022-07-19,0,463101,27.02,0,54013.0,17,08/01/22 18:29:49,2022-04-23,2022-07-19,87.0
273,4410,3558,2022-07-20,0,345559,27.02,0,35793.0,17,08/01/22 18:52:40,2022-04-23,2022-07-20,88.0
274,4412,3578,2022-07-21,0,952000,0.25,0,0.0,17,07/24/22 21:36:36,2022-06-26,2022-07-21,25.0
275,4413,3579,2022-07-22,0,1044000,0.25,0,0.0,17,07/24/22 21:37:54,2022-06-26,2022-07-22,26.0
276,4414,3584,2022-07-22,0,925000,0.28,0,0.0,17,07/24/22 21:38:50,2022-07-01,2022-07-22,21.0
277,4415,3561,2022-07-21,0,402725,26.42,0,45168.0,17,08/01/22 18:43:38,2022-04-15,2022-07-21,97.0
278,4416,3570,2022-07-22,1,215024,14.71,0,6155.0,17,08/01/22 18:54:53,2022-05-24,2022-08-26,59.0
279,4417,3567,2022-07-22,1,205291,22.870001,0,16163.0,17,08/01/22 18:56:02,2022-05-22,2022-08-14,61.0
280,4418,3568,2022-07-23,1,286425,17.09,0,15919.0,17,08/01/22 18:57:06,2022-05-22,2022-08-16,62.0
281,4419,3566,2022-07-29,0,102781,26.969999,0,12142.0,17,08/18/22 10:54:20,2022-05-21,2022-07-29,69.0
282,4420,3582,2022-07-25,0,1243750,0.63999999,0,0.0,17,08/01/22 18:59:24,2022-06-26,2022-07-25,29.0
283,4421,3585,2022-07-25,0,731707,0.41,0,0.0,17,08/01/22 19:03:15,2022-06-28,2022-07-25,27.0
284,4422,3583,2022-07-26,0,1082500,0.40000001,0,6.0,17,08/01/22 19:06:49,2022-06-28,2022-07-26,28.0
285,4423,3567,2022-08-14,0,386982,28.5,0,43140.0,17,08/29/22 16:15:18,2022-05-22,2022-08-14,84.0
286,4424,3568,2022-08-16,0,817797,24.33,0,82697.0,2,09/05/22 13:49:25,2022-05-22,2022-08-16,86.0
287,4425,3591,2022-08-10,0,523077,0.13,0,0.0,17,08/29/22 16:24:05,2022-07-26,2022-08-10,15.0
288,4426,3570,2022-08-26,0,750410,25.629999,0,86624.0,2,09/05/22 18:09:02,2022-05-24,2022-08-26,94.0
289,4427,3593,2022-08-27,0,1212000,0.25,0,0.0,17,08/30/22 08:22:58,2022-08-09,2022-08-27,18.0
290,4428,3580,2022-09-06,1,254385,26.0,0,28164.0,17,09/26/22 22:26:26,2022-06-14,2022-09-26,84.0
291,4429,3581,2022-09-08,1,396723,22.889999,0,38554.0,17,09/26/22 22:26:58,2022-06-14,2022-09-27,86.0
292,4430,3577,2022-09-09,1,195978,27.35,0,23703.0,17,09/26/22 22:27:19,2022-06-14,2022-09-24,87.0
293,4431,3594,2022-09-01,0,2251923,0.51999998,0,0.0,17,09/10/22 22:51:04,2022-08-09,2022-09-01,23.0
294,4432,3575,2022-09-10,1,236799,26.93,0,29924.0,17,09/26/22 22:27:43,2022-06-13,2022-09-23,89.0
295,4433,3576,2022-09-14,0,495980,28.360001,0,62570.0,17,09/26/22 22:23:09,2022-06-13,2022-09-14,93.0
296,4434,3575,2022-09-23,0,388729,29.9,0,51739.0,17,10/03/22 13:18:01,2022-06-13,2022-09-23,102.0
297,4435,3577,2022-09-24,0,469663,30.59,0,62385.0,17,10/03/22 13:29:47,2022-06-14,2022-09-24,102.0
298,4436,3598,2022-09-16,0,1622222,0.090000004,0,0.0,17,09/26/22 22:35:35,2022-09-05,2022-09-16,11.0
299,4437,3580,2022-09-26,0,349098,33.259998,0,58149.0,17,10/13/22 20:12:16,2022-06-14,2022-09-26,104.0
300,4438,3581,2022-09-27,0,471298,27.42,0,60323.0,17,10/13/22 20:12:52,2022-06-14,2022-09-27,105.0
301,4439,3586,2022-10-07,0,607848,25.610001,0,65562.0,17,10/25/22 18:09:50,2022-07-21,2022-10-07,78.0
302,4440,3590,2022-10-08,0,391265,25.299999,0,40950.0,17,10/25/22 18:10:43,2022-07-25,2022-10-08,75.0
303,4441,3587,2022-10-09,0,258698,25.809999,0,28396.0,17,10/25/22 18:11:18,2022-07-22,2022-10-09,79.0
304,4442,3599,2022-09-22,0,1095000,0.2,0,0.0,17,10/13/22 20:15:31,2022-09-05,2022-09-22,17.0
305,4443,3602,2022-10-04,0,1190000,0.2,0,0.0,17,10/13/22 20:16:45,2022-09-15,2022-10-04,19.0
306,4444,3603,2022-10-05,0,1124000,0.25,0,0.0,17,10/13/22 20:18:25,2022-09-15,2022-10-05,20.0
307,4445,3601,2022-10-06,0,2091667,0.36000001,0,0.0,17,10/13/22 20:20:09,2022-09-14,2022-10-06,22.0
308,4446,3588,2022-10-13,1,208913,23.0,0,20303.0,17,10/25/22 18:12:50,2022-07-22,2022-10-25,83.0
309,4447,3610,2022-10-23,0,1469231,0.13,0,0.0,17,10/25/22 18:03:22,2022-10-06,2022-10-23,17.0
310,4448,3611,2022-10-23,0,1663636,0.11,0,0.0,17,10/25/22 18:05:22,2022-10-06,2022-10-23,17.0
311,4449,3589,2022-10-23,0,538477,29.68,0,63816.0,17,10/31/22 13:34:31,2022-07-25,2022-10-23,90.0
312,4450,3588,2022-10-25,0,392680,25.41,0,42719.0,17,11/10/22 09:04:19,2022-07-22,2022-10-25,95.0
313,4451,3595,2022-10-26,0,328808,25.41,0,32552.0,17,11/10/22 09:05:06,2022-07-26,2022-10-26,92.0
314,4452,3592,2022-10-27,1,141676,18.5,0,8308.0,17,11/10/22 09:06:20,2022-08-10,2022-11-09,78.0
315,4453,3614,2022-11-04,0,938462,0.13,0,0.0,17,11/10/22 07:53:02,2022-10-17,2022-11-04,18.0
316,4454,3615,2022-11-05,0,950000,0.14,0,0.0,17,11/10/22 07:56:03,2022-10-17,2022-11-05,19.0
317,4455,3609,2022-11-05,0,1366667,0.12,0,0.0,17,11/10/22 08:09:18,2022-10-17,2022-11-05,19.0
318,4456,3616,2022-11-06,0,1190000,0.2,0,0.0,17,11/10/22 09:01:02,2022-10-17,2022-11-06,20.0
319,4457,3597,2022-11-07,1,358876,16.73,0,17575.0,17,11/14/22 13:30:53,2022-09-01,2022-11-26,67.0
320,4458,3592,2022-11-09,0,262684,22.43,0,20249.0,17,12/02/22 13:00:31,2022-08-10,2022-11-09,91.0
321,4459,3596,2022-11-11,1,271667,18.0,0,15182.0,17,12/02/22 12:59:46,2022-08-27,2022-11-27,76.0
322,4460,3597,2022-11-26,0,763261,23.0,0,54475.0,17,12/02/22 13:21:43,2022-09-01,2022-11-26,86.0
323,4461,3596,2022-11-27,0,677378,22.5,0,45796.0,17,12/02/22 13:23:07,2022-08-27,2022-11-27,92.0
324,4462,3621,2022-11-23,0,450000,0.2,0,0.0,17,12/02/22 13:33:26,2022-11-06,2022-11-23,17.0
325,4463,3625,2022-12-09,0,1400000,0.2,0,0.0,17,12/12/22 17:47:11,2022-11-24,2022-12-09,15.0
326,4464,3624,2022-12-09,0,1988889,0.27000001,0,0.0,17,12/22/22 08:42:38,2022-11-25,2022-12-09,14.0
327,4465,3600,2022-12-15,1,338905,21.0,0,21919.0,17,12/22/22 08:45:28,2022-09-16,2023-01-07,90.0
328,4466,3607,2022-12-18,1,290570,19.299999,0,17188.0,17,01/04/23 11:32:38,2022-10-06,2023-01-05,73.0
329,4467,3606,2022-12-20,1,225535,24.75,0,18649.0,17,01/04/23 11:33:18,2022-10-05,2023-01-10,76.0
330,4468,3604,2022-12-21,1,282235,24.43,0,23677.0,17,01/04/23 11:33:41,2022-09-22,2023-01-07,90.0
331,4469,3605,2022-12-22,1,243616,21.85,0,16541.0,17,01/04/23 11:34:04,2022-10-04,2023-02-03,79.0
332,4470,3607,2023-01-05,0,523594,28.440001,0,55059.0,17,01/20/23 10:00:01,2022-10-06,2023-01-05,91.0
333,4471,3600,2023-01-07,0,611270,29.459999,0,65624.0,17,01/20/23 10:00:38,2022-09-16,2023-01-07,113.0
334,4472,3604,2023-01-07,0,413169,31.209999,0,49089.0,17,01/20/23 10:01:25,2022-09-22,2023-01-07,107.0
335,4473,3612,2023-01-08,1,381455,19.790001,0,23778.0,17,01/20/23 10:06:50,2022-10-23,2023-02-07,77.0
336,4474,3629,2023-01-11,0,1200000,0.2,0,0.0,17,01/20/23 09:45:48,2022-12-24,2023-01-11,18.0
337,4475,3623,2023-01-17,0,920000,0.69999999,0,0.0,17,01/20/23 09:57:02,2022-12-24,2023-01-17,24.0
338,4476,3606,2023-01-10,0,363005,33.41,0,46313.0,17,01/20/23 10:02:56,2022-10-05,2023-01-10,97.0
339,4477,3613,2023-01-11,1,366458,19.200001,0,22944.0,17,01/20/23 10:07:24,2022-10-23,2023-02-06,80.0
340,4478,3618,2023-01-17,1,133193,23.68,0,10941.0,17,01/29/23 11:16:53,2022-11-05,2023-02-16,73.0
341,4479,3608,2023-01-22,0,467053,35.330002,0,72711.0,17,02/06/23 21:49:16,2022-10-06,2023-01-22,108.0
342,4480,3617,2023-01-20,1,160652,20.559999,0,11951.0,17,01/29/23 11:17:34,2022-11-04,2023-02-14,77.0
343,4481,3612,2023-01-23,1,281272,25.469999,0,27862.0,17,02/06/23 21:52:31,2022-10-23,2023-02-07,92.0
344,4482,3628,2023-01-16,0,2432143,0.83999997,0,0.0,17,01/24/23 10:04:14,2022-12-23,2023-01-16,24.0
345,4483,3613,2023-01-24,1,275604,24.43,0,23830.0,17,02/06/23 21:54:00,2022-10-23,2023-02-06,93.0
346,4484,3619,2023-01-26,1,273423,23.780001,0,24417.0,17,02/06/23 21:54:32,2022-11-05,2023-02-22,82.0
347,4485,3605,2023-02-03,0,472462,34.57,0,72219.0,17,03/01/23 19:26:00,2022-10-04,2023-02-03,122.0
348,4486,3613,2023-02-06,0,429678,28.540001,0,47588.0,17,03/02/23 08:46:04,2022-10-23,2023-02-06,106.0
349,4487,3612,2023-02-07,0,369008,30.33,0,45004.0,17,03/02/23 08:47:49,2022-10-23,2023-02-07,107.0
350,4488,3620,2023-02-10,0,590929,28.0,0,65497.0,17,03/02/23 08:48:38,2022-11-06,2023-02-10,96.0
351,4489,3617,2023-02-14,0,371267,30.0,0,46445.0,17,03/02/23 08:49:22,2022-11-04,2023-02-14,102.0
352,4490,3618,2023-02-16,0,270000,25.6,0,23863.0,17,03/02/23 08:49:52,2022-11-05,2023-02-16,103.0
353,4491,3622,2023-02-19,0,286950,27.51,0,31881.0,17,03/02/23 08:50:16,2022-11-25,2023-02-19,86.0
354,4492,3619,2023-02-22,0,463731,31.68,0,58720.0,17,03/02/23 08:50:50,2022-11-05,2023-02-22,109.0
355,4493,3627,2023-02-23,0,931422,21.450001,0,67481.0,17,03/02/23 08:51:42,2022-12-09,2023-02-23,76.0
356,4494,3627,2023-02-09,1,337882,17.0,0,17713.0,17,03/02/23 08:52:06,2022-12-09,2023-02-23,62.0
357,4495,3626,2023-02-13,1,326579,19.0,0,20800.0,17,03/02/23 08:52:28,2022-12-09,2023-03-09,66.0
358,4496,3636,2023-02-07,0,1043396,0.52999997,0,0.0,17,03/02/23 08:59:55,2023-01-21,2023-02-07,17.0
359,4497,3637,2023-02-08,0,1170000,0.69999999,0,0.0,17,03/02/23 09:37:50,2023-01-21,2023-02-08,18.0
360,4498,3634,2023-02-14,0,1118750,0.31999999,0,0.0,17,03/07/23 11:35:10,2023-01-29,2023-02-14,16.0
361,4499,3635,2023-02-15,0,1064103,0.38999999,0,0.0,17,03/07/23 11:36:44,2023-01-29,2023-02-15,17.0
362,4500,3642,2023-03-13,0,935000,0.40000001,0,0.0,17,03/15/23 09:02:33,2023-02-24,2023-03-13,17.0
363,4501,3626,2023-03-09,0,679202,26.83,0,68714.0,17,03/15/23 09:04:16,2022-12-09,2023-03-09,90.0
364,4502,3631,2023-03-07,1,221412,17.0,0,11173.0,17,03/15/23 09:04:43,2023-01-17,2023-03-25,49.0
365,4503,3633,2023-03-11,1,333571,16.799999,0,15315.0,17,03/20/23 16:06:57,2023-01-16,2023-04-07,54.0
366,4504,3643,2023-03-14,0,1106000,0.5,0,0.0,17,03/20/23 16:11:43,2023-02-24,2023-03-14,18.0
367,4505,3630,2023-03-15,1,229212,17.389999,0,11471.0,17,03/20/23 22:08:33,2023-01-11,2023-03-29,63.0
368,4506,3644,2023-03-14,0,2758621,0.57999998,0,0.0,17,03/20/23 22:39:32,2023-02-28,2023-03-14,14.0
369,4507,3649,2023-03-23,0,676667,0.30000001,0,0.0,17,03/31/23 12:01:36,2023-03-06,2023-03-23,17.0
370,4508,3650,2023-03-23,0,697500,0.40000001,0,0.0,17,03/31/23 12:03:05,2023-03-06,2023-03-23,17.0
371,4509,3651,2023-03-23,0,1623077,0.38999999,0,0.0,17,03/31/23 12:04:47,2023-03-06,2023-03-23,17.0
372,4510,3631,2023-03-25,0,512542,23.6,0,43031.0,17,03/31/23 12:13:44,2023-01-17,2023-03-25,67.0
373,4511,3632,2023-03-28,0,798136,22.0,0,59436.0,17,03/31/23 12:14:18,2023-01-16,2023-03-28,71.0
374,4512,3630,2023-03-29,0,488211,21.629999,0,35669.0,17,04/05/23 09:48:15,2023-01-11,2023-03-29,77.0
375,4513,3633,2023-04-07,0,729538,26.0,0,68955.0,17,04/22/23 00:17:38,2023-01-16,2023-04-07,81.0
376,4514,3653,2023-04-10,0,1427500,0.40000001,0,0.0,17,04/11/23 08:30:05,2023-03-24,2023-04-10,17.0
377,4515,3652,2023-04-11,0,1602500,0.40000001,0,0.0,17,04/11/23 08:31:53,2023-03-24,2023-04-11,18.0
378,4516,3654,2023-04-12,0,2440449,0.88999999,0,0.0,17,04/22/23 00:15:32,2023-03-24,2023-04-12,19.0
379,4517,3638,2023-04-20,0,690000,26.0,0,66309.0,17,04/26/23 17:47:16,2023-02-07,2023-04-20,72.0
380,4518,3641,2023-04-21,0,753640,25.0,0,67149.0,17,04/26/23 17:48:21,2023-02-15,2023-04-21,65.0
381,4519,3640,2023-04-26,0,730133,24.889999,0,66931.0,17,05/05/23 09:29:33,2023-02-14,2023-04-26,71.0
382,4520,3639,2023-05-02,0,759500,26.42,0,71314.0,17,05/15/23 13:19:52,2023-02-08,2023-05-02,83.0
383,4521,3661,2023-05-08,0,602222,0.44999999,0,0.0,17,05/15/23 13:09:00,2023-04-21,2023-05-08,17.0
384,4522,3662,2023-05-08,0,635556,0.44999999,0,0.0,17,05/15/23 13:13:50,2023-04-21,2023-05-08,17.0
385,4523,3663,2023-05-10,0,2478333,0.60000002,0,0.0,17,05/15/23 13:15:16,2023-04-21,2023-05-10,19.0
386,4524,3664,2023-05-11,0,1248000,0.5,0,0.0,17,05/15/23 13:17:27,2023-04-26,2023-05-11,15.0
387,4525,3648,2023-05-12,1,321633,19.6,0,23404.0,17,06/05/23 13:38:36,2023-03-14,2023-06-05,59.0
388,4526,3645,2023-05-13,1,195059,17.0,0,7991.0,17,06/05/23 13:39:01,2023-03-13,2023-05-28,61.0
389,4527,3647,2023-05-17,1,253526,19.0,0,15353.0,17,06/05/23 13:39:20,2023-03-14,2023-05-30,64.0
390,4528,3656,2023-05-24,1,286237,18.6,0,14779.0,17,06/05/23 13:39:40,2023-03-23,2023-06-20,62.0
391,4529,3646,2023-05-26,0,825350,20.0,0,47094.0,17,06/05/23 13:36:47,2023-03-14,2023-05-26,73.0
392,4530,3645,2023-05-28,0,626263,19.0,0,30368.0,17,06/05/23 13:37:11,2023-03-13,2023-05-28,76.0
393,4531,3647,2023-05-30,0,735381,21.0,0,38269.0,17,06/05/23 13:37:38,2023-03-14,2023-05-30,77.0
394,4532,3655,2023-05-27,1,336087,18.4,0,18224.0,17,06/05/23 13:39:59,2023-03-23,2023-07-04,65.0
395,4533,3648,2023-05-28,1,237400,25.0,0,20353.0,17,05/30/23 09:27:12,2023-03-14,2023-06-05,75.0
396,4534,3648,2023-06-05,0,468704,27.0,0,45322.0,17,06/19/23 17:47:56,2023-03-14,2023-06-05,83.0
397,4535,3659,2023-06-07,1,290000,17.700001,0,16175.0,17,06/28/23 19:15:19,2023-04-12,2023-06-27,56.0
398,4536,3657,2023-06-08,1,398121,16.5,0,18487.0,17,06/28/23 19:15:59,2023-04-10,2023-07-01,59.0
399,4537,3658,2023-06-14,1,350974,19.5,0,22603.0,17,06/28/23 19:16:21,2023-04-11,2023-06-22,64.0
400,4538,3660,2023-06-15,1,354731,18.6,0,20659.0,17,06/28/23 19:17:25,2023-04-12,2023-06-24,64.0
401,4539,3671,2023-06-06,0,909302,0.43000001,0,0.0,17,06/19/23 17:50:35,2023-05-19,2023-06-06,18.0
402,4540,3670,2023-06-06,0,770000,0.5,0,0.0,17,06/19/23 17:52:01,2023-05-19,2023-06-06,18.0
403,4541,3669,2023-06-09,0,2535789,0.94999999,0,0.0,17,06/19/23 17:53:36,2023-05-16,2023-06-09,24.0
404,4542,3656,2023-06-20,0,851883,23.9,0,63085.0,17,06/28/23 19:12:58,2023-03-23,2023-06-20,89.0
405,4543,3658,2023-06-22,0,891878,21.299999,0,61961.0,17,06/28/23 19:13:39,2023-04-11,2023-06-22,72.0
406,4544,3660,2023-06-24,0,829257,20.200001,0,49073.0,17,06/28/23 19:14:30,2023-04-12,2023-06-24,73.0
407,4545,3659,2023-06-27,0,578381,23.219999,0,39344.0,17,06/28/23 19:14:54,2023-04-12,2023-06-27,76.0
408,4546,3657,2023-07-01,0,798578,22.5,0,54585.0,17,07/12/23 11:15:13,2023-04-10,2023-07-01,82.0
409,4547,3655,2023-07-04,0,636033,30.0,0,69758.0,17,07/12/23 11:15:48,2023-03-23,2023-07-04,103.0
410,4548,3680,2023-07-10,0,2528736,0.87,0,0.0,17,07/17/23 14:03:30,2023-06-16,2023-07-10,24.0
411,4549,3678,2023-07-07,0,1081967,0.61000001,0,0.0,17,07/11/23 15:43:54,2023-06-15,2023-07-07,22.0
412,4550,3679,2023-07-08,0,1114074,0.67500001,0,0.0,17,07/11/23 15:44:50,2023-06-15,2023-07-08,23.0
413,4551,3681,2023-07-11,0,790000,0.80000001,0,0.0,17,07/11/23 15:45:34,2023-06-17,2023-07-11,24.0
414,4552,3666,2023-07-25,0,890516,22.459999,0,59762.0,17,08/07/23 14:16:16,2023-05-10,2023-07-25,76.0
415,4553,3668,2023-07-26,0,768472,21.790001,0,47514.0,17,08/07/23 14:16:48,2023-05-11,2023-07-26,76.0
416,4554,3667,2023-07-27,0,958887,23.18,0,67214.0,17,08/07/23 14:17:18,2023-05-10,2023-07-27,78.0
417,4555,3665,2023-08-02,0,941167,24.0,0,65183.0,17,08/10/23 15:03:48,2023-05-08,2023-08-02,86.0
418,4556,3675,2023-08-04,1,279568,18.5,0,14300.0,17,08/07/23 14:18:17,2023-06-09,2023-08-24,56.0
419,4557,3676,2023-07-06,0,604918,0.61000001,0,0.0,17,08/07/23 21:12:22,2023-06-15,2023-07-06,21.0
420,4558,3677,2023-07-06,0,532353,0.68000001,0,0.0,17,08/07/23 21:12:44,2023-06-15,2023-07-06,21.0
421,4559,3673,2023-08-08,1,129053,22.5,0,8507.0,17,08/10/23 15:03:01,2023-06-06,2023-08-19,63.0
422,4560,3689,2023-08-08,0,830588,0.85000002,0,0.0,17,08/12/23 15:57:26,2023-07-19,2023-08-08,20.0
423,4561,3690,2023-08-09,0,420000,0.60000002,0,0.0,17,08/12/23 15:57:58,2023-07-19,2023-08-09,21.0
424,4562,3691,2023-08-09,0,464815,0.54000002,0,0.0,17,08/12/23 15:58:26,2023-07-19,2023-08-09,21.0
425,4563,3688,2023-08-10,0,1663717,1.13,0,0.0,17,08/12/23 15:58:50,2023-07-18,2023-08-10,23.0
426,4564,3674,2023-08-10,1,223554,21.27,0,13930.0,17,08/14/23 22:49:46,2023-06-09,2023-08-23,62.0
427,4565,3672,2023-08-11,1,174212,20.940001,0,10687.0,17,08/14/23 22:50:10,2023-06-06,2023-09-01,66.0
428,4566,3673,2023-08-19,0,356440,25.0,0,30561.0,17,08/21/23 20:39:20,2023-06-06,2023-08-19,74.0
429,4567,3674,2023-08-23,0,540840,25.0,0,46370.0,17,08/27/23 15:17:41,2023-06-09,2023-08-23,75.0
430,4568,3675,2023-08-24,0,709386,25.889999,0,62988.0,17,08/27/23 15:18:32,2023-06-09,2023-08-24,76.0
431,4569,3672,2023-09-01,0,525299,26.799999,0,48434.0,17,09/11/23 22:55:35,2023-06-06,2023-09-01,87.0
432,4570,3696,2023-08-30,0,2238596,0.56999999,0,0.0,17,09/04/23 17:56:38,2023-08-12,2023-08-30,18.0
433,4571,3697,2023-08-30,0,667925,0.52999997,0,0.0,17,09/04/23 18:00:21,2023-08-12,2023-08-30,18.0
434,4572,3698,2023-08-30,0,715686,1.02,0,0.0,17,09/11/23 22:47:43,2023-08-12,2023-08-30,18.0
435,4573,3683,2023-09-06,1,200923,23.83,0,15300.0,17,09/17/23 13:14:58,2023-07-06,2023-09-21,62.0
436,4574,3684,2023-09-07,1,219624,22.879999,0,17800.0,17,09/17/23 13:15:41,2023-07-07,2023-09-19,62.0
437,4575,3685,2023-09-08,1,191451,26.67,0,18527.0,17,09/17/23 13:16:05,2023-07-08,2023-09-22,62.0
438,4576,3686,2023-09-12,1,159583,24.0,0,11817.0,17,10/09/23 11:22:10,2023-07-10,2023-09-18,64.0
439,4577,3682,2023-09-15,0,668167,30.0,0,66773.0,17,09/25/23 20:20:53,2023-07-06,2023-09-15,71.0
440,4578,3687,2023-09-16,0,455567,30.0,0,46986.0,17,09/25/23 20:21:46,2023-07-10,2023-09-16,68.0
441,4579,3686,2023-09-18,0,507900,23.290001,0,34839.0,17,09/25/23 20:24:21,2023-07-10,2023-09-18,70.0
442,4580,3684,2023-09-19,0,581321,28.0,0,57177.0,17,09/25/23 20:26:34,2023-07-07,2023-09-19,74.0
443,4581,3683,2023-09-21,0,591956,29.34,0,59565.0,17,09/25/23 20:27:42,2023-07-06,2023-09-21,77.0
444,4582,3685,2023-09-22,0,515130,31.459999,0,55582.0,17,09/25/23 20:28:24,2023-07-08,2023-09-22,76.0
445,4583,3703,2023-09-23,0,463158,0.56999999,0,0.0,17,09/27/23 10:03:40,2023-09-01,2023-09-23,22.0
446,4584,3704,2023-09-23,0,548214,0.56,0,0.0,17,09/27/23 10:05:46,2023-09-01,2023-09-23,22.0
447,4585,3702,2023-09-24,0,1623134,1.34,0,0.0,17,09/27/23 10:16:04,2023-08-30,2023-09-24,25.0
448,4586,3706,2023-09-26,0,418182,0.76999998,0,0.0,17,09/27/23 10:19:45,2023-09-01,2023-09-26,25.0
449,4587,3705,2023-09-26,0,479221,0.76999998,0,0.0,17,09/27/23 10:23:21,2023-09-01,2023-09-26,25.0
450,4588,3708,2023-09-26,0,2004301,0.93000001,0,0.0,17,09/27/23 10:27:43,2023-09-04,2023-09-26,22.0
451,5959,4704,2021-01-03,0,1694000,0.56,0,0.0,16,01/05/21 10:29:14,,,
452,5960,4708,2021-01-05,0,848000,0.2,0,0.0,16,01/05/21 10:29:42,,,
453,5961,4654,2021-01-06,0,763807,18.65,0,43782.0,16,04/23/21 16:38:35,,,
454,5962,4681,2021-01-04,1,282058,15.18,0,11202.0,16,04/23/21 16:39:41,,,
455,5963,4709,2021-01-06,0,3764000,0.25,0,0.0,16,01/12/21 16:42:43,,,
456,5964,4670,2021-01-10,0,791977,21.219999,0,55735.0,16,04/23/21 16:42:46,,,
457,5965,4672,2021-01-11,0,822064,24.790001,0,70102.0,16,04/23/21 16:45:25,,,
458,5966,4692,2021-01-12,0,14555,16.969999,0,731.0,16,04/23/21 16:43:22,,,
459,5967,4693,2021-01-12,0,49685,19.059999,0,2883.0,16,04/23/21 16:43:57,,,
460,5968,4694,2021-01-05,1,145178,17.110001,0,6787.0,16,04/23/21 16:40:54,,,
461,5969,4697,2021-01-05,1,196387,15.5,0,8169.0,16,04/23/21 16:40:17,,,
462,5970,4688,2021-01-06,1,136314,20.129999,0,8044.0,16,04/23/21 16:41:28,,,
463,5971,4665,2021-01-07,1,85368,25.059999,0,6840.0,16,04/23/21 16:41:54,,,
464,5972,4687,2021-01-07,1,258229,17.57,0,13069.0,16,04/23/21 16:42:22,,,
465,5973,4689,2021-01-11,1,235491,17.0,0,11238.0,16,04/23/21 16:44:21,,,
466,5974,4664,2021-01-12,0,815082,20.09,0,52566.0,16,04/23/21 16:44:52,,,
467,5975,4671,2021-01-17,0,1113285,20.549999,0,74738.0,16,04/23/21 16:46:58,,,
468,5976,4707,2021-01-12,0,1603000,0.95999998,0,0.0,16,01/20/21 10:27:32,,,
469,5977,4678,2021-01-14,0,441171,20.5,0,29072.0,16,04/23/21 16:46:16,,,
470,5978,4726,2021-01-26,0,1230000,0.31999999,0,0.0,16,01/29/21 12:42:04,2021-01-09,2021-01-26,17.0
471,5979,4730,2021-01-27,0,763000,0.27000001,0,0.0,16,01/29/21 12:42:52,2021-01-11,2021-01-27,16.0
472,5980,4727,2021-01-27,0,1870000,0.40000001,0,0.0,16,01/29/21 12:43:26,2021-01-09,2021-01-27,18.0
473,5981,4725,2021-01-28,0,1510000,0.47,0,0.0,16,01/29/21 12:44:19,2021-01-09,2021-01-28,19.0
474,5982,4729,2021-01-29,0,1276000,0.43000001,0,0.0,16,01/29/21 12:44:53,2021-01-10,2021-01-29,19.0
475,5983,4682,2021-01-29,0,945000,24.6,0,83440.0,16,04/23/21 16:48:36,,,
476,5984,4679,2021-01-30,0,747096,21.870001,0,55259.0,16,04/23/21 16:47:41,,,
477,5985,4681,2021-01-31,0,1019180,20.49,0,73640.0,16,04/23/21 16:49:32,,,
478,5986,4683,2021-02-01,0,1387789,22.93,0,11739.0,16,04/23/21 16:50:41,,,
479,5987,4695,2021-02-09,0,541118,23.98,0,45951.0,16,04/23/21 16:51:34,,,
480,5988,4728,2021-02-02,0,3055000,1.13,0,0.0,16,02/13/21 07:27:38,2021-01-10,2021-02-02,23.0
481,5989,4733,2021-02-09,0,1349000,0.27000001,0,0.0,16,02/13/21 15:33:17,2021-01-25,2021-02-09,15.0
482,5990,4732,2021-02-11,0,1289000,0.38,0,0.0,16,02/13/21 15:38:14,2021-01-25,2021-02-11,17.0
483,5991,4734,2021-02-12,0,715000,0.36000001,0,0.0,16,02/13/21 15:40:32,2021-01-25,2021-02-12,18.0
484,5992,4735,2021-02-12,0,993000,0.38,0,0.0,16,02/13/21 15:41:15,2021-01-25,2021-02-12,18.0
485,5993,4665,2021-02-13,0,514320,33.380001,0,83413.0,16,04/23/21 16:52:11,,,
486,5994,4688,2021-02-13,1,187686,27.610001,0,20516.0,16,04/23/21 16:52:49,,,
487,5995,4689,2021-02-15,0,666101,24.16,0,60214.0,16,04/23/21 16:53:27,,,
488,5996,4690,2021-02-16,0,560529,24.93,0,52644.0,16,04/23/21 16:53:54,,,
489,5997,4691,2021-02-17,0,485150,26.33,0,48977.0,16,04/23/21 16:54:28,,,
490,5998,4687,2021-02-18,1,143058,27.799999,0,16151.0,16,04/23/21 16:55:01,,,
491,5999,4698,2021-02-19,1,145838,26.309999,0,15016.0,16,04/23/21 16:55:31,,,
492,6000,4694,2021-02-19,1,91293,27.91,0,10412.0,16,04/23/21 16:56:36,,,
493,6001,4697,2021-02-20,1,79687,27.469999,0,8562.0,16,04/23/21 16:56:03,,,
494,6002,4751,2021-02-17,0,1236000,0.1,0,0.0,16,02/22/21 14:28:39,2021-02-06,2021-02-17,11.0
495,6003,4752,2021-02-17,0,1125000,0.11,0,0.0,16,02/22/21 14:31:58,2021-02-12,2021-02-17,5.0
496,6004,4741,2021-02-19,1,1299927,0.55000001,0,0.0,16,03/02/21 00:28:47,2021-01-30,2021-03-24,20.0
497,6005,4721,2021-02-22,1,297414,15.08,0,13601.0,16,04/23/21 16:57:01,,,
498,6006,4719,2021-02-22,1,232795,16.1,0,11681.0,16,04/23/21 16:57:23,,,
499,6007,4747,2021-02-23,1,678000,0.23999999,0,0.0,16,03/02/21 00:29:44,2021-02-10,2021-03-25,13.0
500,6008,4750,2021-02-24,0,1178000,0.60500002,0,0.0,16,03/02/21 00:33:08,2021-02-06,2021-02-24,18.0
501,6009,4712,2021-02-26,1,111663,16.120001,0,5934.0,16,04/23/21 16:57:51,,,
502,6010,4714,2021-02-26,1,173249,14.99,0,7994.0,16,04/23/21 16:58:22,,,
503,6011,4713,2021-02-28,1,69930,15.63,0,3434.0,16,04/23/21 16:59:31,,,
504,6012,4718,2021-02-28,1,210922,15.84,0,10857.0,16,04/23/21 16:58:50,,,
505,6013,4722,2021-03-02,1,301656,16.91,0,17289.0,16,04/23/21 17:00:43,2021-01-03,2021-03-29,58.0
506,6014,4720,2021-03-01,1,404457,15.93,0,20653.0,16,04/23/21 17:00:09,,,
507,6015,4694,2021-03-02,0,760639,29.75,0,100968.0,16,04/23/21 17:01:18,,,
508,6016,4723,2021-03-03,1,164503,14.79,0,7316.0,16,04/23/21 17:03:10,2021-01-05,2021-04-09,57.0
509,6017,4724,2021-03-10,1,654828,14.5,0,27945.0,16,04/23/21 17:02:02,2021-01-05,2021-04-13,64.0
510,6018,4731,2021-03-13,1,242790,19.139999,0,16217.0,16,04/23/21 17:04:02,2021-01-12,2021-04-21,60.0
511,6019,4713,2021-03-14,1,77856,19.959999,0,5724.0,16,04/23/21 17:05:13,,,
512,6020,4687,2021-03-14,0,781332,31.98,0,121691.0,16,04/23/21 17:03:38,,,
513,6021,4753,2021-03-09,1,824000,1.51,0,0.0,16,03/14/21 22:07:37,2021-02-06,2021-03-23,31.0
514,6022,4697,2021-03-15,0,662968,32.349998,0,102980.0,16,04/23/21 17:05:47,,,
515,6023,4721,2021-03-15,1,184633,21.67,0,15452.0,16,04/23/21 17:06:38,,,
516,6024,4699,2021-03-16,0,566418,30.790001,0,79368.0,16,04/23/21 17:04:40,,,
517,6025,4688,2021-03-17,0,436568,35.959999,0,84447.0,16,04/23/21 17:08:14,,,
518,6026,4698,2021-03-18,0,516187,31.26,0,76416.0,16,04/23/21 17:10:07,,,
519,6027,4710,2021-03-18,0,23956,33.060001,0,3787.0,16,04/23/21 17:09:07,,,
520,6028,4720,2021-03-17,1,201793,21.75,0,17179.0,16,04/23/21 17:07:42,,,
521,6029,4719,2021-03-18,1,264989,22.65,0,23709.0,16,04/23/21 17:08:40,,,
522,6030,4754,2021-03-19,0,850148,3.3699999,0,0.0,16,03/24/21 12:44:03,2021-02-17,2021-03-19,30.0
523,6031,4753,2021-03-23,0,797051,3.73,0,0.0,16,03/24/21 12:46:46,2021-02-06,2021-03-23,45.0
524,6032,4741,2021-03-24,0,483947,6.79,0,0.0,16,03/24/21 12:51:11,2021-01-30,2021-03-24,53.0
525,6033,4718,2021-03-17,1,98095,21.52,0,7845.11,16,04/23/21 17:07:11,,,
526,6034,4736,2021-03-19,1,167932,16.59,0,9323.0,16,04/23/21 17:09:31,2021-01-26,2021-04-23,52.0
527,6035,4739,2021-03-24,1,251308,16.82,0,14333.0,16,04/23/21 17:10:35,2021-01-28,2021-04-22,55.0
528,6036,4724,2021-03-25,1,156917,22.120001,0,13405.0,16,04/23/21 17:11:19,2021-01-05,2021-04-13,79.0
529,6037,4742,2021-03-27,1,458649,18.209999,0,30525.0,16,04/23/21 17:11:45,2021-02-02,2021-04-26,53.0
530,6038,4738,2021-03-28,1,439762,15.14,0,20858.0,16,04/23/21 17:26:24,2021-01-27,2021-05-09,60.0
531,6039,4743,2021-03-29,1,278575,19.23,0,20446.0,16,04/23/21 17:27:01,2021-02-02,2021-05-01,55.0
532,6040,4747,2021-03-25,0,221885,3.49,0,0.0,16,03/29/21 18:02:36,2021-02-10,2021-03-25,43.0
533,6041,4758,2021-03-25,0,341000,3.4300001,0,0.0,16,03/29/21 18:04:24,2021-02-23,2021-03-25,30.0
534,6042,4722,2021-03-29,0,939264,25.799999,0,104194.0,16,04/23/21 17:27:31,2021-01-03,2021-03-29,85.0
535,6043,4757,2021-03-26,0,1267000,1.96,0,0.0,16,03/30/21 13:42:12,2021-02-27,2021-03-26,27.0
536,6044,4713,2021-03-31,0,284618,25.42,0,30388.0,16,04/23/21 17:28:11,,,
537,6045,4711,2021-04-01,0,391751,27.98,0,48202.0,16,04/06/21 13:50:45,,,
538,6046,4715,2021-04-01,0,44507,26.49,0,5047.0,16,04/23/21 17:29:58,,,
539,6047,4716,2021-04-01,0,36683,29.059999,0,4956.71,16,04/23/21 17:29:27,,,
540,6048,4720,2021-04-03,0,861678,25.860001,0,96404.0,16,04/23/21 17:31:27,,,
541,6049,4721,2021-04-03,1,120419,27.67,0,15088.0,16,04/23/21 17:31:49,,,
542,6050,4737,2021-04-02,1,78530,18.91,0,5551.0,16,04/23/21 17:30:36,2021-01-27,2021-04-30,65.0
543,6051,4717,2021-04-02,0,37065,27.33,0,4366.0,16,04/23/21 17:31:01,,,
544,6052,4712,2021-04-05,0,228386,25.469999,0,25176.0,16,04/23/21 17:32:41,,,
545,6053,4740,2021-04-06,1,299760,20.799999,0,24861.0,16,04/23/21 17:35:09,2021-01-29,2021-04-25,67.0
546,6054,4714,2021-04-08,0,413451,28.25,0,52666.0,16,04/23/21 17:34:22,,,
547,6055,4723,2021-04-09,0,365419,25.389999,0,40845.0,16,04/23/21 17:35:50,2021-01-05,2021-04-09,94.0
548,6056,4749,2021-04-07,1,303498,18.58,0,19897.0,16,04/23/21 17:33:45,2021-02-12,2021-05-04,54.0
549,6057,4736,2021-04-07,1,146286,22.620001,0,13122.0,16,04/23/21 17:34:51,2021-01-26,2021-04-23,71.0
550,6058,4724,2021-04-13,0,1491798,26.09,0,176085.0,16,04/23/21 17:38:41,2021-01-05,2021-04-13,98.0
551,6059,4719,2021-04-14,0,1179725,27.620001,0,148893.0,16,04/23/21 17:36:56,,,
552,6060,4718,2021-04-14,0,652000,27.25,0,82407.0,16,04/23/21 17:39:05,,,
553,6061,4721,2021-04-13,0,688257,27.08,0,83765.0,16,04/23/21 17:41:50,,,
554,6062,4744,2021-04-11,1,223256,15.91,0,12300.0,16,04/23/21 17:39:49,2021-02-10,2021-05-05,60.0
555,6063,4748,2021-04-13,1,232472,17.799999,0,15163.0,16,04/23/21 17:40:12,2021-02-11,2021-05-08,61.0
556,6064,4759,2021-04-15,1,208909,14.03,0,8681.0,16,04/23/21 17:42:12,2021-02-24,2021-06-07,50.0
557,6065,4742,2021-04-15,1,203786,23.51,0,21033.0,16,04/23/21 17:41:10,2021-02-02,2021-04-26,72.0
558,6066,4743,2021-04-16,1,102444,26.6,0,12126.0,16,04/25/21 16:08:18,2021-02-02,2021-05-01,73.0
559,6067,4771,2021-04-14,0,555000,0.36000001,0,0.0,16,04/20/21 18:51:59,2021-03-29,2021-04-14,16.0
560,6068,4772,2021-04-14,0,932000,0.37,0,0.0,16,04/20/21 19:04:54,2021-03-29,2021-04-14,16.0
561,6069,4769,2021-04-15,0,1769000,0.60000002,0,0.0,16,04/20/21 19:05:55,2021-03-29,2021-04-15,17.0
562,6070,4773,2021-04-15,0,648000,0.56999999,0,0.0,16,04/20/21 19:07:33,2021-03-29,2021-04-15,17.0
563,6071,4768,2021-04-16,0,265000,0.67000002,0,0.0,16,04/20/21 19:11:55,2021-03-29,2021-04-16,18.0
564,6072,4770,2021-04-16,0,1469000,0.66000003,0,0.0,16,04/20/21 19:25:40,2021-03-29,2021-04-16,18.0
565,6073,4777,2021-04-20,0,334000,0.30000001,0,0.0,16,04/20/21 19:28:02,2021-04-07,2021-04-20,13.0
566,6074,4767,2021-04-18,0,2944000,0.80000001,0,0.0,16,04/20/21 22:38:33,2021-03-29,2021-04-18,20.0
567,6075,4774,2021-04-21,0,3337000,0.34999999,0,0.0,16,04/25/21 15:55:50,2021-04-07,2021-04-21,14.0
568,6076,4791,2021-04-22,0,3383000,0.079999998,0,0.0,16,04/25/21 15:56:32,2021-04-13,2021-04-22,9.0
569,6077,4779,2021-04-23,0,1410000,0.34,0,0.0,16,04/25/21 15:57:25,2021-04-08,2021-04-23,15.0
570,6078,4731,2021-04-21,0,880222,29.9,0,120371.0,16,04/27/21 14:12:21,2021-01-12,2021-04-21,99.0
571,6079,4739,2021-04-22,0,808598,24.5,0,83126.0,16,04/27/21 14:25:20,2021-01-28,2021-04-22,84.0
572,6080,4736,2021-04-23,0,446963,29.200001,0,56591.0,16,04/27/21 14:45:39,2021-01-26,2021-04-23,87.0
573,6081,4740,2021-04-25,0,598080,26.040001,0,70683.0,16,05/05/21 13:37:23,2021-01-29,2021-04-25,86.0
574,6082,4742,2021-04-26,0,859978,26.709999,0,103210.0,16,05/05/21 13:38:36,2021-02-02,2021-04-26,83.0
575,6083,4738,2021-04-24,1,246682,22.49,0,23970.0,16,04/27/21 14:49:31,2021-01-27,2021-05-09,87.0
576,6084,4756,2021-04-24,1,152061,20.629999,0,12849.0,16,04/27/21 15:03:08,2021-02-19,2021-05-18,64.0
577,6085,4755,2021-04-27,1,148854,22.700001,0,14289.0,16,05/05/21 13:39:56,2021-02-19,2021-05-17,67.0
578,6086,4737,2021-04-30,0,390536,28.540001,0,49776.0,16,05/05/21 13:41:19,2021-01-27,2021-04-30,93.0
579,6087,4743,2021-05-01,0,542160,28.540001,0,73478.0,16,05/05/21 13:42:07,2021-02-02,2021-05-01,88.0
580,6088,4749,2021-05-04,0,1016251,27.690001,0,131411.0,16,05/14/21 14:28:38,2021-02-12,2021-05-04,81.0
581,6089,4778,2021-04-28,0,1218000,0.83999997,0,0.0,16,05/06/21 10:41:38,2021-04-08,2021-04-28,20.0
582,6090,4775,2021-04-29,0,782000,0.94999999,0,0.0,16,05/06/21 10:46:39,2021-04-07,2021-04-29,22.0
583,6091,4776,2021-04-29,0,424000,0.95999998,0,0.0,16,05/06/21 10:47:09,2021-04-07,2021-04-29,22.0
584,6092,4764,2021-05-06,1,145019,24.6,0,16331.0,16,06/07/21 15:34:01,2021-03-24,2021-06-03,43.0
585,6093,4793,2021-05-07,0,1554000,0.92000002,0,0.0,16,05/09/21 19:44:30,2021-04-22,2021-05-07,15.0
586,6094,4797,2021-05-08,0,1518000,0.1,0,0.0,16,05/09/21 19:48:08,2021-04-26,2021-05-08,12.0
587,6095,4744,2021-05-05,0,595077,22.799999,0,56323.0,16,05/14/21 14:29:40,2021-02-10,2021-05-05,84.0
588,6096,4748,2021-05-08,0,725122,28.620001,0,93183.0,16,05/14/21 14:34:07,2021-02-11,2021-05-08,86.0
589,6097,4738,2021-05-09,0,877989,26.690001,0,109077.0,16,05/14/21 14:35:57,2021-01-27,2021-05-09,102.0
590,6098,4761,2021-05-07,1,184558,23.030001,0,17445.0,16,05/14/21 14:38:11,2021-03-09,2021-05-27,59.0
591,6099,4762,2021-05-07,1,141815,23.879999,0,15123.0,16,05/14/21 14:38:44,2021-03-19,2021-05-26,49.0
592,6100,4763,2021-05-08,1,149039,23.67,0,16018.0,16,05/14/21 14:39:18,2021-03-23,2021-05-28,46.0
593,6101,4798,2021-05-11,0,807000,0.28999999,0,0.0,16,05/14/21 13:51:27,2021-04-26,2021-05-11,15.0
594,6102,4804,2021-05-12,0,1725000,0.090000004,0,0.0,16,05/14/21 13:53:14,2021-04-30,2021-05-12,12.0
595,6103,4800,2021-05-13,0,536000,0.30000001,0,0.0,16,05/14/21 13:54:55,2021-04-26,2021-05-13,17.0
596,6104,4799,2021-05-13,0,536000,0.30000001,0,0.0,16,05/14/21 14:10:47,2021-04-26,2021-05-13,17.0
597,6105,4760,2021-05-12,1,80574,24.77,0,9355.0,16,05/26/21 10:11:01,2021-02-24,2021-06-07,77.0
598,6106,4746,2021-05-13,0,144487,26.120001,0,18408.0,16,05/26/21 10:03:04,2021-02-10,2021-05-13,92.0
599,6107,4755,2021-05-17,0,582733,27.07,0,75728.0,16,05/26/21 10:07:05,2021-02-19,2021-05-17,87.0
600,6108,4756,2021-05-18,0,524290,27.0,0,68823.0,16,05/26/21 10:08:34,2021-02-19,2021-05-18,88.0
601,6109,4745,2021-05-17,0,153976,24.0,0,17105.0,16,05/26/21 10:03:34,2021-02-10,2021-05-17,96.0
602,6110,4807,2021-05-15,0,488000,0.13,0,0.0,16,05/18/21 13:40:29,2021-05-01,2021-05-15,14.0
603,6111,4806,2021-05-17,0,1840000,0.19,0,0.0,16,05/18/21 13:45:43,2021-05-01,2021-05-17,16.0
604,6112,4810,2021-05-18,0,1368000,0.64999998,0,0.0,16,05/18/21 13:48:58,2021-05-08,2021-05-18,10.0
605,6113,4765,2021-05-14,1,150183,24.030001,0,16866.0,16,05/26/21 10:11:23,2021-03-25,2021-06-04,50.0
606,6114,4805,2021-05-19,0,648000,0.40000001,0,0.0,16,05/24/21 15:30:28,2021-04-30,2021-05-19,19.0
607,6115,4803,2021-05-20,0,1718000,0.46000001,0,0.0,16,05/24/21 15:33:04,2021-04-30,2021-05-20,20.0
608,6116,4813,2021-05-21,0,1324000,0.23,0,0.0,16,05/24/21 15:35:41,2021-05-06,2021-05-21,15.0
609,6117,4811,2021-05-21,0,1247000,0.20999999,0,0.0,16,05/24/21 15:38:36,2021-05-06,2021-05-21,15.0
610,6118,4812,2021-05-22,0,1711000,0.2,0,0.0,16,05/24/21 15:41:53,2021-05-06,2021-05-22,16.0
611,6119,4816,2021-05-23,0,1593000,0.55000001,0,0.0,16,05/24/21 15:50:00,2021-05-12,2021-05-23,11.0
612,6120,4766,2021-05-23,1,225668,22.9,0,23150.0,16,05/31/21 16:27:33,2021-03-26,2021-06-02,58.0
613,6121,4762,2021-05-26,0,536425,28.780001,0,75522.0,16,05/31/21 16:17:20,2021-03-19,2021-05-26,68.0
614,6122,4819,2021-05-25,0,449000,0.64999998,0,0.0,16,05/31/21 15:49:15,2021-05-15,2021-05-25,10.0
615,6123,4814,2021-05-26,0,1051000,0.14,0,0.0,16,05/31/21 15:55:39,2021-05-12,2021-05-26,14.0
616,6124,4820,2021-05-27,0,1089000,0.72000003,0,0.0,16,05/31/21 15:57:05,2021-05-17,2021-05-27,10.0
617,6125,4761,2021-05-27,0,488628,27.91,0,67499.0,16,06/07/21 15:04:40,2021-03-09,2021-05-27,79.0
618,6126,4763,2021-05-28,0,468402,29.0,0,68979.0,16,06/07/21 15:06:17,2021-03-23,2021-05-28,66.0
619,6127,4766,2021-06-02,0,831829,24.92,0,101899.0,16,11/03/21 11:50:49,2021-03-26,2021-06-02,68.0
620,6128,4764,2021-06-03,0,251215,26.790001,0,33673.0,16,11/03/21 11:51:56,2021-03-24,2021-06-03,71.0
621,6129,4765,2021-06-04,0,682495,27.42,0,95030.0,16,11/03/21 11:52:44,2021-03-25,2021-06-04,71.0
622,6130,4759,2021-06-07,0,431756,24.940001,0,53673.0,16,11/03/21 11:54:49,2021-02-24,2021-06-07,103.0
623,6131,4760,2021-06-07,0,287704,27.0,0,37549.0,16,11/05/21 08:17:33,2021-02-24,2021-06-07,103.0
624,6132,4783,2021-06-05,1,182007,14.95,0,9858.0,16,11/03/21 11:54:00,2021-04-14,2021-07-06,52.0
625,6133,4780,2021-06-05,1,111246,13.16,0,4117.0,16,11/03/21 11:53:25,2021-04-14,2021-07-02,52.0
626,6134,4781,2021-06-07,1,96356,14.27,0,4325.0,16,11/03/21 11:59:13,2021-04-14,2021-07-08,54.0
627,6135,4825,2021-06-02,0,1342000,0.67000002,0,0.0,16,06/07/21 18:36:59,2021-05-21,2021-06-02,12.0
628,6136,4824,2021-06-04,0,1553000,1.15,0,0.0,16,06/07/21 18:40:29,2021-05-21,2021-06-04,14.0
629,6137,4808,2021-06-03,0,743000,7.6999998,0,0.0,16,06/07/21 19:24:52,2021-05-07,2021-06-03,27.0
630,6138,4784,2021-06-07,1,639301,13.74,0,31481.0,16,11/03/21 12:00:18,2021-04-15,2021-07-24,53.0
631,6139,4782,2021-06-07,1,146270,13.94,0,7254.0,16,11/03/21 11:59:38,2021-04-14,2021-07-07,54.0
632,6140,4792,2021-06-10,1,801898,14.75,0,44260.0,16,11/03/21 12:00:45,2021-04-18,2021-07-29,53.0
633,6141,4833,2021-06-09,0,777000,1.05,0,0.0,16,06/15/21 15:32:10,2021-05-26,2021-06-09,14.0
634,6142,4828,2021-06-10,0,950000,0.2,0,0.0,16,06/15/21 15:28:59,2021-05-23,2021-06-10,18.0
635,6143,4830,2021-06-15,0,1570000,0.28999999,0,0.0,16,06/15/21 15:34:45,2021-05-24,2021-06-15,22.0
636,6144,4829,2021-06-15,0,1305000,0.38999999,0,0.0,16,06/15/21 15:39:29,2021-05-23,2021-06-15,23.0
637,6145,4795,2021-06-10,1,175305,13.12,0,7851.0,16,11/03/21 12:01:07,2021-04-21,2021-07-22,50.0
638,6146,4789,2021-06-11,1,351969,12.95,0,15289.0,16,11/03/21 12:03:04,2021-04-16,2021-07-28,56.0
639,6147,4827,2021-06-16,0,1384000,0.66000003,0,0.0,16,06/23/21 09:15:02,2021-05-23,2021-06-16,24.0
640,6148,4796,2021-06-17,1,340208,14.45,0,18024.0,16,11/03/21 12:03:27,2021-04-21,2021-07-23,57.0
641,6149,4790,2021-06-22,1,227327,15.15,0,13141.0,16,11/03/21 12:03:49,2021-04-20,2021-07-22,63.0
642,6150,4802,2021-06-23,1,377427,16.74,0,29390.0,16,11/03/21 12:04:31,2021-04-29,2021-07-11,55.0
643,6151,4801,2021-06-24,1,305556,16.74,0,22158.0,16,11/03/21 12:05:02,2021-04-28,2021-07-24,57.0
644,6152,4809,2021-06-25,1,336545,17.02,0,25350.0,16,11/03/21 12:28:36,2021-05-07,2021-08-05,49.0
645,6153,4842,2021-06-25,0,1632000,0.1,0,0.0,16,06/28/21 14:19:21,2021-06-12,2021-06-25,13.0
646,6154,4840,2021-07-02,0,956000,0.41999999,0,0.0,16,07/07/21 10:24:57,2021-06-10,2021-07-02,22.0
647,6155,4780,2021-07-02,0,496067,19.07,0,41857.0,16,11/03/21 12:29:51,2021-04-14,2021-07-02,79.0
648,6156,4783,2021-07-06,0,426122,22.190001,0,47459.0,16,07/21/21 17:00:23,2021-04-14,2021-07-06,83.0
649,6157,4782,2021-07-07,0,372580,20.610001,0,34626.0,16,07/21/21 17:01:53,2021-04-14,2021-07-07,84.0
650,6158,4786,2021-07-07,0,54449,19.459999,0,4311.0,16,07/21/21 17:03:42,2021-04-16,2021-07-07,82.0
651,6159,4787,2021-07-07,0,51406,21.73,0,5225.0,16,07/21/21 17:03:00,2021-04-16,2021-07-07,82.0
652,6160,4794,2021-06-30,1,393414,17.459999,0,31525.0,16,11/03/21 12:28:57,2021-04-23,2021-08-05,68.0
653,6161,4792,2021-07-01,1,359787,20.639999,0,36471.0,16,11/03/21 12:29:18,2021-04-18,2021-07-29,74.0
654,6162,4789,2021-07-07,1,253429,18.809999,0,22453.0,16,11/03/21 12:29:35,2021-04-16,2021-07-28,82.0
655,6163,4857,2021-07-08,0,871000,0.25999999,0,0.0,16,07/12/21 18:38:14,2021-06-22,2021-07-08,16.0
656,6164,4858,2021-07-12,0,753000,0.30000001,0,0.0,16,07/12/21 18:39:20,2021-06-22,2021-07-12,20.0
657,6165,4781,2021-07-08,0,338666,21.08,0,33513.0,16,07/21/21 17:04:22,2021-04-14,2021-07-08,85.0
658,6166,4788,2021-07-09,0,55679,19.52,0,4544.0,16,07/21/21 17:05:52,2021-04-16,2021-07-09,84.0
659,6167,4785,2021-07-09,0,43838,22.190001,0,4341.0,16,07/21/21 17:06:26,2021-04-16,2021-07-09,84.0
660,6168,4802,2021-07-11,0,886465,21.440001,0,86155.0,16,07/21/21 17:07:39,2021-04-29,2021-07-11,73.0
661,6169,4796,2021-07-08,1,332331,19.540001,0,29343.0,16,07/21/21 17:04:53,2021-04-21,2021-07-23,78.0
662,6170,4795,2021-07-09,1,161411,19.940001,0,14683.0,16,07/21/21 17:05:20,2021-04-21,2021-07-22,79.0
663,6171,4790,2021-07-11,1,107222,20.620001,0,9886.0,16,07/21/21 17:07:02,2021-04-20,2021-07-22,82.0
664,6172,4821,2021-07-12,1,226109,15.16,0,12695.0,16,07/21/21 17:08:53,2021-05-18,2021-08-18,55.0
665,6173,4815,2021-07-12,1,224202,14.54,0,11177.0,16,07/21/21 17:09:57,2021-05-11,2021-08-08,62.0
666,6174,4853,2021-07-20,0,1135000,0.090000004,0,0.0,16,07/21/21 13:12:26,2021-07-05,2021-07-20,15.0
667,6175,4847,2021-07-15,0,731000,0.85000002,0,0.0,16,07/21/21 16:32:20,2021-06-25,2021-07-15,20.0
668,6176,4848,2021-07-16,0,560000,0.81999999,0,0.0,16,07/21/21 16:36:20,2021-06-26,2021-07-16,20.0
669,6177,4855,2021-07-21,0,880000,0.55000001,0,0.0,16,07/21/21 16:56:05,2021-06-23,2021-07-21,28.0
670,6178,4818,2021-07-20,1,122714,17.610001,0,9245.0,16,08/02/21 15:55:09,2021-05-13,2021-08-07,68.0
671,6179,4826,2021-07-20,1,419903,13.96,0,20321.0,16,08/02/21 15:54:56,2021-05-23,2021-09-03,58.0
672,6180,4823,2021-07-21,1,379393,15.94,0,23416.0,16,08/02/21 15:55:32,2021-05-20,2021-09-04,62.0
673,6181,4817,2021-07-21,1,186429,16.77,0,12195.0,16,08/02/21 15:56:00,2021-05-13,2021-08-24,69.0
674,6182,4850,2021-07-22,0,949000,0.50999999,0,0.0,16,07/25/21 10:33:30,2021-06-27,2021-07-22,25.0
675,6183,4851,2021-07-22,0,790000,0.50999999,0,0.0,16,07/25/21 10:35:58,2021-06-27,2021-07-22,25.0
676,6184,4795,2021-07-22,0,656487,21.870001,0,66490.0,16,08/02/21 14:40:35,2021-04-21,2021-07-22,92.0
677,6185,4790,2021-07-22,0,433143,21.129999,0,43065.0,16,08/02/21 14:42:50,2021-04-20,2021-07-22,93.0
678,6186,4796,2021-07-23,0,1427114,22.799999,0,159687.0,16,08/02/21 14:50:54,2021-04-21,2021-07-23,93.0
679,6187,4784,2021-07-24,0,1290595,23.34,0,145802.0,16,08/02/21 14:53:30,2021-04-15,2021-07-24,100.0
680,6188,4801,2021-07-24,0,855651,25.530001,0,111792.0,16,08/02/21 15:22:26,2021-04-28,2021-07-24,87.0
681,6189,4821,2021-07-23,1,255053,16.34,0,17658.0,16,08/02/21 15:56:28,2021-05-18,2021-08-18,66.0
682,6190,4837,2021-07-24,1,294069,16.889999,0,20714.0,16,08/02/21 15:56:50,2021-06-04,2021-08-23,50.0
683,6191,4822,2021-07-26,1,154046,17.82,0,11867.0,16,08/02/21 15:57:10,2021-05-19,2021-08-17,68.0
684,6192,4789,2021-07-28,0,1192468,24.030001,0,144396.0,16,08/03/21 09:51:33,2021-04-16,2021-07-28,103.0
685,6193,4792,2021-07-29,0,1337398,26.98,0,195338.0,16,08/03/21 09:50:58,2021-04-18,2021-07-29,102.0
686,6194,4854,2021-07-28,0,2970000,1.0700001,0,0.0,16,08/03/21 09:59:48,2021-06-23,2021-07-28,35.0
687,6195,4856,2021-08-03,0,1372000,1.45,0,0.0,16,08/03/21 10:05:29,2021-06-23,2021-08-03,41.0
688,6196,4852,2021-07-30,0,1133044,0.44999999,0,0.0,16,08/03/21 10:10:02,2021-07-05,2021-07-30,25.0
689,6197,4859,2021-08-02,0,1062000,2.73,0,0.0,16,08/03/21 10:12:24,2021-07-06,2021-08-02,27.0
690,6198,4841,2021-08-03,0,2248000,3.02,0,0.0,16,08/03/21 15:11:48,2021-06-12,2021-08-03,52.0
691,6199,4809,2021-08-05,0,827172,26.42,0,114779.0,16,08/11/21 14:01:25,2021-05-07,2021-08-05,90.0
692,6200,4794,2021-08-05,0,653021,27.67,0,96557.0,16,08/11/21 14:03:05,2021-04-23,2021-08-05,104.0
693,6201,4818,2021-08-07,0,361978,22.59,0,38884.0,16,08/11/21 14:05:14,2021-05-13,2021-08-07,86.0
694,6202,4815,2021-08-08,0,653043,22.51,0,72031.0,16,08/11/21 14:08:42,2021-05-11,2021-08-08,89.0
695,6203,4826,2021-08-06,1,257399,21.74,0,25678.0,16,08/16/21 10:58:42,2021-05-23,2021-09-03,75.0
696,6204,4817,2021-08-06,1,182655,22.379999,0,19626.0,16,08/11/21 14:11:48,2021-05-13,2021-08-24,85.0
697,6205,4836,2021-08-07,1,310800,21.799999,0,31807.0,16,08/16/21 10:59:23,2021-06-02,2021-08-25,66.0
698,6206,4837,2021-08-07,1,216822,21.08,0,21385.0,16,08/16/21 10:59:55,2021-06-04,2021-08-23,64.0
699,6207,4871,2021-08-04,0,769000,0.11,0,0.0,16,08/16/21 11:01:33,2021-07-22,2021-08-04,13.0
700,6208,4872,2021-08-04,0,581000,0.12,0,0.0,16,08/16/21 11:02:44,2021-07-22,2021-08-04,13.0
701,6209,4873,2021-08-05,0,1200000,0.11,0,0.0,16,08/16/21 11:06:15,2021-07-23,2021-08-05,13.0
702,6210,4860,2021-08-06,0,1183000,0.60000002,0,0.0,16,08/16/21 11:08:09,2021-07-08,2021-08-06,29.0
703,6211,4868,2021-08-06,0,1278000,0.090000004,0,0.0,16,08/16/21 11:10:10,2021-07-22,2021-08-06,15.0
704,6212,4869,2021-08-06,0,617000,0.1,0,0.0,16,08/16/21 11:12:10,2021-07-22,2021-08-06,15.0
705,6213,4875,2021-08-08,0,1077000,0.18000001,0,0.0,16,08/16/21 11:15:25,2021-07-24,2021-08-08,15.0
706,6214,4864,2021-08-13,0,420000,1.3200001,0,0.0,16,08/16/21 11:17:27,2021-07-20,2021-08-13,24.0
707,6215,4865,2021-08-10,0,1000,1.0,0,0.0,16,08/16/21 14:49:49,2021-07-20,2021-08-10,21.0
708,6216,4886,2021-08-18,0,1260000,0.69999999,0,0.0,16,08/24/21 11:11:47,2021-08-06,2021-08-18,12.0
709,6217,4874,2021-08-19,0,1136000,0.54000002,0,0.0,16,08/24/21 11:13:16,2021-07-23,2021-08-19,27.0
710,6218,4870,2021-08-24,0,777000,0.43000001,0,0.0,16,08/24/21 11:15:23,2021-07-22,2021-08-24,33.0
711,6219,4887,2021-08-20,0,875000,0.75999999,0,0.0,16,08/24/21 11:20:17,2021-08-08,2021-08-20,12.0
712,6220,4822,2021-08-17,0,517428,24.34,0,61236.0,16,08/24/21 11:24:05,2021-05-19,2021-08-17,90.0
713,6221,4821,2021-08-18,0,790316,21.645,0,78134.0,16,08/24/21 11:24:41,2021-05-18,2021-08-18,92.0
714,6222,4831,2021-08-19,0,111605,24.32,0,12256.0,16,08/24/21 11:25:17,2021-05-25,2021-08-19,86.0
715,6223,4832,2021-08-19,0,90571,25.57,0,11276.0,16,08/24/21 11:25:47,2021-05-25,2021-08-19,86.0
716,6224,4838,2021-08-20,0,609439,24.16,0,70502.0,16,09/01/21 11:14:15,2021-06-09,2021-08-20,72.0
717,6225,4837,2021-08-23,0,692799,23.469999,0,77834.0,16,09/28/21 08:19:11,2021-06-04,2021-08-23,80.0
718,6226,4823,2021-08-21,1,155060,26.040001,0,20555.0,16,09/01/21 11:15:07,2021-05-20,2021-09-04,93.0
719,6227,4845,2021-08-21,1,188712,19.309999,0,16151.0,16,09/01/21 11:16:18,2021-06-16,2021-09-17,66.0
720,6228,4843,2021-08-22,1,251415,17.309999,0,18528.0,16,09/28/21 08:18:41,2021-06-15,2021-09-19,68.0
721,6229,4846,2021-08-22,1,167720,20.15,0,15365.0,16,09/01/21 11:17:52,2021-06-16,2021-09-21,67.0
722,6230,4817,2021-08-24,0,646937,26.610001,0,87230.0,16,09/28/21 08:19:30,2021-05-13,2021-08-24,103.0
723,6231,4836,2021-08-25,0,953373,23.719999,0,107235.0,16,09/28/21 08:24:06,2021-06-02,2021-08-25,84.0
724,6232,4885,2021-08-24,0,784000,2.8099999,0,0.0,16,09/01/21 11:42:40,2021-08-06,2021-08-24,18.0
725,6233,4883,2021-08-25,0,1223000,0.81999999,0,0.0,16,09/01/21 11:46:56,2021-08-04,2021-08-25,21.0
726,6234,4891,2021-08-26,0,935000,0.090000004,0,0.0,16,09/01/21 11:50:49,2021-08-10,2021-08-26,16.0
727,6235,4884,2021-08-17,0,865000,0.87,0,0.0,16,09/01/21 12:08:55,2021-08-05,2021-08-17,12.0
728,6236,4892,2021-08-26,0,1471000,0.090000004,0,0.0,16,09/01/21 12:10:12,2021-08-10,2021-08-26,16.0
729,6237,4893,2021-08-27,0,1323000,0.1,0,0.0,16,09/01/21 12:14:05,2021-08-10,2021-08-27,17.0
730,6238,4894,2021-08-27,0,942000,0.11,0,0.0,16,09/01/21 12:15:36,2021-08-10,2021-08-27,17.0
731,6239,4895,2021-08-28,0,1852000,0.079999998,0,0.0,16,09/01/21 12:17:05,2021-08-11,2021-08-28,17.0
732,6240,4896,2021-08-28,0,523000,0.11,0,0.0,16,09/01/21 12:23:46,2021-08-11,2021-08-28,17.0
733,6241,4888,2021-09-02,0,892000,0.46000001,0,0.0,16,09/08/21 07:47:36,2021-08-07,2021-09-02,26.0
734,6242,4839,2021-09-01,0,566903,26.370001,0,74679.0,16,09/10/21 19:00:39,2021-06-10,2021-09-01,83.0
735,6243,4835,2021-09-01,0,506651,28.4,0,77290.0,16,09/10/21 18:59:21,2021-05-27,2021-09-01,97.0
736,6244,4826,2021-09-03,0,668232,27.309999,0,96190.0,16,09/10/21 19:01:26,2021-05-23,2021-09-03,103.0
737,6245,4823,2021-09-04,0,869095,26.049999,0,115230.0,16,09/10/21 19:02:12,2021-05-20,2021-09-04,107.0
738,6246,4834,2021-09-05,0,559666,29.73,0,96263.0,16,09/10/21 19:04:37,2021-05-27,2021-09-05,101.0
739,6247,4844,2021-09-06,0,710084,25.129999,0,92054.0,16,09/10/21 19:07:53,2021-06-15,2021-09-06,83.0
740,6248,4889,2021-09-02,0,744000,0.46000001,0,0.0,16,09/08/21 07:55:47,2021-08-07,2021-09-02,26.0
741,6249,4908,2021-09-03,0,578000,0.23,0,0.0,16,09/08/21 07:59:06,2021-08-28,2021-09-03,6.0
742,6250,4897,2021-09-03,0,3356000,0.2,0,0.0,16,09/08/21 08:09:35,2021-08-12,2021-09-03,22.0
743,6251,4890,2021-09-07,0,2410000,0.72000003,0,0.0,16,09/15/21 15:36:07,2021-08-07,2021-09-07,31.0
744,6252,4906,2021-09-08,0,1610000,0.69999999,0,0.0,16,09/15/21 15:38:54,2021-08-27,2021-09-08,12.0
745,6253,4907,2021-09-09,0,1891000,0.46000001,0,0.0,16,09/15/21 15:43:19,2021-08-28,2021-09-09,12.0
746,6254,4905,2021-09-15,0,2004000,0.69,0,0.0,16,09/15/21 15:47:35,2021-08-26,2021-09-15,20.0
747,6255,4914,2021-09-11,0,576000,0.15000001,0,0.0,16,09/15/21 15:51:15,2021-08-28,2021-09-11,14.0
748,6256,4915,2021-09-11,0,1517000,0.19,0,0.0,16,09/15/21 15:52:51,2021-08-24,2021-09-11,18.0
749,6257,4845,2021-09-17,0,431854,24.33,0,55666.0,16,11/03/21 13:32:38,2021-06-16,2021-09-17,93.0
750,6258,4913,2021-09-17,0,1418000,0.38999999,0,0.0,16,09/21/21 19:18:05,2021-08-24,2021-09-17,24.0
751,6259,4843,2021-09-19,0,604078,26.24,0,87188.0,16,11/03/21 13:32:59,2021-06-15,2021-09-19,96.0
752,6260,4846,2021-09-21,0,346458,25.549999,0,48466.0,16,11/03/21 13:33:16,2021-06-16,2021-09-21,97.0
753,6261,4849,2021-09-16,1,111610,18.690001,0,9782.0,16,11/03/21 13:32:18,2021-07-02,2021-10-01,76.0
754,6262,4925,2021-09-22,0,595000,0.07,0,0.0,16,09/27/21 15:49:43,2021-09-09,2021-09-22,13.0
755,6263,4926,2021-09-22,0,739000,0.079999998,0,0.0,16,09/27/21 15:50:58,2021-09-09,2021-09-22,13.0
756,6264,4923,2021-09-23,0,906000,0.1,0,0.0,16,09/27/21 15:51:34,2021-09-09,2021-09-23,14.0
757,6265,4924,2021-09-23,0,739000,0.1,0,0.0,16,09/27/21 15:52:20,2021-09-09,2021-09-23,14.0
758,6266,4922,2021-09-24,0,1279000,1.36,0,0.0,16,09/27/21 16:13:28,2021-09-11,2021-09-24,13.0
759,6267,4849,2021-10-01,0,535930,21.57,0,60502.0,16,11/03/21 13:33:36,2021-07-02,2021-10-01,91.0
760,6268,4867,2021-10-02,0,1181460,21.09,0,126773.0,16,11/03/21 13:33:54,2021-07-22,2021-10-02,72.0
761,6269,4928,2021-10-05,0,1599000,0.47,0,0.0,16,10/05/21 15:57:11,2021-09-22,2021-10-05,13.0
762,6270,4862,2021-10-03,0,245668,27.24,0,37388.0,16,11/03/21 13:34:26,2021-07-15,2021-10-03,80.0
763,6271,4863,2021-10-03,0,285383,26.34,0,42568.0,16,11/03/21 13:34:09,2021-07-15,2021-10-03,80.0
764,6272,4881,2021-10-04,0,384722,26.049999,0,53257.0,16,11/03/21 13:34:44,2021-08-02,2021-10-04,63.0
765,6273,4861,2021-10-05,0,260631,26.290001,0,37481.0,16,11/18/21 08:45:19,2021-07-15,2021-10-05,82.0
766,6274,4929,2021-10-06,0,1566000,0.54000002,0,0.0,16,10/11/21 15:16:57,2021-09-23,2021-10-06,13.0
767,6275,4933,2021-10-07,0,1295000,0.07,0,0.0,16,10/11/21 15:19:08,2021-09-23,2021-10-07,14.0
768,6276,4934,2021-10-07,0,859000,0.11,0,0.0,16,10/11/21 15:20:58,2021-09-23,2021-10-07,14.0
769,6277,4931,2021-10-08,0,2261000,0.11,0,0.0,16,10/11/21 15:22:41,2021-09-23,2021-10-08,15.0
770,6278,4866,2021-10-09,0,327054,24.1,0,40212.0,16,11/18/21 08:45:44,2021-07-21,2021-10-09,80.0
771,6279,4882,2021-10-11,0,1491329,23.559999,0,180691.0,16,10/20/21 10:10:42,2021-08-03,2021-10-11,69.0
772,6280,4935,2021-10-12,0,803000,0.079999998,0,0.0,16,10/20/21 09:43:17,2021-09-30,2021-10-12,12.0
773,6281,4936,2021-10-12,0,448000,0.090000004,0,0.0,16,10/20/21 09:45:07,2021-09-30,2021-10-12,12.0
774,6282,4946,2021-10-13,0,661000,0.31,0,0.0,16,10/20/21 09:48:42,2021-09-22,2021-10-13,21.0
775,6283,4944,2021-10-14,0,1475000,0.43000001,0,0.0,16,10/20/21 09:55:29,2021-10-08,2021-10-14,6.0
776,6284,4949,2021-10-13,0,963000,0.31999999,0,0.0,16,10/20/21 09:56:24,2021-09-22,2021-10-13,21.0
777,6285,4943,2021-10-15,0,1737000,0.34999999,0,0.0,16,10/20/21 10:00:11,2021-10-07,2021-10-15,8.0
778,6286,4932,2021-10-16,0,713000,0.27000001,0,0.0,16,10/20/21 10:03:39,2021-09-23,2021-10-16,23.0
779,6287,4937,2021-10-18,0,1123000,0.1,0,0.0,16,10/20/21 10:05:03,2021-10-04,2021-10-18,14.0
780,6288,4938,2021-10-18,0,662000,0.17,0,0.0,16,10/20/21 10:06:13,2021-10-04,2021-10-18,14.0
781,6289,4877,2021-10-14,0,471655,25.26,0,64557.0,16,11/18/21 08:46:31,2021-07-28,2021-10-14,78.0
782,6290,4878,2021-10-18,0,226462,28.84,0,35724.0,16,10/27/21 10:40:21,2021-07-28,2021-10-18,82.0
783,6291,4879,2021-10-18,0,1108174,24.1,0,134029.0,16,11/18/21 08:57:19,2021-07-29,2021-10-18,81.0
784,6292,4876,2021-10-19,0,1041132,25.26,0,140353.0,16,11/18/21 08:57:40,2021-07-28,2021-10-19,83.0
785,6293,4901,2021-10-26,0,599736,22.719999,0,67245.0,16,11/18/21 08:59:48,2021-08-20,2021-10-26,67.0
786,6294,4939,2021-10-22,0,3690000,0.28,0,0.0,16,10/27/21 10:16:05,2021-10-03,2021-10-22,19.0
787,6295,4954,2021-10-27,0,1062000,0.58999997,0,0.0,16,10/27/21 10:19:27,2021-10-18,2021-10-27,9.0
788,6296,4900,2021-10-25,0,319101,22.25,0,35125.0,16,11/18/21 08:59:18,2021-08-19,2021-10-25,67.0
789,6297,4880,2021-10-27,0,719339,25.77,0,98817.0,16,11/09/21 21:13:02,2021-07-30,2021-10-27,89.0
790,6298,4917,2021-10-24,1,161304,17.030001,0,12413.0,16,11/18/21 08:58:03,2021-09-07,2021-11-10,47.0
791,6299,4904,2021-10-24,1,119142,20.74,0,12034.0,16,11/18/21 08:58:36,2021-08-17,2021-11-04,68.0
792,6300,4903,2021-10-25,1,151667,21.290001,0,16064.0,16,11/18/21 08:59:00,2021-08-25,2021-11-23,61.0
793,6301,4916,2021-10-26,1,63664,16.540001,0,4926.0,16,11/18/21 09:02:12,2021-09-07,2021-11-30,49.0
794,6302,4902,2021-11-03,0,543933,26.6,0,74745.0,16,11/18/21 08:51:02,2021-08-24,2021-11-03,71.0
795,6303,4898,2021-10-28,1,243405,18.059999,0,20303.0,16,11/09/21 21:15:38,2021-08-18,2021-11-19,71.0
796,6304,4945,2021-11-03,0,1342000,0.5,0,0.0,16,11/03/21 14:08:52,2021-10-12,2021-11-03,22.0
797,6305,4958,2021-11-03,0,697000,0.090000004,0,0.0,16,11/03/21 14:13:00,2021-10-22,2021-11-03,12.0
798,6306,4963,2021-11-03,0,799000,0.079999998,0,0.0,16,11/03/21 14:14:25,2021-10-22,2021-11-03,12.0
799,6307,4955,2021-11-04,0,778000,0.11,0,0.0,16,11/09/21 20:43:56,2021-10-21,2021-11-04,14.0
800,6308,4957,2021-11-04,0,420000,0.13,0,0.0,16,11/09/21 21:06:58,2021-10-21,2021-11-04,14.0
801,6309,4964,2021-11-05,0,1770000,0.090000004,0,0.0,16,11/09/21 21:07:31,2021-10-25,2021-11-05,11.0
802,6310,4962,2021-11-09,0,925000,0.20999999,0,0.0,16,11/09/21 21:08:01,2021-10-22,2021-11-09,18.0
803,6311,4904,2021-11-04,0,670486,23.950001,0,79709.0,16,11/18/21 08:51:45,2021-08-17,2021-11-04,79.0
804,6312,4899,2021-11-05,0,569561,25.35,0,73279.0,16,11/18/21 08:52:27,2021-08-19,2021-11-05,78.0
805,6313,4909,2021-11-04,1,203881,18.959999,0,16368.0,16,11/18/21 09:05:07,2021-09-02,2021-12-01,63.0
806,6314,4918,2021-11-05,1,365073,15.51,0,22431.0,16,11/18/21 09:04:32,2021-09-08,2021-12-10,58.0
807,6315,4919,2021-11-06,1,275173,13.85,0,14608.0,16,11/18/21 09:03:58,2021-09-09,2021-12-07,58.0
808,6316,4912,2021-11-07,1,201293,17.040001,0,13989.0,16,11/18/21 09:05:35,2021-09-03,2021-11-30,65.0
809,6317,4967,2021-10-28,0,4338000,0.28,0,0.0,16,11/10/21 08:50:30,2021-10-07,2021-10-28,21.0
810,6318,4960,2021-11-12,0,779000,0.23999999,0,0.0,16,11/18/21 08:16:30,2021-10-22,2021-11-12,21.0
811,6319,4961,2021-11-12,0,841000,0.23999999,0,0.0,16,11/18/21 08:21:40,2021-10-22,2021-11-12,21.0
812,6320,4959,2021-11-16,0,1099000,0.55000001,0,0.0,16,11/18/21 08:36:54,2021-10-22,2021-11-16,25.0
813,6321,4972,2021-11-17,0,1475000,0.37,0,0.0,16,11/18/21 08:40:23,2021-11-05,2021-11-17,12.0
814,6322,4917,2021-11-10,0,673244,22.07,0,58778.0,16,11/18/21 08:53:37,2021-09-07,2021-11-10,64.0
815,6323,4968,2021-10-26,0,881000,0.2,0,0.0,16,11/22/21 09:58:44,2021-10-07,2021-10-26,19.0
816,6324,4956,2021-11-10,0,568000,0.22,0,0.0,16,11/22/21 10:12:32,2021-10-21,2021-11-10,20.0
817,6325,4970,2021-11-22,0,1399000,0.64999998,0,0.0,16,11/22/21 13:04:49,2021-11-03,2021-11-22,19.0
818,6326,4971,2021-11-19,0,983000,0.81,0,0.0,16,11/22/21 17:56:52,2021-11-04,2021-11-19,15.0
819,6327,4898,2021-11-19,0,1070850,24.139999,0,115727.0,16,12/01/21 08:50:30,2021-08-18,2021-11-19,93.0
820,6328,4979,2021-11-26,0,1936000,0.33000001,0,0.0,16,12/01/21 08:32:59,2021-11-05,2021-11-26,21.0
821,6329,4983,2021-11-30,0,1556000,0.1,0,0.0,16,12/01/21 08:34:47,2021-11-17,2021-11-30,13.0
822,6330,4982,2021-11-30,0,1729000,0.11,0,0.0,16,12/01/21 08:40:09,2021-11-17,2021-11-30,13.0
823,6331,4984,2021-11-30,0,966000,0.1,0,0.0,16,12/01/21 08:43:48,2021-11-17,2021-11-30,13.0
824,6332,4903,2021-11-23,0,664629,31.290001,0,91552.0,16,12/01/21 08:51:29,2021-08-25,2021-11-23,90.0
825,6333,4911,2021-11-23,0,147881,21.77,0,12923.0,16,12/01/21 08:52:39,2021-09-03,2021-11-23,81.0
826,6334,4909,2021-12-01,0,933058,26.620001,0,101272.0,16,12/01/21 08:53:58,2021-09-02,2021-12-01,90.0
827,6335,4910,2021-11-26,0,120933,24.059999,0,11443.0,16,12/01/21 08:54:46,2021-09-03,2021-11-26,84.0
828,6336,4916,2021-11-30,0,861086,25.92,0,94032.0,16,12/07/21 15:22:16,2021-09-07,2021-11-30,84.0
829,6337,4912,2021-11-30,0,687220,25.23,0,72988.0,16,12/07/21 15:22:59,2021-09-03,2021-11-30,88.0
830,6338,4930,2021-11-27,1,221573,19.33,0,14870.0,16,12/06/21 11:19:10,2021-09-24,2021-12-14,64.0
831,6339,4942,2021-11-27,1,292412,13.22,0,11481.0,16,12/06/21 11:19:39,2021-10-06,2022-01-06,52.0
832,6340,4988,2021-12-01,0,901000,0.090000004,0,0.0,16,12/06/21 09:52:44,2021-11-18,2021-12-01,13.0
833,6341,4981,2021-12-01,0,891000,0.11,0,0.0,16,12/06/21 09:53:10,2021-11-17,2021-12-01,14.0
834,6342,4919,2021-12-07,0,1170366,23.17,0,110695.0,16,12/15/21 18:26:32,2021-09-09,2021-12-07,89.0
835,6343,4918,2021-12-10,0,1287854,22.59,0,116150.0,16,12/20/21 19:53:00,2021-09-08,2021-12-10,93.0
836,6344,4921,2021-12-13,0,595150,26.85,0,63390.0,16,01/06/22 21:39:57,2021-09-10,2021-12-13,94.0
837,6345,4930,2021-12-14,0,1109063,25.0,0,116863.0,16,01/06/22 22:01:58,2021-09-24,2021-12-14,81.0
838,6346,4940,2021-12-08,1,125348,17.950001,0,7540.0,16,12/20/21 19:56:28,2021-10-05,2022-01-05,64.0
839,6347,4941,2021-12-09,1,135261,18.65,0,8357.0,16,12/20/21 19:56:50,2021-10-05,2022-01-03,65.0
840,6348,4987,2021-12-07,0,424000,0.23999999,0,0.0,16,12/15/21 19:07:31,2021-11-18,2021-12-07,19.0
841,6349,4991,2021-12-08,0,2447000,0.36000001,0,0.0,16,12/15/21 19:11:43,2021-11-30,2021-12-08,8.0
842,6350,4992,2021-12-09,0,3274000,0.40000001,0,0.0,16,12/15/21 19:17:56,2021-11-30,2021-12-09,9.0
843,6351,4927,2021-12-17,0,861069,26.559999,0,95419.0,16,01/06/22 22:03:30,2021-09-17,2021-12-17,91.0
844,6352,4920,2021-12-18,0,631980,30.5,0,81580.0,16,01/06/22 22:04:29,2021-09-10,2021-12-18,99.0
845,6353,4952,2021-12-16,1,253647,17.0,0,14194.0,16,01/06/22 22:06:44,2021-10-14,2022-01-27,63.0
846,6354,4950,2021-12-16,1,82615,18.0,0,4962.0,16,01/06/22 22:07:27,2021-10-13,2022-01-16,64.0
847,6355,4947,2021-12-16,1,99477,17.0,0,5323.0,16,01/06/22 22:12:33,2021-10-13,2022-01-16,64.0
848,6356,4965,2021-12-18,1,451315,14.01,0,19561.0,16,01/06/22 22:13:14,2021-10-22,2022-01-25,57.0
849,6357,4942,2021-12-19,1,167265,21.459999,0,13846.0,16,01/06/22 22:13:59,2021-10-06,2022-01-06,74.0
850,6358,4966,2021-12-19,1,438694,13.74,0,18010.0,16,01/06/22 22:14:38,2021-10-26,2022-01-27,54.0
851,6359,4953,2021-12-20,1,285856,15.81,0,15143.0,16,01/06/22 22:15:27,2021-10-14,2022-02-01,67.0
852,6360,4948,2021-12-20,1,81674,19.5,0,5839.0,16,01/06/22 22:16:16,2021-10-13,2022-01-20,68.0
853,6361,4996,2021-12-17,0,1861000,0.090000004,0,0.0,16,12/20/21 20:03:09,2021-12-05,2021-12-17,12.0
854,6362,4989,2021-12-10,0,1452000,0.25999999,0,0.0,16,12/20/21 20:05:31,2021-11-22,2021-12-10,18.0
855,6363,4993,2021-12-22,0,2172000,0.28,0,0.0,16,01/06/22 19:43:26,2021-12-02,2021-12-22,20.0
856,6364,4995,2021-12-28,0,2772000,0.41999999,0,0.0,16,01/06/22 21:24:14,2021-12-05,2021-12-28,23.0
857,6365,4994,2021-12-29,0,4960000,0.44,0,0.0,16,01/06/22 21:28:24,2021-12-04,2021-12-29,25.0
858,6366,5008,2021-12-31,0,957000,0.12,0,0.0,16,01/06/22 21:31:58,2021-12-17,2021-12-31,14.0
859,6367,5005,2021-12-31,0,677000,0.15000001,0,0.0,16,01/06/22 21:35:57,2021-12-17,2021-12-31,14.0
860,6368,4974,2021-12-29,1,546586,14.12,0,24084.0,16,01/06/22 22:16:59,2021-10-28,2022-02-02,62.0
861,6369,4975,2021-12-30,1,281673,14.19,0,12160.0,16,01/06/22 22:17:39,2021-10-28,2022-01-26,63.0
862,6370,5006,2022-01-01,0,1050000,0.12,0,0.0,16,01/06/22 22:32:20,2021-12-17,2022-01-01,15.0
863,6371,5007,2022-01-01,0,1008000,0.13,0,0.0,16,01/06/22 22:34:40,2021-12-17,2022-01-01,15.0
864,6372,4940,2022-01-05,0,634722,25.110001,0,71128.0,16,01/11/22 13:24:58,2021-10-05,2022-01-05,92.0
865,6373,4941,2022-01-03,0,513669,24.799999,0,55801.0,16,01/21/22 13:23:19,2021-10-05,2022-01-03,90.0
866,6374,4974,2022-01-05,1,457673,15.34,0,27083.0,16,01/21/22 13:28:15,2021-10-28,2022-02-02,69.0
867,6375,4942,2022-01-06,0,693499,24.35,0,73916.0,16,01/11/22 13:26:47,2021-10-06,2022-01-06,92.0
868,6376,5004,2021-12-30,0,1015556,0.44999999,0,0.0,16,01/21/22 12:49:32,2021-12-17,2021-12-30,13.0
869,6377,5016,2022-01-12,0,1992000,0.75,0,0.0,16,01/21/22 13:06:12,2021-12-31,2022-01-12,12.0
870,6378,5015,2022-01-13,0,1471579,0.94999999,0,0.0,16,01/21/22 13:08:49,2021-12-31,2022-01-13,13.0
871,6379,4950,2022-01-16,0,240545,27.450001,0,27659.0,16,01/28/22 12:04:06,2021-10-13,2022-01-16,95.0
872,6380,4947,2022-01-16,0,367309,25.66,0,38973.0,16,01/28/22 12:04:53,2021-10-13,2022-01-16,95.0
873,6381,4951,2022-01-18,0,382191,25.16,0,43052.0,16,01/24/22 23:10:01,2021-10-13,2022-01-18,97.0
874,6382,4948,2022-01-20,0,199382,28.469999,0,25793.0,16,01/24/22 23:11:06,2021-10-13,2022-01-20,99.0
875,6383,4966,2022-01-08,1,323390,19.700001,0,27185.0,16,01/21/22 13:28:52,2021-10-26,2022-01-27,74.0
876,6384,4965,2022-01-07,1,331553,20.030001,0,27705.0,16,01/21/22 13:31:45,2021-10-22,2022-01-25,77.0
877,6385,4969,2022-01-08,1,109182,20.870001,0,10050.0,16,01/21/22 13:30:17,2021-10-26,2022-01-26,74.0
878,6386,4975,2022-01-07,1,197878,16.280001,0,12666.0,16,01/21/22 13:30:53,2021-10-28,2022-01-26,71.0
879,6387,4985,2022-01-09,1,345452,13.47,0,16142.0,16,01/21/22 13:32:16,2021-11-18,2022-02-09,52.0
880,6388,4980,2022-01-09,1,101346,18.129999,0,7377.0,16,01/21/22 13:32:50,2021-11-10,2022-02-14,60.0
881,6389,4953,2022-01-10,1,260325,22.42,0,26060.0,16,01/21/22 15:31:40,2021-10-14,2022-02-01,88.0
882,6390,4973,2022-01-10,1,102578,17.92,0,7398.0,16,01/21/22 15:32:20,2021-11-09,2022-03-05,62.0
883,6391,4986,2022-01-14,1,179852,15.7,0,10381.0,16,01/21/22 15:32:52,2021-11-18,2022-02-19,57.0
884,6392,4977,2022-01-18,1,198686,21.860001,0,19601.0,16,01/24/22 23:12:58,2021-11-16,2022-02-04,63.0
885,6393,4976,2022-01-22,1,250214,21.76,0,21357.0,16,02/08/22 14:04:59,2021-11-12,2022-02-14,71.0
886,6394,4978,2022-01-22,1,264474,18.02,0,18987.0,16,01/28/22 12:05:32,2021-11-17,2022-02-17,66.0
887,6395,4953,2022-01-23,1,299411,28.84,0,37287.0,16,02/08/22 14:06:11,2021-10-14,2022-02-01,101.0
888,6396,4985,2022-01-23,1,218900,18.629999,0,14323.0,16,02/08/22 14:06:55,2021-11-18,2022-02-09,66.0
889,6397,4952,2022-01-24,1,316949,29.440001,0,41707.0,16,02/08/22 13:59:23,2021-10-14,2022-01-27,102.0
890,6398,4965,2022-01-24,1,377184,25.059999,0,42149.0,16,02/08/22 13:50:55,2021-10-22,2022-01-25,94.0
891,6399,4965,2022-01-25,0,1039392,25.110001,0,99314.0,16,02/08/22 13:51:43,2021-10-22,2022-01-25,95.0
892,6400,4975,2022-01-26,0,653300,21.200001,0,59272.0,16,02/08/22 13:56:41,2021-10-28,2022-01-26,90.0
893,6401,4969,2022-01-26,0,385255,24.6,0,41118.0,16,02/08/22 13:57:43,2021-10-26,2022-01-26,92.0
894,6402,4952,2022-01-27,0,601348,29.940001,0,73919.0,16,02/08/22 13:59:59,2021-10-14,2022-01-27,105.0
895,6403,4966,2022-01-26,1,325434,27.190001,0,36276.0,16,02/08/22 14:03:35,2021-10-26,2022-01-27,92.0
896,6404,4966,2022-01-27,0,701942,25.75,0,77800.0,16,02/08/22 14:04:03,2021-10-26,2022-01-27,93.0
897,6405,4974,2022-01-27,1,484893,21.27,0,44640.0,16,02/08/22 14:07:39,2021-10-28,2022-02-02,91.0
898,6406,5028,2022-01-27,0,2927273,0.22,0,0.0,16,01/28/22 11:58:24,2022-01-12,2022-01-27,15.0
899,6407,5020,2022-01-31,0,907692,0.51999998,0,0.0,16,02/08/22 13:29:28,2022-01-11,2022-01-31,20.0
900,6408,5021,2022-02-01,0,1297778,0.44999999,0,0.0,16,02/08/22 13:32:03,2022-01-12,2022-02-01,20.0
901,6409,5003,2021-12-30,0,894444,0.54000002,0,0.0,16,03/02/22 08:32:11,2021-12-17,2021-12-30,13.0
902,6410,4953,2022-02-01,0,450971,29.030001,0,59397.0,16,02/08/22 13:45:33,2021-10-14,2022-02-01,110.0
903,6411,4974,2022-02-02,0,762034,22.290001,0,72443.0,16,02/08/22 13:46:50,2021-10-28,2022-02-02,97.0
904,6412,4977,2022-02-04,0,481805,28.469999,0,60956.0,16,02/13/22 19:42:26,2021-11-16,2022-02-04,80.0
905,6413,4990,2022-01-30,1,484624,15.04,0,22330.0,16,02/08/22 14:09:12,2021-11-26,2022-02-27,65.0
906,6414,5001,2022-01-30,1,255248,14.81,0,11034.0,16,02/08/22 14:10:02,2021-12-09,2022-03-04,52.0
907,6415,4986,2022-02-02,1,204072,21.389999,0,17968.0,16,02/08/22 14:11:02,2021-11-18,2022-02-19,76.0
908,6416,4999,2022-02-03,1,429568,12.65,0,17709.0,16,02/08/22 14:11:55,2021-12-08,2022-03-12,57.0
909,6417,5002,2022-02-03,1,386038,14.04,0,20093.0,16,02/08/22 14:12:32,2021-12-10,2022-03-03,55.0
910,6418,5000,2022-02-04,1,257567,14.14,0,13108.0,16,02/13/22 19:44:11,2021-12-08,2022-03-11,58.0
911,6419,4985,2022-02-05,1,296516,22.530001,0,28276.0,16,02/13/22 19:43:25,2021-11-18,2022-02-09,79.0
912,6420,4976,2022-02-05,1,299006,25.25,0,33550.0,16,02/13/22 19:44:50,2021-11-12,2022-02-14,85.0
913,6421,5026,2022-02-02,0,568750,0.16,0,0.0,16,02/08/22 14:21:42,2022-01-20,2022-02-02,13.0
914,6422,5029,2022-02-07,0,2371591,0.88,0,0.0,16,02/08/22 14:24:24,2022-01-27,2022-02-07,11.0
915,6423,5027,2022-02-08,0,969697,0.33000001,0,0.0,16,02/08/22 14:26:23,2022-01-20,2022-02-08,19.0
916,6424,5013,2022-02-07,1,643584,11.95,0,23676.0,16,03/01/22 13:33:12,2021-12-28,2022-03-20,41.0
917,6425,5014,2022-02-09,1,474166,11.38,0,16225.0,16,03/01/22 13:36:31,2021-12-29,2022-03-18,42.0
918,6426,4973,2022-02-10,1,84459,31.1,0,8968.0,16,03/01/22 13:40:49,2021-11-09,2022-03-05,93.0
919,6427,4999,2022-02-10,1,404798,14.18,0,20249.0,16,03/01/22 13:42:10,2021-12-08,2022-03-12,64.0
920,6428,5024,2022-02-09,0,980000,0.30000001,0,0.0,16,02/13/22 15:11:40,2022-01-20,2022-02-09,20.0
921,6429,5025,2022-02-09,0,965625,0.31999999,0,0.0,16,02/13/22 15:59:03,2022-01-20,2022-02-09,20.0
922,6430,5022,2022-02-10,0,4525000,0.44,0,0.0,16,02/13/22 19:37:50,2022-01-19,2022-02-10,22.0
923,6431,5023,2022-02-11,0,4380357,0.56,0,0.0,16,02/13/22 19:40:23,2022-01-19,2022-02-11,23.0
924,6432,4985,2022-02-09,0,306464,22.42,0,29318.0,16,03/01/22 13:24:08,2021-11-18,2022-02-09,83.0
925,6433,5038,2022-02-04,0,10000,0.1,0,0.0,16,02/14/22 11:04:40,2022-02-02,2022-02-04,2.0
926,6434,5000,2022-02-14,1,233148,16.76,0,15174.0,16,03/01/22 13:43:21,2021-12-08,2022-03-11,68.0
927,6435,5012,2022-02-15,1,333087,12.43,0,13029.0,16,03/01/22 13:44:35,2021-12-28,2022-03-19,49.0
928,6436,5011,2022-02-18,1,304421,15.34,0,17150.0,16,03/01/22 14:01:14,2021-12-28,2022-03-21,52.0
929,6437,5030,2022-02-16,0,1380769,0.25999999,0,0.0,16,03/01/22 08:38:22,2022-01-31,2022-02-16,16.0
930,6438,5031,2022-02-16,0,1091892,0.37,0,0.0,16,03/01/22 08:48:14,2022-01-31,2022-02-16,16.0
931,6439,5033,2022-02-17,0,2154545,0.11,0,0.0,16,03/01/22 09:08:09,2022-02-04,2022-02-17,13.0
932,6440,5044,2022-02-17,0,1161538,0.13,0,0.0,16,03/01/22 09:48:05,2022-02-06,2022-02-17,11.0
933,6441,5045,2022-02-21,0,1244000,0.25,0,0.0,16,03/01/22 11:35:32,2022-02-06,2022-02-21,15.0
934,6442,5032,2022-02-18,0,1026531,0.49000001,0,0.0,16,03/01/22 11:20:36,2022-01-31,2022-02-18,18.0
935,6443,5046,2022-02-22,0,1137838,0.37,0,0.0,16,03/01/22 12:07:07,2022-02-06,2022-02-22,16.0
936,6444,5043,2022-02-17,0,1150000,0.14,0,0.0,16,03/01/22 12:53:24,2022-02-04,2022-02-17,13.0
937,6445,4998,2022-02-23,0,184273,20.33,0,14552.0,16,03/08/22 09:57:03,2021-12-07,2022-02-23,78.0
938,6446,4980,2022-02-14,0,269551,32.529999,0,43942.0,16,03/01/22 13:25:26,2021-11-10,2022-02-14,96.0
939,6447,4976,2022-02-14,0,439736,28.459999,0,54706.0,16,03/01/22 13:27:47,2021-11-12,2022-02-14,94.0
940,6448,4978,2022-02-17,0,817588,27.35,0,98503.0,16,03/01/22 13:29:06,2021-11-17,2022-02-17,92.0
941,6449,4986,2022-02-19,0,580478,27.92,0,72248.0,16,03/01/22 13:37:55,2021-11-18,2022-02-19,93.0
942,6450,4997,2022-02-26,0,179721,21.889999,0,15932.0,16,03/08/22 09:25:25,2021-12-07,2022-02-26,81.0
943,6452,5001,2022-02-16,1,191577,18.879999,0,14632.0,16,03/01/22 13:47:24,2021-12-09,2022-03-04,69.0
944,6453,5009,2022-02-15,1,242518,15.3,0,14258.0,16,03/01/22 13:51:42,2021-12-22,2022-03-31,55.0
945,6454,5010,2022-02-17,1,100736,16.74,0,6854.0,16,03/01/22 13:56:13,2021-12-22,2022-04-04,57.0
946,6455,4990,2022-02-27,0,1036892,23.719999,0,106331.0,16,03/08/22 09:32:26,2021-11-26,2022-02-27,93.0
947,6456,5019,2022-02-22,1,237276,13.25,0,10765.0,16,03/01/22 14:09:58,2022-01-13,2022-04-08,40.0
948,6457,5018,2022-02-24,1,215137,13.01,0,9124.0,16,03/08/22 09:44:19,2022-01-12,2022-04-04,43.0
949,6458,5010,2022-02-25,1,101120,19.32,0,7966.0,16,03/08/22 09:38:57,2021-12-22,2022-04-04,65.0
950,6459,4999,2022-02-26,1,139511,21.700001,0,13084.0,16,03/08/22 09:48:56,2021-12-08,2022-03-12,80.0
951,6460,5017,2022-02-27,1,221772,12.66,0,9250.0,16,03/08/22 09:51:00,2022-01-12,2022-04-06,46.0
952,6461,5057,2022-02-24,0,1445455,0.66000003,0,0.0,16,03/01/22 15:01:32,2022-02-17,2022-02-24,7.0
953,6462,5055,2022-02-25,0,1300000,0.64999998,0,0.0,16,03/01/22 15:14:57,2022-02-17,2022-02-25,8.0
954,6463,5065,2022-02-27,0,372727,0.55000001,0,0.0,16,03/02/22 08:18:59,2022-02-22,2022-02-27,5.0
955,6465,5042,2022-02-01,0,1158696,0.46000001,0,0.0,16,03/02/22 08:36:13,2022-01-11,2022-02-01,21.0
956,6466,5068,2022-02-22,0,1917857,0.28,0,0.0,16,03/02/22 08:39:33,2022-02-04,2022-02-22,18.0
957,6467,5001,2022-03-04,0,705123,24.200001,0,73120.0,16,03/15/22 13:30:00,2021-12-09,2022-03-04,85.0
958,6468,5002,2022-03-03,0,820145,24.870001,0,88396.0,16,03/15/22 13:30:39,2021-12-10,2022-03-03,83.0
959,6469,4973,2022-03-05,0,310211,38.68,0,66274.0,16,03/15/22 13:29:22,2021-11-09,2022-03-05,116.0
960,6470,5014,2022-03-08,1,162207,18.98,0,11900.0,16,03/22/22 21:08:56,2021-12-29,2022-03-18,69.0
961,6471,5061,2022-03-01,0,887500,0.47999999,0,0.0,16,03/08/22 10:09:45,2022-02-21,2022-03-01,8.0
962,6472,5054,2022-03-02,0,1178261,0.23,0,0.0,16,03/08/22 10:41:24,2022-02-17,2022-03-02,13.0
963,6473,5053,2022-03-02,0,2076923,0.25999999,0,0.0,16,03/08/22 11:33:09,2022-02-17,2022-03-02,13.0
964,6474,5012,2022-03-08,1,286401,19.35,0,22618.0,16,03/15/22 13:27:22,2021-12-28,2022-03-19,70.0
965,6475,5051,2022-03-04,0,2321951,0.41,0,0.0,16,03/08/22 13:57:53,2022-02-12,2022-03-04,20.0
966,6476,5052,2022-03-09,0,4419231,0.77999997,0,0.0,16,03/10/22 08:19:44,2022-02-13,2022-03-09,24.0
967,6477,4999,2022-03-09,1,258940,25.639999,0,29050.0,16,03/15/22 13:26:08,2021-12-08,2022-03-12,91.0
968,6478,5059,2022-03-11,0,1257143,0.14,0,0.0,16,03/11/22 14:13:45,2022-02-27,2022-03-11,12.0
969,6479,5000,2022-03-11,0,770878,24.459999,0,82452.0,16,03/22/22 21:21:21,2021-12-08,2022-03-11,93.0
970,6480,5058,2022-03-11,0,918750,0.16,0,0.0,16,03/15/22 13:09:50,2022-02-27,2022-03-11,12.0
971,6481,5069,2022-03-13,0,1094118,0.17,0,0.0,16,03/15/22 13:11:32,2022-02-27,2022-03-13,14.0
972,6482,5070,2022-03-14,0,1213043,0.23,0,0.0,16,03/15/22 13:13:22,2022-02-27,2022-03-14,15.0
973,6483,4999,2022-03-12,0,1074177,25.83,0,117325.0,16,03/22/22 21:22:05,2021-12-08,2022-03-12,94.0
974,6484,5017,2022-03-16,1,148422,17.84,0,11087.0,16,03/29/22 14:14:49,2022-01-12,2022-04-06,63.0
975,6485,5036,2022-03-17,1,113318,16.559999,0,6847.0,16,03/29/22 14:16:05,2022-02-01,2022-04-20,44.0
976,6486,5037,2022-03-18,1,117951,14.41,0,6260.0,16,03/29/22 14:16:45,2022-02-01,2022-04-19,45.0
977,6487,5034,2022-03-19,1,174721,15.02,0,9668.0,16,03/29/22 14:17:25,2022-01-31,2022-04-14,47.0
978,6488,5035,2022-03-20,1,137934,16.9,0,8988.0,16,04/06/22 00:53:31,2022-01-31,2022-04-20,48.0
979,6489,5014,2022-03-18,0,1162350,23.219999,0,116335.0,16,03/29/22 14:27:28,2021-12-29,2022-03-18,79.0
980,6490,5012,2022-03-19,0,1247443,20.34,0,105195.0,16,03/29/22 14:40:25,2021-12-28,2022-03-19,81.0
981,6491,5013,2022-03-20,0,1442918,23.299999,0,144079.0,16,03/29/22 14:42:22,2021-12-28,2022-03-20,82.0
982,6492,5011,2022-03-21,0,1050519,23.52,0,107246.0,16,04/05/22 22:28:42,2021-12-28,2022-03-21,83.0
983,6493,5056,2022-03-15,0,1965385,0.25999999,0,0.0,16,03/22/22 21:44:26,2022-02-27,2022-03-15,16.0
984,6494,5072,2022-03-16,0,1947945,1.46,0,0.0,16,03/22/22 21:51:48,2022-03-02,2022-03-16,14.0
985,6495,5062,2022-03-17,0,607143,0.41999999,0,0.0,16,03/22/22 21:54:38,2022-02-27,2022-03-17,18.0
986,6496,5076,2022-03-18,0,1860417,0.47999999,0,0.0,16,03/22/22 22:04:19,2022-03-11,2022-03-18,7.0
987,6497,5019,2022-03-22,1,152062,20.99,0,13799.0,16,04/06/22 00:54:13,2022-01-13,2022-04-08,68.0
988,6498,5018,2022-03-22,1,139360,22.0,0,13342.0,16,03/29/22 14:18:20,2022-01-12,2022-04-04,69.0
989,6499,5040,2022-03-23,1,192297,12.64,0,8136.0,16,04/06/22 00:55:08,2022-02-08,2022-04-29,43.0
990,6500,5039,2022-03-23,1,512047,11.63,0,18354.0,16,04/06/22 00:55:52,2022-02-07,2022-05-06,44.0
991,6501,5041,2022-03-24,1,365714,12.25,0,14759.0,16,04/06/22 01:04:06,2022-02-08,2022-04-29,44.0
992,6502,5049,2022-03-29,1,342507,11.41,0,13387.0,16,04/06/22 00:57:19,2022-02-10,2022-05-04,47.0
993,6503,5048,2022-03-29,1,571526,11.17,0,21674.0,16,04/06/22 00:58:05,2022-02-09,2022-05-01,48.0
994,6504,5010,2022-04-04,0,611607,28.0,0,76907.0,16,04/11/22 11:40:39,2021-12-22,2022-04-04,103.0
995,6505,5060,2022-03-15,0,929032,0.31,0,0.0,16,04/05/22 22:17:53,2022-02-27,2022-03-15,16.0
996,6506,5009,2022-03-31,0,693144,27.58,0,84197.0,16,04/06/22 00:22:22,2021-12-22,2022-03-31,99.0
997,6507,5018,2022-04-04,0,416163,26.48,0,48517.0,16,04/21/22 12:57:17,2022-01-12,2022-04-04,82.0
998,6508,5079,2022-03-31,0,5031250,0.31999999,0,0.0,16,04/06/22 00:27:34,2022-03-16,2022-03-31,15.0
999,6509,5080,2022-04-01,0,1000000,0.28999999,0,0.0,16,04/06/22 00:31:10,2022-03-16,2022-04-01,16.0
1000,6510,5081,2022-04-01,0,1153571,0.28,0,0.0,16,04/06/22 00:34:02,2022-03-16,2022-04-01,16.0
1001,6511,5082,2022-04-05,0,2543902,0.41,0,0.0,16,04/06/22 00:37:28,2022-03-19,2022-04-05,17.0
1002,6512,5035,2022-04-01,1,102649,20.76,0,8860.0,16,04/21/22 13:03:23,2022-01-31,2022-04-20,60.0
1003,6513,5047,2022-04-01,1,453338,15.43,0,25570.0,16,04/21/22 13:04:04,2022-02-11,2022-04-27,49.0
1004,6514,5037,2022-04-02,1,96327,19.33,0,7425.0,16,04/21/22 13:04:38,2022-02-01,2022-04-19,60.0
1005,6515,5063,2022-04-03,1,170128,13.29,0,5663.0,16,04/21/22 13:05:48,2022-02-16,2022-05-11,46.0
1006,6516,5041,2022-04-04,1,314039,16.809999,0,20526.0,16,04/21/22 13:06:30,2022-02-08,2022-04-29,55.0
1007,6517,5017,2022-04-06,0,534591,25.440001,0,58776.0,16,04/21/22 12:58:24,2022-01-12,2022-04-06,84.0
1008,6518,5036,2022-04-03,1,58973,22.790001,0,5776.0,16,04/21/22 13:05:02,2022-02-01,2022-04-20,61.0
1009,6519,5034,2022-04-01,1,92217,21.969999,0,8464.0,16,04/21/22 13:02:39,2022-01-31,2022-04-14,60.0
1010,6520,5083,2022-04-06,0,2405455,0.55000001,0,0.0,16,04/11/22 11:27:56,2022-03-19,2022-04-06,18.0
1011,6521,5019,2022-04-08,0,682100,28.1,0,79075.0,16,04/21/22 12:58:57,2022-01-13,2022-04-08,85.0
1012,6522,5064,2022-04-06,1,436892,10.49,0,15057.0,16,04/21/22 13:07:12,2022-02-22,2022-05-27,43.0
1013,6523,5039,2022-04-08,1,378395,16.200001,0,19986.0,16,04/21/22 13:08:23,2022-02-07,2022-05-06,60.0
1014,6524,5048,2022-04-10,1,472086,15.87,0,25654.0,16,04/21/22 13:09:19,2022-02-09,2022-05-01,60.0
1015,6525,5050,2022-04-10,1,692783,13.44,0,29659.0,16,04/21/22 13:36:51,2022-02-16,2022-05-15,53.0
1016,6526,5049,2022-04-11,1,314722,14.74,0,13015.0,16,04/21/22 13:38:02,2022-02-10,2022-05-04,60.0
1017,6527,5067,2022-04-11,1,462048,13.28,0,16753.0,16,04/21/22 13:38:35,2022-02-25,2022-05-13,45.0
1018,6528,5047,2022-04-12,1,231389,18.0,0,11960.0,16,04/21/22 13:42:57,2022-02-11,2022-04-27,60.0
1019,6529,5091,2022-04-13,0,956000,0.25,0,0.0,16,04/21/22 11:49:32,2022-03-29,2022-04-13,15.0
1020,6530,5090,2022-04-13,0,1047619,0.20999999,0,0.0,16,04/21/22 11:54:42,2022-03-29,2022-04-13,15.0
1021,6531,5088,2022-04-14,0,678788,0.33000001,0,0.0,16,04/21/22 11:56:57,2022-03-29,2022-04-14,16.0
1022,6532,5089,2022-04-14,0,737500,0.31999999,0,0.0,16,04/21/22 11:57:26,2022-03-29,2022-04-14,16.0
1023,6533,5034,2022-04-14,0,291725,25.860001,0,30503.0,16,04/25/22 16:09:55,2022-01-31,2022-04-14,73.0
1024,6534,5037,2022-04-19,0,306845,26.049999,0,32419.0,16,05/06/22 09:04:35,2022-02-01,2022-04-19,77.0
1025,6535,5036,2022-04-20,0,267246,27.02,0,29849.0,16,05/06/22 09:37:20,2022-02-01,2022-04-20,78.0
1026,6536,5035,2022-04-20,0,356540,25.84,0,37169.0,16,05/06/22 10:08:02,2022-01-31,2022-04-20,79.0
1027,6537,5040,2022-04-13,1,95045,20.030001,0,5591.0,16,04/21/22 13:45:23,2022-02-08,2022-04-29,64.0
1028,6538,5066,2022-04-13,1,394988,12.57,0,13048.0,16,04/25/22 16:11:58,2022-02-24,2022-05-20,48.0
1029,6539,5041,2022-04-18,1,298285,21.58,0,25427.0,16,05/05/22 17:57:51,2022-02-08,2022-04-29,69.0
1030,6540,5047,2022-04-18,1,454467,19.700001,0,34546.0,16,05/05/22 17:58:43,2022-02-11,2022-04-27,66.0
1031,6541,5098,2022-04-22,0,968571,0.34999999,0,0.0,16,04/25/22 16:02:45,2022-04-05,2022-04-22,17.0
1032,6542,5075,2022-04-21,1,398675,10.57,0,10562.0,16,05/05/22 18:00:16,2022-03-09,2022-06-02,43.0
1033,6543,5064,2022-04-22,1,427722,14.97,0,21784.0,16,05/05/22 18:00:49,2022-02-22,2022-05-27,59.0
1034,6544,5084,2022-04-22,1,347253,12.74,0,11786.0,16,05/05/22 18:01:21,2022-03-16,2022-06-01,37.0
1035,6545,5050,2022-04-24,1,426604,18.08,0,24389.0,16,05/05/22 18:01:58,2022-02-16,2022-05-15,67.0
1036,6546,5071,2022-04-24,1,422118,16.049999,0,17663.0,16,05/05/22 18:04:50,2022-03-01,2022-05-24,54.0
1037,6547,5073,2022-04-25,1,647945,12.7,0,19514.0,16,05/06/22 08:43:56,2022-03-04,2022-06-04,52.0
1038,6548,5077,2022-04-25,1,465636,11.64,0,12409.0,16,05/06/22 08:50:48,2022-03-13,2022-05-30,43.0
1039,6549,5074,2022-04-25,1,340073,13.75,0,11845.0,16,05/06/22 08:51:20,2022-03-09,2022-05-18,47.0
1040,6550,5067,2022-04-25,1,363115,14.83,0,16571.0,16,05/06/22 08:43:14,2022-02-25,2022-05-13,59.0
1041,6551,5078,2022-04-28,1,563742,11.03,0,18331.0,16,05/06/22 09:00:21,2022-03-14,2022-06-10,45.0
1042,6552,5066,2022-04-30,1,332409,19.84,0,19205.0,16,05/16/22 14:39:25,2022-02-24,2022-05-20,65.0
1043,6553,5075,2022-04-30,1,427977,13.69,0,13668.0,16,05/16/22 14:42:27,2022-03-09,2022-06-02,52.0
1044,6554,5087,2022-05-01,1,523675,11.7,0,13832.0,16,05/27/22 11:43:11,2022-03-18,2022-06-08,44.0
1045,6555,5078,2022-05-04,1,524571,12.82,0,20488.0,16,05/18/22 10:40:50,2022-03-14,2022-06-10,51.0
1046,6556,5047,2022-04-27,0,1975875,21.17,0,145267.0,16,05/06/22 10:09:23,2022-02-11,2022-04-27,75.0
1047,6557,5041,2022-04-29,0,1035153,26.200001,0,102083.0,16,05/06/22 10:48:02,2022-02-08,2022-04-29,80.0
1048,6558,5040,2022-04-29,0,429773,26.030001,0,33777.0,16,05/16/22 14:49:43,2022-02-08,2022-04-29,80.0
1049,6559,5048,2022-05-01,0,1431802,21.33,0,108147.0,16,05/27/22 11:24:38,2022-02-09,2022-05-01,81.0
1050,6560,5049,2022-05-04,0,826724,21.030001,0,63716.0,16,05/16/22 14:32:25,2022-02-10,2022-05-04,83.0
1051,6561,5039,2022-05-06,0,981294,25.5,0,92654.0,16,05/16/22 14:33:27,2022-02-07,2022-05-06,88.0
1052,6562,5099,2022-04-26,0,1361111,0.54000002,0,0.0,16,05/06/22 11:31:16,2022-04-05,2022-04-26,21.0
1053,6563,5097,2022-04-26,0,878788,0.66000003,0,0.0,16,05/06/22 11:35:53,2022-04-05,2022-04-26,21.0
1054,6564,5106,2022-05-04,0,2084211,0.56999999,0,0.0,16,05/06/22 11:42:16,2022-04-14,2022-05-04,20.0
1055,6565,5104,2022-05-03,0,748000,0.5,0,0.0,16,05/06/22 11:44:47,2022-04-14,2022-05-03,19.0
1056,6566,5108,2022-05-05,0,5445833,0.23999999,0,0.0,16,05/06/22 11:48:38,2022-04-20,2022-05-05,15.0
1057,6567,5063,2022-05-11,0,566852,23.379999,0,50238.0,16,05/27/22 11:25:49,2022-02-16,2022-05-11,84.0
1058,6568,5067,2022-05-13,0,871531,21.99,0,65577.0,16,05/27/22 11:27:02,2022-02-25,2022-05-13,77.0
1059,6569,5050,2022-05-15,0,1254497,22.58,0,105928.0,16,05/27/22 11:28:03,2022-02-16,2022-05-15,88.0
1060,6570,5073,2022-05-12,1,293307,17.93,0,13361.0,16,05/31/22 19:04:09,2022-03-04,2022-06-04,69.0
1061,6571,5077,2022-05-12,1,194702,16.610001,0,9466.0,16,05/31/22 19:03:18,2022-03-13,2022-05-30,60.0
1062,6572,5107,2022-05-10,0,4871429,0.34999999,0,0.0,16,05/16/22 14:53:13,2022-04-20,2022-05-10,20.0
1063,6573,5084,2022-05-13,1,376207,19.67,0,24510.0,16,05/27/22 11:44:23,2022-03-16,2022-06-01,58.0
1064,6574,5117,2022-05-13,0,777273,0.22,0,0.0,16,05/16/22 15:20:26,2022-04-28,2022-05-13,15.0
1065,6575,5116,2022-05-13,0,900000,0.23,0,0.0,16,05/16/22 15:27:43,2022-04-28,2022-05-13,15.0
1066,6576,5105,2022-05-09,0,1688596,1.14,0,0.0,16,05/16/22 15:41:34,2022-04-14,2022-05-09,25.0
1067,6577,5124,2022-05-17,0,731250,0.63999999,0,0.0,16,05/27/22 11:10:20,2022-05-10,2022-05-17,7.0
1068,6578,5118,2022-05-18,0,836585,0.41,0,0.0,16,05/27/22 11:12:37,2022-04-28,2022-05-18,20.0
1069,6579,5119,2022-05-18,0,734146,0.41,0,0.0,16,05/27/22 11:14:24,2022-04-28,2022-05-18,20.0
1070,6580,5121,2022-05-19,0,2706667,0.44999999,0,0.0,16,05/27/22 11:18:57,2022-04-29,2022-05-19,20.0
1071,6581,5120,2022-05-23,0,969863,0.73000002,0,0.0,16,05/27/22 11:22:19,2022-04-28,2022-05-23,25.0
1072,6582,5074,2022-05-18,0,854481,19.75,0,49909.0,16,05/31/22 18:58:10,2022-03-09,2022-05-18,70.0
1073,6583,5066,2022-05-20,0,660491,24.450001,0,58060.0,16,05/31/22 18:59:04,2022-02-24,2022-05-20,85.0
1074,6584,5071,2022-05-24,0,1108163,23.030001,0,84000.0,16,06/06/22 15:41:55,2022-03-01,2022-05-24,84.0
1075,6585,5093,2022-05-20,1,626928,14.26,0,26334.0,16,06/06/22 15:45:40,2022-03-31,2022-06-29,50.0
1076,6586,5095,2022-05-21,1,552928,10.49,0,12922.0,16,06/19/22 11:01:48,2022-04-05,2022-07-06,46.0
1077,6587,5094,2022-05-21,1,439916,14.61,0,19965.0,16,06/06/22 13:37:48,2022-04-01,2022-06-27,50.0
1078,6588,5092,2022-05-24,1,522578,14.97,0,19423.0,16,06/06/22 15:32:11,2022-03-31,2022-06-30,54.0
1079,6589,5075,2022-05-26,1,318272,19.209999,0,15708.0,16,06/06/22 15:37:32,2022-03-09,2022-06-02,78.0
1080,6590,5073,2022-05-26,1,322543,21.469999,0,23495.0,16,06/19/22 11:03:50,2022-03-04,2022-06-04,83.0
1081,6591,5126,2022-05-24,0,1232143,1.12,0,0.0,16,05/27/22 11:53:51,2022-05-13,2022-05-24,11.0
1082,6592,5064,2022-05-27,0,1040027,24.77,0,89752.0,16,06/06/22 15:42:48,2022-02-22,2022-05-27,94.0
1083,6593,5085,2022-05-29,0,181791,23.139999,0,13562.0,16,06/06/22 15:43:31,2022-03-17,2022-05-29,73.0
1084,6594,5086,2022-05-29,0,193023,21.93,0,13635.0,16,06/19/22 10:09:02,2022-03-17,2022-05-29,73.0
1085,6595,5077,2022-05-30,0,937919,21.74,0,66401.0,16,06/06/22 15:44:45,2022-03-13,2022-05-30,78.0
1086,6596,5084,2022-05-28,1,175653,26.41,0,16588.0,16,06/06/22 15:39:09,2022-03-16,2022-06-01,73.0
1087,6597,5087,2022-05-28,1,316647,21.26,0,21704.0,16,06/19/22 11:07:19,2022-03-18,2022-06-08,71.0
1088,6598,5075,2022-05-30,1,379564,23.879999,0,30253.0,16,06/06/22 15:39:59,2022-03-09,2022-06-02,82.0
1089,6599,5132,2022-05-31,0,1339024,0.41,0,0.0,16,05/31/22 19:07:50,2022-05-12,2022-05-31,19.0
1090,6600,5134,2022-06-01,0,1647222,0.36000001,0,0.0,16,06/06/22 13:32:35,2022-05-12,2022-06-01,20.0
1091,6601,5084,2022-06-01,0,1168451,25.16,0,106420.0,16,06/19/22 10:12:11,2022-03-16,2022-06-01,77.0
1092,6602,5075,2022-06-02,0,861176,25.5,0,64288.0,16,06/27/22 16:59:11,2022-03-09,2022-06-02,85.0
1093,6603,5073,2022-06-04,0,664226,23.9,0,54598.0,16,06/19/22 10:14:06,2022-03-04,2022-06-04,92.0
1094,6604,5087,2022-06-08,0,690364,25.07,0,60667.0,16,06/19/22 10:28:09,2022-03-18,2022-06-08,82.0
1095,6605,5078,2022-06-10,0,817678,25.059999,0,69282.0,16,06/19/22 10:50:56,2022-03-14,2022-06-10,88.0
1096,6606,5130,2022-06-11,0,217,4.5999999,0,0.0,16,06/19/22 12:27:55,2022-05-23,2022-06-11,19.0
1097,6607,5101,2022-06-08,1,294358,13.06,0,8876.0,16,06/27/22 16:50:49,2022-04-13,2022-07-20,56.0
1098,6608,5102,2022-06-09,1,238636,14.58,0,9254.0,16,06/27/22 16:52:06,2022-04-13,2022-07-16,57.0
1099,6609,5103,2022-06-09,1,354032,15.07,0,14182.0,16,06/27/22 16:53:20,2022-04-14,2022-07-08,56.0
1100,6610,5096,2022-06-10,1,153710,21.530001,0,11090.0,16,06/19/22 11:12:53,2022-04-05,2022-07-05,66.0
1101,6611,5100,2022-06-10,1,211915,21.74,0,15163.0,16,06/19/22 11:13:43,2022-04-06,2022-07-07,65.0
1102,6612,5092,2022-06-11,1,218421,20.82,0,14053.0,16,06/19/22 11:14:50,2022-03-31,2022-06-30,72.0
1103,6613,5093,2022-06-12,1,247703,22.110001,0,16984.0,16,06/19/22 11:15:36,2022-03-31,2022-06-29,73.0
1104,6614,5094,2022-06-12,1,223783,22.01,0,15854.0,16,06/19/22 11:17:17,2022-04-01,2022-06-27,72.0
1105,6615,5101,2022-06-14,1,220076,15.56,0,8426.0,16,07/12/22 21:34:41,2022-04-13,2022-07-20,62.0
1106,6616,5136,2022-06-03,0,1404167,0.23999999,0,0.0,16,06/19/22 11:21:23,2022-05-16,2022-06-03,18.0
1107,6617,5133,2022-06-07,0,2389552,0.67000002,0,0.0,16,06/19/22 11:27:00,2022-05-12,2022-06-07,26.0
1108,6618,5135,2022-06-08,0,1930435,0.69,0,0.0,16,06/19/22 12:13:51,2022-05-16,2022-06-08,23.0
1109,6619,5138,2022-06-09,0,500000,0.079999998,0,0.0,16,06/19/22 12:16:38,2022-05-27,2022-06-09,13.0
1110,6620,5139,2022-06-15,0,1856000,0.25,0,0.0,16,06/21/22 08:46:53,2022-05-27,2022-06-15,19.0
1111,6621,5140,2022-06-16,0,1684000,0.25,0,0.0,16,06/21/22 08:48:40,2022-05-28,2022-06-16,19.0
1112,6622,5095,2022-06-15,1,444693,17.98,0,26072.0,16,07/12/22 21:11:22,2022-04-05,2022-07-06,71.0
1113,6623,5092,2022-06-16,1,399684,21.690001,0,31722.0,16,07/12/22 21:09:42,2022-03-31,2022-06-30,77.0
1114,6624,5093,2022-06-17,1,198469,23.040001,0,16898.0,16,07/12/22 21:07:54,2022-03-31,2022-06-29,78.0
1115,6625,5096,2022-06-17,1,233178,22.219999,0,19398.0,16,07/12/22 21:13:47,2022-04-05,2022-07-05,73.0
1116,6626,5094,2022-06-18,1,215037,22.370001,0,17588.0,16,07/12/22 21:14:40,2022-04-01,2022-06-27,78.0
1117,6627,5100,2022-06-18,1,94485,24.26,0,8337.0,16,07/12/22 21:16:14,2022-04-06,2022-07-07,73.0
1118,6628,5094,2022-06-21,1,122914,23.1,0,10610.0,16,07/12/22 21:05:27,2022-04-01,2022-06-27,81.0
1119,6629,5102,2022-06-26,1,168562,19.780001,0,10337.0,16,07/12/22 21:17:30,2022-04-13,2022-07-16,74.0
1120,6630,5103,2022-06-26,1,219782,22.219999,0,16933.0,16,07/12/22 21:18:11,2022-04-14,2022-07-08,73.0
1121,6631,5113,2022-06-26,1,587592,15.82,0,26646.0,16,07/12/22 21:18:50,2022-05-04,2022-08-16,53.0
1122,6632,5094,2022-06-27,0,530678,27.120001,0,50114.0,16,06/27/22 17:03:54,2022-04-01,2022-06-27,87.0
1123,6633,5141,2022-06-14,0,623077,0.13,0,0.0,16,06/28/22 14:21:50,2022-05-28,2022-06-14,17.0
1124,6634,5142,2022-06-14,0,620000,0.15000001,0,0.0,16,06/28/22 14:22:41,2022-05-28,2022-06-14,17.0
1125,6635,5143,2022-06-14,0,494444,0.18000001,0,0.0,16,06/28/22 14:23:18,2022-05-28,2022-06-14,17.0
1126,6636,5125,2022-06-27,1,408136,16.200001,0,19459.0,16,07/12/22 21:19:28,2022-05-09,2022-08-10,49.0
1127,6637,5115,2022-06-27,1,797946,12.82,0,23932.0,16,07/12/22 21:20:14,2022-05-05,2022-08-12,53.0
1128,6638,5093,2022-06-29,0,768433,28.639999,0,87524.0,16,07/12/22 21:07:29,2022-03-31,2022-06-29,90.0
1129,6639,5092,2022-06-30,0,828193,28.379999,0,96000.0,16,07/12/22 21:08:48,2022-03-31,2022-06-30,91.0
1130,6640,5112,2022-06-29,1,212007,18.540001,0,12655.0,16,07/12/22 21:21:08,2022-04-26,2022-07-19,64.0
1131,6641,5110,2022-06-30,1,180685,18.719999,0,10649.0,16,07/12/22 21:22:34,2022-04-26,2022-07-17,65.0
1132,6642,5109,2022-06-30,1,201854,20.5,0,15019.0,16,07/12/22 21:23:25,2022-04-22,2022-07-16,69.0
1133,6643,5111,2022-07-01,1,160373,19.34,0,10297.0,16,07/12/22 21:24:42,2022-04-26,2022-07-17,66.0
1134,6644,5123,2022-07-02,1,371143,13.36,0,12736.0,16,07/19/22 13:38:36,2022-05-10,2022-08-13,53.0
1135,6645,5122,2022-07-02,1,321504,13.24,0,11136.0,16,07/19/22 13:39:19,2022-05-10,2022-08-14,53.0
1136,6646,5115,2022-07-03,1,622140,14.32,0,24655.0,16,07/12/22 21:26:47,2022-05-05,2022-08-12,59.0
1137,6647,5122,2022-07-03,1,410509,13.22,0,14324.0,16,07/12/22 21:28:02,2022-05-10,2022-08-14,54.0
1138,6648,5114,2022-07-03,1,149689,17.41,0,8092.0,16,07/19/22 13:39:55,2022-05-03,2022-08-04,61.0
1139,6649,5129,2022-07-04,1,423823,13.51,0,15005.0,16,07/19/22 13:40:44,2022-05-19,2022-08-16,46.0
1140,6650,5131,2022-07-05,1,329598,13.17,0,11406.0,16,07/19/22 13:41:38,2022-05-24,2022-09-09,42.0
1141,6651,5127,2022-07-06,1,152732,15.55,0,6792.0,16,07/19/22 19:22:52,2022-05-17,2022-08-11,50.0
1142,6652,5113,2022-07-11,1,354607,18.6,0,17460.0,16,07/24/22 16:41:01,2022-05-04,2022-08-16,68.0
1143,6653,5096,2022-07-05,0,597379,28.58,0,67144.0,16,07/19/22 13:22:00,2022-04-05,2022-07-05,91.0
1144,6654,5095,2022-07-06,0,1104043,26.190001,0,120411.0,16,07/19/22 13:21:03,2022-04-05,2022-07-06,92.0
1145,6655,5100,2022-07-07,0,566357,29.27,0,73333.0,16,07/19/22 13:19:53,2022-04-06,2022-07-07,92.0
1146,6656,5103,2022-07-08,0,705266,21.690001,0,61974.0,16,07/19/22 13:18:42,2022-04-14,2022-07-08,85.0
1147,6657,5150,2022-07-07,0,4434286,0.34999999,0,0.0,16,07/12/22 21:35:36,2022-06-12,2022-07-07,25.0
1148,6658,5151,2022-07-08,0,1921875,0.31999999,0,0.0,16,07/12/22 21:38:38,2022-06-12,2022-07-08,26.0
1149,6659,5125,2022-07-11,1,275892,17.940001,0,13205.0,16,07/24/22 16:42:18,2022-05-09,2022-08-10,63.0
1150,6660,5115,2022-07-13,1,524138,14.69,0,23570.0,16,07/19/22 19:25:31,2022-05-05,2022-08-12,69.0
1151,6661,5122,2022-07-13,1,213548,15.28,0,9210.0,16,07/24/22 16:42:50,2022-05-10,2022-08-14,64.0
1152,6662,5102,2022-07-16,0,577888,23.92,0,57646.0,16,07/24/22 16:46:58,2022-04-13,2022-07-16,94.0
1153,6663,5109,2022-07-16,0,469111,23.92,0,43711.0,16,07/24/22 16:48:11,2022-04-22,2022-07-16,85.0
1154,6664,5110,2022-07-17,0,379935,24.129999,0,35339.0,16,08/01/22 17:52:24,2022-04-26,2022-07-17,82.0
1155,6665,5111,2022-07-17,0,308044,23.0,0,26445.0,16,08/01/22 17:53:17,2022-04-26,2022-07-17,82.0
1156,6666,5112,2022-07-19,0,477404,21.280001,0,39952.0,16,08/01/22 17:54:10,2022-04-26,2022-07-19,84.0
1157,6667,5161,2022-07-19,0,615625,0.31999999,0,0.0,16,07/24/22 14:11:59,2022-06-25,2022-07-19,24.0
1158,6668,5163,2022-07-20,0,3596429,0.28,0,0.0,16,07/24/22 14:13:37,2022-06-26,2022-07-20,24.0
1159,6669,5160,2022-07-21,0,842424,0.33000001,0,0.0,16,07/24/22 14:23:21,2022-06-25,2022-07-21,26.0
1160,6670,5164,2022-07-21,0,1200000,0.23999999,0,0.0,16,07/24/22 14:29:31,2022-06-28,2022-07-21,23.0
1161,6671,5162,2022-07-22,0,692000,0.5,0,0.0,16,07/24/22 15:53:34,2022-06-25,2022-07-22,27.0
1162,6672,5159,2022-07-23,0,3945000,0.40000001,0,0.0,16,07/26/22 11:37:21,2022-06-25,2022-07-23,28.0
1163,6673,5101,2022-07-20,0,618466,25.290001,0,66938.0,16,08/01/22 17:55:02,2022-04-13,2022-07-20,98.0
1164,6674,5114,2022-07-19,1,81223,20.65,0,5133.0,16,08/01/22 17:47:57,2022-05-03,2022-08-04,77.0
1165,6675,5125,2022-07-21,1,247139,21.15,0,18698.0,16,08/18/22 10:11:35,2022-05-09,2022-08-10,73.0
1166,6676,5122,2022-07-21,1,201593,18.139999,0,9784.0,16,08/01/22 17:51:11,2022-05-10,2022-08-14,72.0
1167,6677,5115,2022-07-22,1,455061,17.98,0,29284.0,16,08/18/22 10:12:43,2022-05-05,2022-08-12,78.0
1168,6678,5113,2022-07-23,1,215742,21.799999,0,19528.0,16,08/18/22 10:13:33,2022-05-04,2022-08-16,80.0
1169,6679,5129,2022-07-24,1,401669,17.35,0,17285.0,16,08/18/22 10:17:29,2022-05-19,2022-08-16,66.0
1170,6680,5131,2022-07-24,1,186365,18.49,0,12727.0,16,08/18/22 10:18:07,2022-05-24,2022-09-09,61.0
1171,6681,5123,2022-07-25,1,203226,18.860001,0,14385.0,16,08/18/22 10:18:47,2022-05-10,2022-08-13,76.0
1172,6682,5127,2022-07-25,1,133772,21.34,0,11518.0,16,08/18/22 10:19:26,2022-05-17,2022-08-11,69.0
1173,6683,5137,2022-07-28,1,274240,14.6,0,11777.0,16,08/18/22 10:20:22,2022-05-31,2022-09-23,58.0
1174,6684,5146,2022-07-28,1,591422,13.01,0,22396.0,16,08/18/22 10:21:30,2022-06-07,2022-09-11,51.0
1175,6685,5115,2022-07-29,1,431119,21.780001,0,35886.0,16,08/18/22 10:22:21,2022-05-05,2022-08-12,85.0
1176,6686,5144,2022-07-29,1,314243,15.58,0,16143.0,16,08/29/22 15:42:00,2022-06-01,2022-09-13,58.0
1177,6687,5147,2022-07-29,1,388885,15.28,0,19237.0,16,08/18/22 10:24:11,2022-06-08,2022-09-22,51.0
1178,6688,5145,2022-07-30,1,273433,15.4,0,13945.0,16,08/18/22 10:24:49,2022-06-03,2022-09-08,57.0
1179,6689,5146,2022-08-15,1,346479,17.040001,0,19991.0,16,08/29/22 15:36:56,2022-06-07,2022-09-11,69.0
1180,6690,5114,2022-08-04,0,444512,24.6,0,45632.0,16,08/18/22 10:26:13,2022-05-03,2022-08-04,93.0
1181,6691,5128,2022-08-09,0,798649,26.85,0,94868.0,16,08/18/22 10:27:07,2022-05-18,2022-08-09,83.0
1182,6692,5125,2022-08-10,0,794539,26.790001,0,92906.0,16,08/18/22 10:28:00,2022-05-09,2022-08-10,93.0
1183,6693,5129,2022-08-16,0,1268700,23.799999,0,121645.0,16,08/29/22 15:39:53,2022-05-19,2022-08-16,89.0
1184,6694,5122,2022-08-14,0,1341597,25.58,0,142925.0,16,08/29/22 15:38:04,2022-05-10,2022-08-14,96.0
1185,6695,5113,2022-08-16,0,979481,28.889999,0,130266.0,16,08/29/22 15:40:37,2022-05-04,2022-08-16,104.0
1186,6696,5127,2022-08-11,0,387278,25.290001,0,41423.0,16,08/18/22 10:32:02,2022-05-17,2022-08-11,86.0
1187,6697,5123,2022-08-13,0,637391,26.09,0,70816.0,16,08/29/22 15:36:18,2022-05-10,2022-08-13,95.0
1188,6698,5115,2022-08-12,0,1582901,24.68,0,161702.0,16,08/29/22 15:34:44,2022-05-05,2022-08-12,99.0
1189,6699,5181,2022-08-16,0,727586,0.28999999,0,0.0,16,08/18/22 10:37:04,2022-07-26,2022-08-16,21.0
1190,6700,5178,2022-08-16,0,706897,0.28999999,0,0.0,16,08/18/22 10:39:34,2022-07-25,2022-08-16,22.0
1191,6701,5175,2022-08-17,0,3355263,0.38,0,0.0,16,08/18/22 10:40:46,2022-07-25,2022-08-17,23.0
1192,6702,5179,2022-08-18,0,3712195,0.41,0,0.0,16,08/18/22 10:42:25,2022-07-26,2022-08-18,23.0
1193,6703,5176,2022-08-19,0,2921739,0.46000001,0,0.0,16,08/29/22 13:47:08,2022-07-25,2022-08-19,25.0
1194,6704,5180,2022-08-20,0,1840000,0.44999999,0,0.0,16,08/29/22 14:41:06,2022-07-26,2022-08-20,25.0
1195,6705,5177,2022-08-21,0,1512698,0.63,0,0.0,16,08/29/22 15:17:42,2022-07-25,2022-08-21,27.0
1196,6706,5187,2022-08-25,0,1342857,0.20999999,0,0.0,16,08/29/22 15:45:50,2022-08-09,2022-08-25,16.0
1197,6707,5153,2022-08-27,1,485828,16.709999,0,26655.0,16,09/10/22 17:37:10,2022-06-15,2022-09-27,73.0
1198,6708,5154,2022-08-27,1,429441,18.0,0,26460.0,16,09/10/22 17:37:35,2022-06-16,2022-09-28,72.0
1199,6709,5148,2022-09-06,1,65189,18.5,0,4010.0,16,09/12/22 19:13:01,2022-06-09,2022-09-29,89.0
1200,6710,5149,2022-09-06,1,65731,17.450001,0,3832.0,16,09/12/22 19:13:21,2022-06-09,2022-09-29,89.0
1201,6711,5157,2022-09-07,1,317976,18.58,0,19615.0,16,09/12/22 19:13:49,2022-07-07,2022-10-11,62.0
1202,6712,5156,2022-09-10,1,378273,22.0,0,34182.0,16,09/26/22 18:20:15,2022-07-07,2022-10-10,65.0
1203,6713,5145,2022-09-08,0,735388,28.879999,0,91295.0,16,09/26/22 18:15:23,2022-06-03,2022-09-08,97.0
1204,6714,5131,2022-09-09,0,553527,34.73,0,94558.0,16,09/26/22 18:16:08,2022-05-24,2022-09-09,108.0
1205,6715,5146,2022-09-11,0,1114185,27.0,0,127071.0,16,09/28/22 14:50:01,2022-06-07,2022-09-11,96.0
1206,6716,5137,2022-09-11,1,200307,29.299999,0,28039.0,16,09/26/22 18:20:44,2022-05-31,2022-09-23,103.0
1207,6717,5158,2022-09-11,1,290924,18.620001,0,19706.0,16,09/26/22 18:21:12,2022-07-08,2022-10-12,65.0
1208,6718,5152,2022-09-12,1,215500,18.0,0,14112.0,16,09/26/22 18:21:39,2022-06-12,2022-10-07,92.0
1209,6719,5196,2022-09-13,0,921905,2.0999999,0,0.0,16,09/20/22 15:46:35,2022-08-25,2022-09-13,19.0
1210,6720,5192,2022-09-13,0,1235556,0.44999999,0,0.0,16,09/20/22 15:47:37,2022-08-20,2022-09-13,24.0
1211,6721,5195,2022-09-16,0,1931818,0.22,0,0.0,16,09/20/22 15:51:21,2022-08-26,2022-09-16,21.0
1212,6722,5144,2022-09-13,0,784234,31.459999,0,113381.0,16,09/26/22 18:17:51,2022-06-01,2022-09-13,104.0
1213,6723,5147,2022-09-22,0,954488,34.98,0,166217.0,16,10/03/22 10:08:29,2022-06-08,2022-09-22,106.0
1214,6724,5137,2022-09-23,0,528138,32.66,0,80001.0,16,10/03/22 10:24:49,2022-05-31,2022-09-23,115.0
1215,6725,5155,2022-09-24,0,651187,30.75,0,86245.0,16,10/03/22 10:26:59,2022-06-14,2022-09-24,102.0
1216,6726,5174,2022-09-20,1,194118,19.209999,0,14081.0,16,10/03/22 10:37:10,2022-07-23,2022-10-21,59.0
1217,6727,5166,2022-09-21,1,295543,17.5,0,18460.0,16,10/03/22 10:39:36,2022-07-20,2022-10-24,63.0
1218,6728,5167,2022-09-21,1,317257,17.5,0,19447.0,16,10/03/22 10:41:25,2022-07-20,2022-10-22,63.0
1219,6729,5168,2022-09-22,1,283778,18.0,0,19007.0,16,10/03/22 10:43:36,2022-07-20,2022-10-21,64.0
1220,6730,5158,2022-09-23,1,241578,22.440001,0,22492.0,16,10/03/22 10:44:13,2022-07-08,2022-10-12,77.0
1221,6731,5174,2022-09-24,1,173714,19.629999,0,13422.0,16,10/03/22 10:38:16,2022-07-23,2022-10-21,63.0
1222,6732,5173,2022-09-25,1,571700,20.0,0,43095.0,16,10/13/22 19:15:38,2022-07-23,2022-10-23,64.0
1223,6733,5165,2022-09-25,1,152524,23.57,0,15375.0,16,10/13/22 19:16:13,2022-07-19,2022-10-06,68.0
1224,6734,5166,2022-09-26,1,130149,18.74,0,9316.0,16,10/13/22 19:16:58,2022-07-20,2022-10-24,68.0
1225,6735,5167,2022-09-26,1,101466,19.1,0,7321.0,16,10/13/22 19:18:02,2022-07-20,2022-10-22,68.0
1226,6736,5194,2022-09-20,0,2333333,0.44999999,0,0.0,16,09/26/22 18:29:41,2022-08-26,2022-09-20,25.0
1227,6737,5193,2022-09-27,0,3256667,0.89999998,0,0.0,16,10/03/22 10:03:24,2022-08-26,2022-09-27,32.0
1228,6738,5153,2022-09-27,0,932259,26.379999,0,105821.0,16,10/13/22 19:11:23,2022-06-15,2022-09-27,104.0
1229,6739,5154,2022-09-28,0,951043,26.370001,0,107502.0,16,10/13/22 19:12:12,2022-06-16,2022-09-28,104.0
1230,6740,5148,2022-09-29,0,108778,24.719999,0,11839.0,16,10/13/22 19:12:58,2022-06-09,2022-09-29,112.0
1231,6741,5149,2022-09-29,0,117510,25.299999,0,12798.0,16,10/13/22 19:13:37,2022-06-09,2022-09-29,112.0
1232,6742,5172,2022-09-30,0,522150,22.98,0,39177.0,16,10/13/22 19:14:26,2022-07-21,2022-09-30,71.0
1233,6743,5171,2022-09-30,0,252588,23.18,0,23348.0,16,10/13/22 19:14:53,2022-07-21,2022-09-30,71.0
1234,6744,5169,2022-10-01,0,238581,23.120001,0,21472.0,16,10/13/22 19:20:12,2022-07-21,2022-10-01,72.0
1235,6745,5170,2022-10-01,0,165726,24.1,0,17136.0,16,10/13/22 19:22:49,2022-07-21,2022-10-01,72.0
1236,6746,5165,2022-10-06,0,391015,26.6,0,44341.0,16,10/13/22 19:34:27,2022-07-19,2022-10-06,79.0
1237,6747,5152,2022-10-07,0,535407,27.0,0,60848.0,16,10/13/22 19:36:43,2022-06-12,2022-10-07,117.0
1238,6748,5156,2022-10-10,0,958635,31.5,0,139324.0,16,10/25/22 15:22:17,2022-07-07,2022-10-10,95.0
1239,6749,5157,2022-10-11,0,1054070,28.5,0,135363.0,16,10/25/22 15:23:12,2022-07-07,2022-10-11,96.0
1240,6750,5201,2022-10-06,0,954839,0.31,0,0.0,16,10/13/22 19:41:00,2022-09-15,2022-10-06,21.0
1241,6751,5202,2022-10-06,0,737500,0.31999999,0,0.0,16,10/13/22 19:42:25,2022-09-15,2022-10-06,21.0
1242,6752,5200,2022-10-07,0,1854286,0.34999999,0,0.0,16,10/13/22 19:43:00,2022-09-15,2022-10-07,22.0
1243,6753,5209,2022-10-08,0,1163636,0.11,0,0.0,16,10/13/22 19:43:36,2022-09-24,2022-10-08,14.0
1244,6754,5208,2022-10-09,0,816667,0.12,0,0.0,16,10/13/22 19:44:08,2022-09-24,2022-10-09,15.0
1245,6755,5210,2022-10-10,0,1140000,0.2,0,0.0,16,10/13/22 19:45:12,2022-09-24,2022-10-10,16.0
1246,6756,5158,2022-10-12,0,586918,30.5,0,80086.0,16,10/25/22 15:24:08,2022-07-08,2022-10-12,96.0
1247,6757,5206,2022-10-13,0,926087,0.23,0,0.0,16,10/17/22 14:13:32,2022-09-24,2022-10-13,19.0
1248,6758,5207,2022-10-14,0,1590625,0.31999999,0,0.0,16,10/17/22 14:14:04,2022-09-24,2022-10-14,20.0
1249,6759,5174,2022-10-21,0,509946,29.66,0,69406.0,16,10/31/22 10:16:55,2022-07-23,2022-10-21,90.0
1250,6760,5168,2022-10-21,0,454891,27.6,0,53600.0,16,10/31/22 10:17:57,2022-07-20,2022-10-21,93.0
1251,6761,5167,2022-10-22,0,464021,28.6,0,58606.0,16,10/31/22 10:18:33,2022-07-20,2022-10-22,94.0
1252,6762,5173,2022-10-23,0,914000,24.0,0,99843.0,16,10/31/22 10:19:05,2022-07-23,2022-10-23,92.0
1253,6763,5166,2022-10-24,0,337088,28.5,0,43247.0,16,11/09/22 15:46:54,2022-07-20,2022-10-24,96.0
1254,6764,5185,2022-10-19,1,325897,17.84,0,19763.0,16,10/31/22 10:20:28,2022-08-18,2022-11-11,62.0
1255,6765,5188,2022-10-19,1,198426,17.15,0,11242.0,16,10/31/22 10:20:55,2022-08-19,2022-11-08,61.0
1256,6766,5190,2022-10-20,1,217114,17.120001,0,9674.0,16,10/31/22 10:21:22,2022-08-19,2022-11-15,62.0
1257,6767,5184,2022-10-26,1,406958,24.0,0,37555.0,16,11/09/22 15:47:36,2022-08-17,2022-11-09,70.0
1258,6768,5182,2022-10-18,1,101649,18.799999,0,6663.0,16,10/31/22 10:19:57,2022-08-16,2022-11-10,63.0
1259,6769,5188,2022-10-27,1,177704,19.6,0,12535.0,16,11/09/22 15:49:37,2022-08-19,2022-11-08,69.0
1260,6771,5230,2022-10-27,0,1800000,0.13,0,0.0,16,11/09/22 14:41:52,2022-10-11,2022-10-27,16.0
1261,6773,5229,2022-10-28,0,4044444,0.18000001,0,0.0,16,11/09/22 14:47:47,2022-10-10,2022-10-28,18.0
1262,6774,5224,2022-11-01,0,480000,0.25,0,0.0,16,11/09/22 14:53:19,2022-10-10,2022-11-01,22.0
1263,6775,5223,2022-11-02,0,3779310,0.28999999,0,0.0,16,11/09/22 14:55:12,2022-10-10,2022-11-02,23.0
1264,6776,5189,2022-11-07,0,1063736,26.5,0,98546.0,16,11/28/22 17:09:53,2022-08-19,2022-11-07,80.0
1265,6777,5188,2022-11-08,0,873377,22.799999,0,68016.0,16,12/01/22 08:56:13,2022-08-19,2022-11-08,81.0
1266,6778,5184,2022-11-09,0,1735971,27.549999,0,180080.0,16,12/01/22 08:58:05,2022-08-17,2022-11-09,84.0
1267,6779,5182,2022-11-10,0,508490,24.5,0,43621.0,16,12/01/22 08:59:09,2022-08-16,2022-11-10,86.0
1268,6780,5185,2022-11-11,0,1552571,24.5,0,133401.0,16,12/01/22 10:43:29,2022-08-18,2022-11-11,85.0
1269,6781,5197,2022-11-12,0,673191,23.5,0,52291.0,16,12/01/22 10:46:41,2022-09-13,2022-11-12,60.0
1270,6782,5186,2022-11-13,0,858720,25.0,0,76042.0,16,12/01/22 10:48:01,2022-08-18,2022-11-13,87.0
1271,6783,5183,2022-11-14,0,542077,26.0,0,52437.0,16,12/01/22 10:49:28,2022-08-16,2022-11-14,90.0
1272,6784,5190,2022-11-15,0,1247519,27.0,0,125647.0,16,12/01/22 10:51:23,2022-08-19,2022-11-15,88.0
1273,6785,5191,2022-11-16,0,1292154,26.0,0,113053.0,16,12/01/22 12:03:05,2022-08-20,2022-11-16,88.0
1274,6786,5228,2022-11-15,0,2345000,0.2,0,0.0,16,12/01/22 10:59:15,2022-10-21,2022-11-15,25.0
1275,6787,5227,2022-11-16,0,1844444,0.27000001,0,0.0,16,12/01/22 11:20:59,2022-10-21,2022-11-16,26.0
1276,6788,5231,2022-11-19,0,1785000,0.2,0,0.0,16,12/01/22 11:28:23,2022-10-27,2022-11-19,23.0
1277,6789,5234,2022-11-24,0,1154545,0.22,0,0.0,16,12/01/22 11:49:31,2022-11-05,2022-11-24,19.0
1278,6790,5241,2022-11-24,0,3681818,0.22,0,0.0,16,12/01/22 11:51:16,2022-11-05,2022-11-24,19.0
1279,6791,5232,2022-11-25,0,1614286,0.20999999,0,0.0,16,12/01/22 11:52:47,2022-11-05,2022-11-25,20.0
1280,6792,5233,2022-11-25,0,1266667,0.23999999,0,0.0,16,12/01/22 11:54:28,2022-11-05,2022-11-25,20.0
1281,6793,5243,2022-12-01,0,4334615,0.25999999,0,0.0,16,12/01/22 11:58:18,2022-11-10,2022-12-01,21.0
1282,6794,5242,2022-12-02,0,2321622,0.37,0,0.0,16,12/12/22 14:16:56,2022-11-10,2022-12-02,22.0
1283,6795,5250,2022-12-08,0,921739,0.23,0,0.0,16,12/12/22 14:19:00,2022-11-21,2022-12-08,17.0
1284,6796,5249,2022-12-09,0,869565,0.23,0,0.0,16,12/12/22 14:22:28,2022-11-21,2022-12-09,18.0
1285,6797,5198,2022-12-08,0,1118365,26.299999,0,94187.0,16,12/22/22 08:26:51,2022-09-13,2022-12-08,86.0
1286,6798,5199,2022-12-05,1,476280,25.0,0,35593.0,16,12/12/22 17:22:18,2022-09-16,2022-12-20,80.0
1287,6799,5212,2022-12-18,0,882404,28.700001,0,90208.0,16,12/22/22 08:27:49,2022-09-27,2022-12-18,82.0
1288,6800,5211,2022-12-21,0,1590077,27.309999,0,147798.0,16,01/04/23 11:01:00,2022-09-27,2022-12-21,85.0
1289,6801,5199,2022-12-20,0,712814,29.5,0,73896.0,16,01/04/23 11:00:09,2022-09-16,2022-12-20,95.0
1290,6802,5216,2022-12-16,1,433895,19.0,0,24464.0,16,12/22/22 08:35:37,2022-10-06,2023-01-21,71.0
1291,6803,5213,2022-12-16,1,374785,18.6,0,20888.0,16,12/22/22 08:36:12,2022-10-06,2023-01-20,71.0
1292,6804,5252,2022-12-13,0,1481818,0.22,0,0.0,16,12/22/22 08:37:16,2022-11-25,2022-12-13,18.0
1293,6805,5251,2022-12-26,0,1167961,1.03,0,0.0,16,01/04/23 10:12:27,2022-11-25,2022-12-26,31.0
1294,6806,5259,2022-12-28,0,3602632,1.14,0,0.0,16,01/04/23 10:54:28,2022-11-28,2022-12-28,30.0
1295,6807,5203,2022-12-22,1,1103011,26.9,0,102134.0,16,01/04/23 10:59:23,2022-09-20,2022-12-28,93.0
1296,6808,5203,2022-12-28,0,258551,28.0,0,25466.0,16,01/04/23 11:08:22,2022-09-20,2022-12-28,99.0
1297,6809,5225,2023-01-02,1,148876,25.799999,0,13562.0,16,01/10/23 11:50:08,2022-10-13,2023-02-04,81.0
1298,6810,5226,2023-01-03,1,532245,20.219999,0,35151.0,16,01/10/23 12:26:38,2022-10-14,2023-01-26,81.0
1299,6811,5216,2023-01-04,1,289136,22.0,0,22662.0,16,01/10/23 12:27:06,2022-10-06,2023-01-21,90.0
1300,6812,5213,2023-01-04,1,231591,26.780001,0,22055.0,16,01/10/23 12:27:35,2022-10-06,2023-01-20,90.0
1301,6813,5253,2022-12-30,0,2132258,1.24,0,0.0,16,01/04/23 11:22:34,2022-11-25,2022-12-30,35.0
1302,6814,5219,2023-01-07,0,193826,23.0,0,14219.0,16,01/20/23 09:21:51,2022-10-08,2023-01-07,91.0
1303,6815,5217,2023-01-08,0,170435,23.0,0,12380.0,16,01/20/23 09:22:14,2022-10-08,2023-01-08,92.0
1304,6816,5237,2023-01-05,1,337602,19.6,0,21230.0,16,01/10/23 12:28:06,2022-10-28,2023-02-03,69.0
1305,6817,5236,2023-01-05,1,275022,23.219999,0,21542.0,16,01/10/23 12:28:32,2022-10-28,2023-01-29,69.0
1306,6818,5235,2023-01-06,1,231354,19.200001,0,13668.0,16,01/20/23 09:23:31,2022-10-27,2023-02-04,71.0
1307,6819,5218,2023-01-09,1,172560,25.0,0,14224.0,16,01/20/23 09:24:08,2022-10-08,2023-01-24,93.0
1308,6820,5266,2023-01-09,0,1885714,0.20999999,0,0.0,16,01/20/23 09:15:25,2022-12-24,2023-01-09,16.0
1309,6821,5213,2023-01-20,0,560860,31.4,0,69711.0,16,01/28/23 19:23:56,2022-10-06,2023-01-20,106.0
1310,6822,5220,2023-01-10,1,134411,26.299999,0,12382.0,16,01/20/23 09:24:37,2022-10-09,2023-01-25,93.0
1311,6823,5221,2023-01-11,1,93448,29.0,0,10320.0,16,01/20/23 09:25:13,2022-10-10,2023-01-27,93.0
1312,6824,5222,2023-01-12,1,91000,30.0,0,10529.0,16,01/20/23 09:25:45,2022-10-10,2023-01-23,94.0
1313,6825,5247,2023-01-19,1,261680,17.379999,0,14916.0,16,01/28/23 19:21:02,2022-11-16,2023-02-18,64.0
1314,6826,5238,2023-01-19,1,93033,24.4,0,8659.0,16,01/28/23 19:21:39,2022-11-01,2023-02-01,79.0
1315,6827,5244,2023-01-20,1,161497,16.700001,0,8370.0,16,01/28/23 19:22:19,2022-11-15,2023-02-20,66.0
1316,6828,5216,2023-01-21,0,591051,31.4,0,74997.0,16,01/28/23 19:24:33,2022-10-06,2023-01-21,107.0
1317,6829,5222,2023-01-23,0,146022,31.549999,0,18490.0,16,02/06/23 18:56:06,2022-10-10,2023-01-23,105.0
1318,6830,5218,2023-01-24,0,342415,26.5,0,33864.0,16,02/06/23 18:56:26,2022-10-08,2023-01-24,108.0
1319,6831,5248,2023-01-21,1,210466,17.389999,0,10974.0,16,01/28/23 19:23:15,2022-11-19,2023-02-16,63.0
1320,6832,5256,2023-01-23,1,295833,18.0,0,15043.0,16,02/06/23 18:59:47,2022-11-25,2023-02-24,59.0
1321,6833,5246,2023-01-24,1,180162,18.5,0,10108.0,16,02/06/23 19:00:32,2022-11-15,2023-02-20,70.0
1322,6834,5220,2023-01-25,0,354767,30.0,0,41216.0,16,02/06/23 18:56:45,2022-10-09,2023-01-25,108.0
1323,6835,5226,2023-01-26,0,856545,27.5,0,89953.0,16,02/06/23 18:58:20,2022-10-14,2023-01-26,104.0
1324,6836,5221,2023-01-27,0,219224,32.200001,0,28388.0,16,02/06/23 18:58:39,2022-10-10,2023-01-27,109.0
1325,6837,5236,2023-01-29,0,893270,31.5,0,114525.0,16,02/06/23 18:59:07,2022-10-28,2023-01-29,93.0
1326,6838,5255,2023-01-27,1,250197,20.299999,0,17735.0,16,02/06/23 19:01:00,2022-11-24,2023-02-11,64.0
1327,6839,5238,2023-02-01,0,469928,27.9,0,50797.0,16,03/01/23 08:47:21,2022-11-01,2023-02-01,92.0
1328,6840,5239,2023-02-02,0,432968,31.0,0,54879.0,16,03/01/23 08:47:54,2022-11-02,2023-02-02,92.0
1329,6841,5215,2023-02-02,0,22515,37.529999,0,4120.0,16,03/01/23 08:48:15,2022-10-06,2023-02-02,119.0
1330,6842,5214,2023-02-02,0,18983,35.400002,0,3183.0,16,03/01/23 08:48:56,2022-10-06,2023-02-02,119.0
1331,6843,5237,2023-02-03,0,926860,29.299999,0,106309.0,16,03/01/23 08:49:25,2022-10-28,2023-02-03,98.0
1332,6844,5204,2023-02-03,0,19822,39.299999,0,3848.0,16,03/01/23 08:50:26,2022-09-20,2023-02-03,136.0
1333,6845,5205,2023-02-03,0,14559,39.700001,0,3049.0,16,03/01/23 08:50:06,2022-09-20,2023-02-03,136.0
1334,6846,5225,2023-02-04,0,516697,33.0,0,74852.0,16,03/01/23 08:52:03,2022-10-13,2023-02-04,114.0
1335,6847,5235,2023-02-04,0,923298,28.200001,0,101278.0,16,03/01/23 08:52:30,2022-10-27,2023-02-04,100.0
1336,6848,5240,2023-02-06,0,531247,37.220001,0,95269.0,16,03/01/23 08:53:06,2022-11-02,2023-02-06,96.0
1337,6849,5255,2023-02-05,1,358093,22.860001,0,30266.0,16,03/01/23 08:58:56,2022-11-24,2023-02-11,73.0
1338,6850,5265,2023-01-25,0,1516190,2.0999999,0,0.0,16,02/06/23 19:02:58,2022-12-23,2023-01-25,33.0
1339,6851,5264,2023-01-25,0,1580000,2.25,0,0.0,16,02/06/23 19:06:17,2022-12-23,2023-01-25,33.0
1340,6852,5257,2023-02-08,1,342708,18.24,0,19806.0,16,03/01/23 09:00:14,2022-12-01,2023-02-18,69.0
1341,6853,5263,2023-02-09,0,1408276,14.5,0,42086.0,16,03/01/23 08:54:39,2022-12-13,2023-02-09,58.0
1342,6854,5255,2023-02-11,0,1589111,22.5,0,131077.0,16,03/01/23 08:56:40,2022-11-24,2023-02-11,79.0
1343,6855,5248,2023-02-16,0,855807,23.85,0,70212.0,16,03/01/23 08:57:34,2022-11-19,2023-02-16,89.0
1344,6856,5260,2023-02-05,1,483000,15.0,0,15569.0,16,03/01/23 08:59:42,2022-12-02,2023-02-19,65.0
1345,6857,5258,2023-02-07,1,321761,17.6,0,19048.0,16,03/01/23 09:01:09,2022-12-01,2023-03-04,68.0
1346,6858,5256,2023-02-08,1,260714,21.0,0,13032.0,16,03/01/23 09:04:08,2022-11-25,2023-02-24,75.0
1347,6859,5254,2023-02-09,1,193000,19.0,0,12169.0,16,03/01/23 09:04:37,2022-11-24,2023-03-03,77.0
1348,6860,5267,2023-02-10,1,312332,15.65,0,14285.0,16,03/01/23 09:05:01,2022-12-28,2023-02-21,44.0
1349,6861,5262,2023-02-11,1,140250,16.82,0,7280.0,16,03/01/23 09:05:29,2022-12-08,2023-03-05,65.0
1350,6862,5269,2023-02-11,1,370602,17.450001,0,20188.0,16,03/01/23 09:05:53,2022-12-30,2023-03-11,43.0
1351,6863,5247,2023-02-18,0,703179,28.0,0,77085.0,16,03/01/23 15:11:42,2022-11-16,2023-02-18,94.0
1352,6864,5257,2023-02-18,0,1197804,20.950001,0,81272.0,16,03/01/23 15:12:29,2022-12-01,2023-02-18,79.0
1353,6865,5260,2023-02-19,0,1341921,20.299999,0,98872.0,16,03/01/23 09:10:19,2022-12-02,2023-02-19,79.0
1354,6866,5244,2023-02-20,0,567540,28.620001,0,63015.0,16,03/01/23 09:11:06,2022-11-15,2023-02-20,97.0
1355,6867,5246,2023-02-20,0,608252,27.51,0,64916.0,16,03/01/23 09:12:45,2022-11-15,2023-02-20,97.0
1356,6868,5267,2023-02-21,0,1447381,21.0,0,98844.0,16,03/01/23 15:13:19,2022-12-28,2023-02-21,55.0
1357,6869,5245,2023-02-21,0,605014,27.719999,0,68471.0,16,03/01/23 15:14:14,2022-11-15,2023-02-21,98.0
1358,6870,5256,2023-02-24,0,1096962,26.0,0,112709.0,16,03/01/23 15:14:44,2022-11-25,2023-02-24,91.0
1359,6871,5261,2023-02-24,0,350185,27.0,0,37325.0,16,03/01/23 15:15:12,2022-12-08,2023-02-24,78.0
1360,6872,5258,2023-02-23,1,204699,24.9,0,19903.0,16,03/01/23 15:16:37,2022-12-01,2023-03-04,84.0
1361,6873,5254,2023-02-25,1,180909,26.4,0,18970.0,16,03/01/23 15:17:02,2022-11-24,2023-03-03,93.0
1362,6874,5262,2023-02-25,1,135571,21.0,0,10099.0,16,03/01/23 15:17:26,2022-12-08,2023-03-05,79.0
1363,6875,5275,2023-02-10,0,178571,0.83999997,0,0.0,16,03/01/23 11:39:22,2023-01-21,2023-02-10,20.0
1364,6876,5273,2023-02-14,0,968966,1.16,0,0.0,16,03/01/23 11:36:21,2023-01-19,2023-02-14,26.0
1365,6877,5274,2023-02-14,0,205036,1.39,0,0.0,16,03/01/23 11:41:55,2023-01-21,2023-02-14,24.0
1366,6878,5277,2023-02-15,0,1000813,1.23,0,0.0,16,03/01/23 11:48:08,2023-01-21,2023-02-15,25.0
1367,6879,5272,2023-02-09,0,4152000,0.75,0,0.0,16,03/01/23 12:20:34,2023-01-19,2023-02-09,21.0
1368,6880,5280,2023-02-14,0,1007895,0.38,0,0.0,16,03/01/23 14:36:25,2023-01-29,2023-02-14,16.0
1369,6881,5281,2023-02-14,0,840909,0.44,0,0.0,16,03/01/23 14:36:40,2023-01-29,2023-02-14,16.0
1370,6882,5282,2023-02-15,0,1397561,0.41,0,0.0,16,03/01/23 14:40:04,2023-01-29,2023-02-15,17.0
1371,6883,5271,2023-02-16,0,3235659,1.29,0,0.0,16,03/01/23 14:51:12,2023-01-19,2023-02-16,28.0
1372,6884,5276,2023-02-17,0,2171200,1.25,0,0.0,16,03/01/23 14:55:33,2023-01-21,2023-02-17,27.0
1373,6885,5268,2023-03-02,0,984996,25.059999,0,92260.0,16,03/14/23 14:31:19,2022-12-28,2023-03-02,64.0
1374,6886,5254,2023-03-03,0,540115,26.15,0,51513.0,16,03/14/23 14:31:49,2022-11-24,2023-03-03,99.0
1375,6887,5258,2023-03-04,0,841563,25.719999,0,81764.0,16,03/14/23 14:32:13,2022-12-01,2023-03-04,93.0
1376,6888,5262,2023-03-05,0,406549,23.209999,0,33440.0,16,03/14/23 14:32:32,2022-12-08,2023-03-05,87.0
1377,6889,5278,2023-03-02,1,314467,15.0,0,9952.0,16,03/14/23 14:36:40,2023-01-25,2023-04-14,36.0
1378,6890,5279,2023-03-03,1,363050,13.18,0,9081.0,16,03/14/23 14:37:55,2023-01-25,2023-04-28,37.0
1379,6891,5269,2023-03-11,0,1224716,28.200001,0,130824.0,16,03/20/23 14:48:38,2022-12-30,2023-03-11,71.0
1380,6892,5270,2023-03-09,1,341306,15.93,0,15522.0,16,03/20/23 14:49:57,2023-01-09,2023-04-10,59.0
1381,6893,5299,2023-03-11,0,3692857,0.56,0,0.0,16,03/14/23 15:40:01,2023-02-21,2023-03-11,18.0
1382,6894,5306,2023-03-13,0,1253226,0.62,0,0.0,16,03/14/23 15:47:47,2023-02-22,2023-03-13,19.0
1383,6895,5301,2023-03-14,0,1562821,0.77999997,0,0.0,16,03/20/23 14:09:26,2023-02-21,2023-03-14,21.0
1384,6896,5300,2023-03-15,0,3797368,0.75999999,0,0.0,16,03/20/23 14:18:20,2023-02-21,2023-03-15,22.0
1385,6897,5308,2023-03-16,0,1378182,0.55000001,0,0.0,16,03/20/23 23:35:00,2023-02-27,2023-03-16,17.0
1386,6898,5305,2023-03-17,0,4518947,0.94999999,0,0.0,16,03/20/23 23:19:42,2023-02-22,2023-03-17,23.0
1387,6900,5309,2023-03-20,0,2631068,1.03,0,0.0,16,03/20/23 23:53:51,2023-02-27,2023-03-20,21.0
1388,6901,5307,2023-03-22,0,5492632,0.94999999,0,0.0,16,03/28/23 10:51:32,2023-02-25,2023-03-22,25.0
1389,6902,5310,2023-03-23,0,915888,1.0700001,0,0.0,16,03/28/23 10:57:26,2023-02-28,2023-03-23,23.0
1390,6903,5319,2023-03-24,0,2854902,0.50999999,0,0.0,16,03/28/23 11:00:01,2023-03-05,2023-03-24,19.0
1391,6904,5320,2023-03-28,0,1751402,1.0700001,0,0.0,16,03/28/23 11:01:57,2023-03-05,2023-03-28,23.0
1392,6905,5321,2023-03-29,0,1180583,1.03,0,0.0,16,03/31/23 10:18:25,2023-03-06,2023-03-29,23.0
1393,6906,5278,2023-03-30,1,195370,24.190001,0,17100.0,16,04/05/23 09:10:16,2023-01-25,2023-04-14,64.0
1394,6907,5270,2023-04-03,1,541685,26.700001,0,54297.0,16,04/21/23 15:24:27,2023-01-09,2023-04-10,84.0
1395,6908,5289,2023-04-05,1,208032,18.799999,0,11556.0,16,04/21/23 15:25:07,2023-02-15,2023-04-20,49.0
1396,6909,5303,2023-04-05,1,460875,16.0,0,21098.0,16,04/21/23 15:25:36,2023-02-16,2023-05-16,48.0
1397,6910,5302,2023-04-06,1,210278,18.0,0,10888.0,16,04/21/23 15:26:37,2023-02-16,2023-04-28,49.0
1398,6911,5285,2023-04-07,1,236562,16.0,0,10640.0,16,04/21/23 15:26:12,2023-02-14,2023-04-27,52.0
1399,6912,5270,2023-04-10,0,410453,26.5,0,42694.0,16,04/21/23 15:13:34,2023-01-09,2023-04-10,91.0
1400,6913,5278,2023-04-14,0,695464,28.0,0,61299.0,16,04/21/23 15:14:44,2023-01-25,2023-04-14,79.0
1401,6914,5291,2023-04-17,0,1317696,23.0,0,106702.0,16,04/26/23 16:46:09,2023-02-09,2023-04-17,67.0
1402,6915,5292,2023-04-18,0,1608213,23.5,0,130351.0,16,04/26/23 16:47:44,2023-02-09,2023-04-18,68.0
1403,6916,5289,2023-04-20,0,697473,24.139999,0,59079.0,16,04/26/23 16:48:43,2023-02-15,2023-04-20,64.0
1404,6917,5303,2023-04-21,1,905667,21.0,0,68460.0,16,04/26/23 17:06:00,2023-02-16,2023-05-16,64.0
1405,6918,5304,2023-04-16,1,393407,18.200001,0,23090.0,16,04/26/23 17:04:42,2023-02-17,2023-05-11,58.0
1406,6919,5331,2023-04-14,1,2297436,0.77999997,0,0.0,16,04/21/23 15:30:45,2023-03-24,2023-04-19,21.0
1407,6920,5331,2023-04-19,0,142063,1.26,0,0.0,16,04/21/23 15:31:02,2023-03-24,2023-04-19,26.0
1408,6921,5336,2023-04-18,0,1828947,0.38,0,0.0,16,04/21/23 15:38:25,2023-04-01,2023-04-18,17.0
1409,6923,5295,2023-04-22,0,125749,23.030001,0,9802.0,16,04/26/23 16:50:33,2023-02-14,2023-04-22,67.0
1410,6924,5294,2023-04-22,0,123227,22.0,0,9630.0,16,04/26/23 16:52:51,2023-02-14,2023-04-22,67.0
1411,6925,5284,2023-04-22,0,74462,19.5,0,4762.0,16,04/23/23 19:49:35,2023-02-10,2023-04-22,71.0
1412,6926,5287,2023-04-22,0,68976,19.049999,0,4371.0,16,04/26/23 17:00:48,2023-02-14,2023-04-22,67.0
1413,6927,5330,2023-04-21,1,1425000,2.0,0,0.0,16,04/25/23 08:39:22,2023-03-24,2023-05-12,28.0
1414,6928,5283,2023-04-26,0,79375,19.200001,0,5000.0,16,04/28/23 09:08:26,2023-02-10,2023-04-26,75.0
1415,6929,5288,2023-04-26,0,51443,19.4,0,3274.0,16,04/28/23 09:10:05,2023-02-14,2023-04-26,71.0
1416,6930,5285,2023-04-27,0,602549,22.75,0,43793.0,16,05/05/23 09:09:04,2023-02-14,2023-04-27,72.0
1417,6931,5279,2023-04-28,0,896900,30.0,0,110668.0,16,05/15/23 12:50:17,2023-01-25,2023-04-28,93.0
1418,6932,5302,2023-04-28,0,661870,23.0,0,56880.0,16,05/05/23 09:10:37,2023-02-16,2023-04-28,71.0
1419,6933,5296,2023-04-30,0,496635,20.799999,0,34066.0,16,05/15/23 12:51:04,2023-02-14,2023-04-30,75.0
1420,6934,5297,2023-05-01,0,491835,24.25,0,40200.0,16,05/15/23 13:00:38,2023-02-15,2023-05-01,75.0
1421,6935,5298,2023-05-04,0,365960,25.0,0,32146.0,16,05/15/23 13:01:04,2023-02-15,2023-05-04,78.0
1422,6936,5315,2023-05-04,1,323294,17.0,0,9685.0,16,05/15/23 12:51:40,2023-03-15,2023-05-29,50.0
1423,6937,5304,2023-05-05,1,750809,23.5,0,60180.0,16,05/15/23 12:54:14,2023-02-17,2023-05-11,77.0
1424,6938,5332,2023-05-15,0,1430095,4.2199998,0,0.0,16,05/15/23 11:59:20,2023-03-24,2023-05-15,52.0
1425,6939,5343,2023-05-08,0,1334000,0.5,0,0.0,16,05/15/23 12:01:50,2023-04-19,2023-05-08,19.0
1426,6940,5344,2023-05-09,0,1091667,0.60000002,0,0.0,16,05/15/23 12:06:58,2023-04-19,2023-05-09,20.0
1427,6941,5345,2023-05-11,0,4725676,0.74000001,0,0.0,16,05/15/23 12:32:11,2023-04-19,2023-05-11,22.0
1428,6942,5342,2023-05-11,0,1021277,0.94,0,0.0,16,06/19/23 17:38:23,2023-04-18,2023-05-11,23.0
1429,6943,5341,2023-05-12,0,838636,0.88,0,0.0,16,05/15/23 12:38:01,2023-04-18,2023-05-12,24.0
1430,6944,5346,2023-05-12,0,1009302,0.43000001,0,0.0,16,05/15/23 12:45:23,2023-04-26,2023-05-12,16.0
1431,6945,5330,2023-05-12,0,118997,6.5799999,0,0.0,16,05/15/23 12:47:32,2023-03-24,2023-05-12,49.0
1432,6946,5325,2023-05-10,1,286118,17.0,0,15951.0,16,05/15/23 12:54:43,2023-03-22,2023-06-04,49.0
1433,6947,5314,2023-05-10,1,387167,18.0,0,22855.0,16,05/15/23 12:55:10,2023-03-15,2023-06-16,56.0
1434,6948,5316,2023-05-12,1,398163,19.6,0,25593.0,16,05/15/23 12:55:39,2023-03-17,2023-06-13,56.0
1435,6949,5317,2023-05-13,1,483929,16.799999,0,24632.0,16,05/15/23 13:00:09,2023-03-17,2023-06-18,57.0
1436,6950,5304,2023-05-11,0,345244,24.6,0,29581.0,16,06/05/23 12:25:38,2023-02-17,2023-05-11,83.0
1437,6951,5293,2023-05-13,0,305952,27.049999,0,32106.0,16,05/15/23 13:02:38,2023-02-14,2023-05-13,88.0
1438,6953,5303,2023-05-16,0,403935,31.0,0,46497.0,16,06/05/23 12:30:16,2023-02-16,2023-05-16,89.0
1439,6954,5290,2023-05-17,0,58080,31.25,0,7041.0,16,05/25/23 13:09:54,2023-02-16,2023-05-17,90.0
1440,6955,5286,2023-05-17,0,48400,30.0,0,5633.0,16,05/25/23 13:10:17,2023-02-15,2023-05-17,91.0
1441,6956,5311,2023-05-16,1,745687,19.129999,0,46782.0,16,05/25/23 13:11:14,2023-03-11,2023-06-05,66.0
1442,6957,5328,2023-05-17,1,509727,18.299999,0,30593.0,16,05/25/23 13:23:43,2023-03-24,2023-06-02,54.0
1443,6958,5323,2023-05-18,1,270319,18.799999,0,16665.0,16,05/25/23 13:12:09,2023-03-20,2023-06-04,59.0
1444,6959,5322,2023-05-19,1,263531,18.92,0,14135.0,16,06/05/23 12:29:40,2023-03-20,2023-06-03,60.0
1445,6960,5324,2023-05-20,1,259598,19.9,0,12712.0,16,06/05/23 12:29:23,2023-03-22,2023-06-03,59.0
1446,6961,5327,2023-05-20,1,173006,19.559999,0,9400.0,16,06/05/23 12:28:52,2023-03-23,2023-06-07,58.0
1447,6962,5326,2023-05-21,1,548929,18.209999,0,25802.0,16,06/05/23 12:28:31,2023-03-22,2023-06-06,60.0
1448,6963,5333,2023-05-21,1,208794,18.08,0,9701.0,16,06/05/23 12:28:05,2023-03-31,2023-06-07,51.0
1449,6964,5329,2023-05-22,1,339778,18.0,0,17363.0,16,06/05/23 12:27:50,2023-03-28,2023-06-17,55.0
1450,6965,5315,2023-05-23,1,544151,23.08,0,35602.0,16,06/05/23 12:27:33,2023-03-15,2023-05-29,69.0
1451,6966,5325,2023-05-25,1,237699,22.6,0,17708.0,16,06/05/23 12:27:04,2023-03-22,2023-06-04,64.0
1452,6967,5316,2023-05-25,1,356167,24.0,0,26528.0,16,06/05/23 12:26:35,2023-03-17,2023-06-13,69.0
1453,6968,5347,2023-05-18,0,1810465,0.86000001,0,0.0,16,05/26/23 16:44:52,2023-04-26,2023-05-18,22.0
1454,6969,5340,2023-05-19,0,3060989,1.8200001,0,0.0,16,05/26/23 16:51:53,2023-04-18,2023-05-19,31.0
1455,6970,5359,2023-05-26,0,949104,2.79,0,0.0,16,05/26/23 18:27:38,2023-05-12,2023-05-26,14.0
1456,6971,5314,2023-05-26,1,333827,24.299999,0,29444.0,16,05/26/23 18:55:49,2023-03-15,2023-06-16,72.0
1457,6972,5328,2023-05-26,1,280550,21.799999,0,22199.0,16,05/26/23 18:56:08,2023-03-24,2023-06-02,63.0
1458,6973,5315,2023-05-29,0,141846,26.0,0,9916.0,16,06/05/23 12:52:01,2023-03-15,2023-05-29,75.0
1459,6974,5317,2023-05-27,1,440552,21.75,0,28072.0,16,05/30/23 08:22:44,2023-03-17,2023-06-18,71.0
1460,6975,5311,2023-05-27,1,714564,23.620001,0,49446.0,16,05/30/23 08:23:12,2023-03-11,2023-06-05,77.0
1461,6976,5325,2023-05-28,1,447500,24.0,0,26226.0,16,06/05/23 12:49:06,2023-03-22,2023-06-04,67.0
1462,6977,5328,2023-05-28,1,334565,23.0,0,22543.0,16,05/30/23 08:24:16,2023-03-24,2023-06-02,65.0
1463,6978,5316,2023-05-29,1,448846,26.0,0,35168.0,16,06/05/23 12:49:44,2023-03-17,2023-06-13,73.0
1464,6979,5318,2023-05-29,1,318332,24.219999,0,24372.0,16,06/05/23 12:50:10,2023-03-16,2023-06-02,74.0
1465,6980,5326,2023-05-30,1,560409,22.0,0,35506.0,16,06/05/23 12:51:30,2023-03-22,2023-06-06,69.0
1466,6981,5328,2023-06-02,0,483162,23.4,0,33123.0,16,06/05/23 13:19:19,2023-03-24,2023-06-02,70.0
1467,6982,5318,2023-06-02,0,300956,24.059999,0,21214.0,16,06/05/23 13:20:23,2023-03-16,2023-06-02,78.0
1468,6983,5322,2023-06-03,0,613975,24.4,0,43343.0,16,06/19/23 16:33:34,2023-03-20,2023-06-03,75.0
1469,6984,5324,2023-06-03,0,878425,22.85,0,58803.0,16,06/05/23 13:24:05,2023-03-22,2023-06-03,73.0
1470,6985,5325,2023-06-04,0,119552,25.01,0,7711.0,16,06/19/23 16:34:33,2023-03-22,2023-06-04,74.0
1471,6986,5323,2023-06-04,0,554303,24.4,0,38583.0,16,06/19/23 16:35:00,2023-03-20,2023-06-04,76.0
1472,6987,5311,2023-06-05,0,1261975,24.299999,0,92576.0,16,06/19/23 16:36:09,2023-03-11,2023-06-05,86.0
1473,6988,5326,2023-06-06,0,724433,22.469999,0,54527.0,16,06/19/23 16:36:57,2023-03-22,2023-06-06,76.0
1474,6989,5327,2023-06-07,0,515575,22.6,0,37962.0,16,06/19/23 16:37:35,2023-03-23,2023-06-07,76.0
1475,6990,5333,2023-06-07,0,470510,22.549999,0,34876.0,16,06/19/23 16:38:05,2023-03-31,2023-06-07,68.0
1476,6991,5334,2023-06-08,0,80769,22.1,0,5789.0,16,06/19/23 16:38:36,2023-03-29,2023-06-08,71.0
1477,6992,5335,2023-06-08,0,65023,22.1,0,4735.0,16,06/19/23 16:39:07,2023-03-29,2023-06-08,71.0
1478,6993,5316,2023-06-13,0,443329,30.58,0,46445.0,16,06/28/23 16:00:11,2023-03-17,2023-06-13,88.0
1479,6994,5313,2023-06-13,0,778535,31.4,0,85110.0,16,06/28/23 16:00:52,2023-03-14,2023-06-13,91.0
1480,6995,5312,2023-06-15,0,858178,25.799999,0,76712.0,16,06/28/23 16:01:27,2023-03-13,2023-06-15,94.0
1481,6996,5314,2023-06-06,1,467584,26.9,0,37992.0,16,06/19/23 16:42:16,2023-03-15,2023-06-16,83.0
1482,6997,5314,2023-06-16,0,116322,28.549999,0,9915.0,16,06/28/23 16:02:07,2023-03-15,2023-06-16,93.0
1483,6998,5329,2023-06-17,0,924609,24.299999,0,68694.0,16,06/28/23 16:02:47,2023-03-28,2023-06-17,81.0
1484,6999,5317,2023-06-18,0,969053,29.889999,0,94398.0,16,06/28/23 16:04:29,2023-03-17,2023-06-18,93.0
1485,7000,5337,2023-06-09,1,472011,14.72,0,19611.0,16,06/19/23 16:44:56,2023-04-14,2023-07-03,56.0
1486,7001,5339,2023-06-18,1,246444,22.5,0,18427.0,16,06/28/23 16:08:49,2023-04-21,2023-07-13,58.0
1487,7002,5372,2023-06-06,0,1638333,0.60000002,0,0.0,16,06/19/23 17:14:34,2023-05-20,2023-06-06,17.0
1488,7003,5367,2023-06-09,0,4851220,0.81999999,0,0.0,16,06/19/23 17:18:54,2023-05-16,2023-06-09,24.0
1489,7004,5369,2023-06-16,0,2949167,1.2,0,0.0,16,06/19/23 17:25:18,2023-05-19,2023-06-16,28.0
1490,7005,5370,2023-06-13,0,3214783,1.15,0,0.0,16,06/19/23 17:26:51,2023-05-19,2023-06-13,25.0
1491,7006,5373,2023-06-14,0,2165789,1.14,0,0.0,16,06/19/23 17:29:11,2023-05-20,2023-06-14,25.0
1492,7007,5368,2023-06-16,0,2252941,1.53,0,0.0,16,06/19/23 17:32:17,2023-05-16,2023-06-16,31.0
1493,7008,5371,2023-06-17,0,1641975,0.81,0,0.0,16,06/19/23 17:33:41,2023-05-19,2023-06-17,29.0
1494,7009,5338,2023-06-20,1,363441,18.6,0,21127.0,16,06/28/23 16:09:34,2023-04-18,2023-07-11,63.0
1495,7010,5374,2023-06-21,0,2666977,2.1500001,0,0.0,16,06/28/23 15:42:31,2023-05-21,2023-06-21,31.0
1496,7011,5389,2023-06-23,0,989062,0.63999999,0,0.0,16,06/28/23 15:45:49,2023-06-06,2023-06-23,17.0
1497,7012,5388,2023-06-27,0,1244444,0.72000003,0,0.0,16,06/28/23 15:50:19,2023-06-05,2023-06-27,22.0
1498,7013,5386,2023-06-28,0,1086885,0.61000001,0,0.0,16,06/28/23 15:57:41,2023-06-05,2023-06-28,23.0
1499,7014,5348,2023-06-23,0,1139106,23.5,0,78769.0,16,06/28/23 16:08:08,2023-05-05,2023-06-23,49.0
1500,7015,5387,2023-06-29,0,1053488,0.86000001,0,0.0,16,07/03/23 19:17:50,2023-06-05,2023-06-29,24.0
1501,7016,5390,2023-07-04,0,2036364,0.44,0,0.0,16,07/11/23 11:00:02,2023-06-17,2023-07-04,17.0
1502,7017,5391,2023-07-11,1,1628866,0.97000003,0,0.0,16,07/11/23 14:04:20,2023-06-17,2023-07-18,24.0
1503,7018,5337,2023-07-03,0,1400042,23.92,0,111504.0,16,07/12/23 10:40:59,2023-04-14,2023-07-03,80.0
1504,7019,5338,2023-07-11,0,1089143,24.5,0,75602.0,16,07/24/23 14:37:05,2023-04-18,2023-07-11,84.0
1505,7020,5356,2023-07-12,0,722324,19.709999,0,35324.0,16,07/24/23 14:38:01,2023-05-12,2023-07-12,61.0
1506,7021,5363,2023-07-12,0,47299,18.879999,0,2172.0,16,07/24/23 14:56:36,2023-05-19,2023-07-12,54.0
1507,7022,5362,2023-07-12,0,46050,20.0,0,2545.0,16,07/24/23 14:57:00,2023-05-19,2023-07-12,54.0
1508,7023,5339,2023-07-13,0,754903,28.25,0,68482.0,16,07/24/23 14:57:32,2023-04-21,2023-07-13,83.0
1509,7024,5361,2023-07-13,0,697592,20.35,0,38264.0,16,07/24/23 14:57:58,2023-05-19,2023-07-13,55.0
1510,7025,5360,2023-07-14,0,1246800,20.0,0,61150.0,16,07/25/23 08:44:09,2023-05-18,2023-07-14,57.0
1511,7026,5357,2023-07-14,0,51393,20.1,0,2465.0,16,07/24/23 15:15:21,2023-05-12,2023-07-14,63.0
1512,7027,5392,2023-07-13,0,1327473,0.91000003,0,0.0,16,07/14/23 09:53:43,2023-06-17,2023-07-13,26.0
1513,7028,5364,2023-07-15,0,1574939,20.35,0,88707.0,16,07/27/23 11:14:33,2023-05-19,2023-07-15,57.0
1514,7029,5358,2023-07-14,0,52356,20.799999,0,2381.0,16,07/25/23 08:44:42,2023-05-12,2023-07-14,63.0
1515,7030,5355,2023-07-18,0,831804,22.01,0,54617.0,16,07/27/23 11:15:23,2023-05-11,2023-07-18,68.0
1516,7031,5350,2023-07-19,0,669409,20.299999,0,35795.0,16,07/27/23 11:15:57,2023-05-08,2023-07-19,72.0
1517,7032,5353,2023-07-20,0,1928578,20.4,0,116090.0,16,07/27/23 11:16:21,2023-05-11,2023-07-20,70.0
1518,7033,5349,2023-07-21,0,239545,19.799999,0,13320.0,16,07/27/23 11:16:50,2023-05-08,2023-07-21,74.0
1519,7034,5352,2023-07-21,0,627571,21.0,0,35944.0,16,07/27/23 11:17:15,2023-05-09,2023-07-21,73.0
1520,7035,5351,2023-07-22,0,193991,21.799999,0,12137.0,16,07/25/23 08:40:13,2023-05-09,2023-07-22,74.0
1521,7036,5354,2023-07-22,1,408738,21.4,0,29563.0,16,07/24/23 15:02:22,2023-05-11,2023-07-26,72.0
1522,7037,5391,2023-07-18,0,1564000,1.5,0,0.0,16,07/24/23 15:03:35,2023-06-17,2023-07-18,31.0
1523,7038,5399,2023-07-18,0,1173333,0.15000001,0,0.0,16,07/24/23 15:10:21,2023-07-06,2023-07-18,12.0
1524,7039,5354,2023-07-26,0,1243205,21.780001,0,80000.0,16,07/26/23 10:10:04,2023-05-11,2023-07-26,76.0
1525,7040,5366,2023-07-26,0,536231,19.9,0,30042.0,16,08/07/23 13:47:55,2023-05-27,2023-07-26,60.0
1526,7041,5398,2023-07-25,0,3572619,0.83999997,0,0.0,16,07/27/23 13:25:36,2023-07-04,2023-07-25,21.0
1527,7042,5406,2023-07-07,1,2952083,0.95999998,0,0.0,16,08/22/23 09:29:28,2023-07-03,2023-07-25,4.0
1528,7043,5400,2023-07-26,0,1024359,0.77999997,0,0.0,16,07/27/23 13:59:35,2023-07-06,2023-07-26,20.0
1529,7044,5413,2023-07-27,0,1168132,0.91000003,0,0.0,16,07/27/23 14:04:29,2023-07-24,2023-07-27,3.0
1530,7046,5381,2023-07-31,1,304392,18.9,0,14840.0,16,07/31/23 09:21:10,2023-06-13,2023-08-16,48.0
1531,7047,5379,2023-07-28,1,504111,18.0,0,23400.0,16,07/31/23 17:35:33,2023-06-09,2023-08-23,49.0
1532,7048,5406,2023-07-25,0,2084091,1.3200001,0,0.0,16,08/22/23 09:29:06,2023-07-03,2023-07-25,22.0
1533,7049,5421,2023-08-01,0,615862,1.45,0,0.0,16,08/07/23 13:44:27,2023-07-25,2023-08-01,7.0
1534,7050,5376,2023-08-03,0,866272,20.280001,0,50687.0,16,08/10/23 14:25:47,2023-06-09,2023-08-03,55.0
1535,7051,5380,2023-08-01,1,621769,16.17,0,23925.0,16,08/07/23 13:53:36,2023-06-10,2023-08-25,52.0
1536,7052,5377,2023-08-02,1,186135,21.059999,0,12072.0,16,08/07/23 13:53:59,2023-06-09,2023-08-13,54.0
1537,7053,5382,2023-08-03,1,129250,21.059999,0,8383.0,16,08/07/23 13:54:32,2023-06-14,2023-08-14,50.0
1538,7054,5383,2023-08-03,1,124223,20.6,0,7880.0,16,08/07/23 13:55:01,2023-06-14,2023-08-15,50.0
1539,7055,5384,2023-08-04,1,266362,20.780001,0,17046.0,16,08/07/23 13:55:39,2023-06-16,2023-08-12,49.0
1540,7056,5380,2023-08-09,1,489442,18.280001,0,23000.0,16,08/10/23 14:21:50,2023-06-10,2023-08-25,60.0
1541,7057,5365,2023-08-10,0,184997,33.060001,0,20058.0,16,08/10/23 14:23:12,2023-05-26,2023-08-10,76.0
1542,7058,5384,2023-08-12,0,666599,24.610001,0,52762.0,16,08/21/23 20:11:26,2023-06-16,2023-08-12,57.0
1543,7059,5416,2023-08-10,0,1178846,0.51999998,0,0.0,16,08/12/23 15:26:04,2023-07-21,2023-08-10,20.0
1544,7060,5379,2023-08-08,1,127586,22.33,0,8632.0,16,08/12/23 15:53:32,2023-06-09,2023-08-23,60.0
1545,7062,5375,2023-08-11,1,228739,23.799999,0,16495.0,16,08/12/23 15:54:20,2023-06-06,2023-08-16,66.0
1546,7064,5377,2023-08-13,0,659520,25.0,0,51660.0,16,08/21/23 20:13:27,2023-06-09,2023-08-13,65.0
1547,7065,5385,2023-08-13,0,1003000,23.0,0,69707.0,16,08/21/23 20:12:45,2023-06-17,2023-08-13,57.0
1548,7066,5394,2023-08-14,0,1141469,28.6,0,105600.0,16,08/21/23 20:14:47,2023-06-21,2023-08-14,54.0
1549,7067,5378,2023-08-11,0,1126951,25.75,0,95969.0,16,08/21/23 20:10:05,2023-06-09,2023-08-11,63.0
1550,7068,5382,2023-08-14,0,645702,24.200001,0,47340.0,16,08/21/23 20:14:13,2023-06-14,2023-08-14,61.0
1551,7069,5383,2023-08-15,0,534142,25.129999,0,39942.0,16,08/21/23 20:15:32,2023-06-14,2023-08-15,62.0
1552,7070,5381,2023-08-16,0,516482,25.299999,0,48081.0,16,08/21/23 20:16:07,2023-06-13,2023-08-16,64.0
1553,7071,5375,2023-08-16,0,605918,24.5,0,44975.0,16,08/21/23 20:16:47,2023-06-06,2023-08-16,71.0
1554,7072,5379,2023-08-17,1,334942,24.870001,0,25237.0,16,08/21/23 20:17:24,2023-06-09,2023-08-23,69.0
1555,7073,5426,2023-08-14,0,383562,1.46,0,0.0,16,08/21/23 20:18:06,2023-07-19,2023-08-14,26.0
1556,7074,5431,2023-08-17,0,547046,4.7399998,0,0.0,16,08/21/23 20:19:43,2023-07-29,2023-08-17,19.0
1557,7075,5414,2023-08-18,1,3009231,1.3,0,0.0,16,09/04/23 17:23:28,2023-07-20,2023-08-29,29.0
1558,7076,5415,2023-08-19,1,1069231,1.5599999,0,0.0,16,08/27/23 14:29:59,2023-07-21,2023-08-29,29.0
1559,7077,5379,2023-08-23,0,510816,24.870001,0,34487.0,16,08/23/23 08:47:26,2023-06-09,2023-08-23,75.0
1560,7078,5380,2023-08-25,0,1646000,23.5,0,119566.0,16,09/04/23 17:03:01,2023-06-10,2023-08-25,76.0
1561,7079,5393,2023-08-24,1,336250,22.4,0,22800.0,16,08/27/23 14:28:50,2023-06-21,2023-08-28,64.0
1562,7080,5427,2023-08-22,0,1246316,0.94999999,0,0.0,16,08/28/23 07:42:04,2023-07-27,2023-08-22,26.0
1563,7081,5430,2023-08-24,1,1823529,0.85000002,0,0.0,16,08/28/23 19:06:36,2023-08-02,2023-09-11,22.0
1564,7082,5428,2023-08-22,0,1060169,1.1799999,0,0.0,16,08/28/23 07:43:36,2023-07-27,2023-08-22,26.0
1565,7083,5429,2023-08-22,0,1045614,1.14,0,0.0,16,08/28/23 17:30:13,2023-07-27,2023-08-22,26.0
1566,7084,5393,2023-08-28,0,1187229,24.9,0,89349.0,16,09/04/23 17:03:50,2023-06-21,2023-08-28,68.0
1567,7085,5397,2023-08-29,0,1180631,22.82,0,85510.0,16,09/04/23 17:04:23,2023-06-28,2023-08-29,62.0
1568,7086,5396,2023-08-31,0,467733,24.08,0,34534.0,16,09/04/23 17:04:58,2023-06-27,2023-08-31,65.0
1569,7087,5395,2023-09-01,0,932716,24.82,0,74060.0,16,09/11/23 21:13:06,2023-06-27,2023-09-01,66.0
1570,7088,5401,2023-09-02,1,245370,20.52,0,14499.0,16,09/11/23 21:14:46,2023-07-04,2023-09-17,60.0
1571,7089,5414,2023-08-29,0,110000,3.5999999,0,0.0,16,09/04/23 17:24:25,2023-07-20,2023-08-29,40.0
1572,7090,5415,2023-08-29,0,1511111,2.6099999,0,0.0,16,09/04/23 17:28:11,2023-07-21,2023-08-29,39.0
1573,7091,5435,2023-08-29,0,2854023,1.74,0,0.0,16,09/04/23 17:47:09,2023-08-02,2023-08-29,27.0
1574,7092,5402,2023-09-08,0,340265,27.120001,0,30716.0,16,09/17/23 12:18:40,2023-07-04,2023-09-08,66.0
1575,7093,5403,2023-09-07,1,336143,21.0,0,20777.0,16,09/17/23 12:20:25,2023-07-11,2023-09-19,58.0
1576,7094,5408,2023-09-09,1,203607,22.18,0,13409.0,16,09/17/23 12:20:44,2023-07-18,2023-09-18,53.0
1577,7095,5430,2023-09-11,0,1484242,1.65,0,0.0,16,09/11/23 21:17:47,2023-08-02,2023-09-11,40.0
1578,7096,5444,2023-09-05,0,1274419,0.43000001,0,0.0,16,09/11/23 21:19:34,2023-08-19,2023-09-05,17.0
1579,7097,5441,2023-09-06,0,2046667,0.60000002,0,0.0,16,09/11/23 21:22:22,2023-08-16,2023-09-06,21.0
1580,7098,5443,2023-09-08,0,1314286,0.76999998,0,0.0,16,09/11/23 21:28:08,2023-08-16,2023-09-08,23.0
1581,7099,5442,2023-09-07,0,677922,0.76999998,0,0.0,16,09/11/23 21:53:16,2023-08-16,2023-09-07,22.0
1582,7100,5445,2023-09-08,0,1429167,0.47999999,0,0.0,16,09/11/23 21:57:27,2023-08-19,2023-09-08,20.0
1583,7101,5407,2023-09-05,0,584772,28.5,0,54858.0,16,09/17/23 12:18:08,2023-07-13,2023-09-05,54.0
1584,7102,5459,2023-09-14,0,717188,1.28,0,0.0,16,09/17/23 11:30:23,2023-09-09,2023-09-14,5.0
1585,7103,5404,2023-09-12,0,52645,28.360001,0,5063.0,16,09/25/23 18:27:08,2023-07-04,2023-09-12,70.0
1586,7104,5405,2023-09-12,0,44703,30.110001,0,4755.0,16,09/25/23 18:27:43,2023-07-04,2023-09-12,70.0
1587,7105,5452,2023-09-15,0,581481,0.27000001,0,0.0,16,09/17/23 12:24:16,2023-08-30,2023-09-15,16.0
1588,7106,5401,2023-09-17,0,796813,29.18,0,85856.0,16,09/25/23 18:29:15,2023-07-04,2023-09-17,75.0
1589,7107,5408,2023-09-18,0,747115,26.17,0,66572.0,16,09/25/23 18:31:45,2023-07-18,2023-09-18,62.0
1590,7108,5403,2023-09-19,0,909143,26.25,0,81124.0,16,09/25/23 18:33:58,2023-07-11,2023-09-19,70.0
1591,7109,5412,2023-09-19,0,32285,24.16,0,2374.0,16,09/25/23 18:35:10,2023-07-18,2023-09-19,63.0
1592,7110,5411,2023-09-19,0,50042,23.68,0,3659.0,16,09/25/23 18:36:28,2023-07-18,2023-09-19,63.0
1593,7111,5410,2023-09-20,0,42337,26.360001,0,3713.0,16,09/25/23 18:39:07,2023-07-18,2023-09-20,64.0
1594,7112,5418,2023-09-20,0,551940,23.969999,0,41008.0,16,09/27/23 09:50:59,2023-07-25,2023-09-20,57.0
1595,7113,5409,2023-09-20,0,35960,22.719999,0,2443.0,16,09/25/23 18:41:52,2023-07-18,2023-09-20,64.0
1596,7114,5423,2023-09-22,0,386417,24.0,0,30528.0,16,10/02/23 23:04:01,2023-07-25,2023-09-22,59.0
1597,7115,5436,2023-09-23,0,87746,18.280001,0,3492.0,16,10/02/23 23:04:24,2023-08-14,2023-09-23,40.0
1598,7116,5451,2023-09-13,0,1829412,0.17,0,0.0,16,09/27/23 09:46:32,2023-08-30,2023-09-13,14.0
1599,7117,5464,2023-09-26,0,342143,1.4,0,0.0,16,09/27/23 09:48:59,2023-09-15,2023-09-26,11.0
1600,7118,5419,2023-09-28,0,1287808,25.18,0,101361.0,16,10/09/23 10:57:03,2023-07-25,2023-09-28,65.0
1601,7119,5417,2023-09-29,0,609624,26.6,0,54702.0,16,10/09/23 10:57:53,2023-07-25,2023-09-29,66.0
1602,7120,5420,2023-09-30,0,815045,26.92,0,76085.0,16,10/09/23 10:58:41,2023-07-25,2023-09-30,67.0
1603,7121,5425,2023-09-30,0,734964,27.4,0,69985.0,16,10/09/23 10:59:23,2023-07-26,2023-09-30,66.0
1604,7122,5424,2023-10-01,0,388109,26.07,0,37229.0,16,10/02/23 23:07:32,2023-07-25,2023-10-01,68.0
1605,7123,5472,2023-09-28,0,1372159,1.76,0,0.0,16,10/09/23 10:52:10,2023-09-13,2023-09-28,15.0
1606,7124,5433,2023-10-03,0,1034543,25.91,0,92724.0,16,10/09/23 11:04:01,2023-07-29,2023-10-03,66.0
1607,7125,5422,2023-10-05,0,1350394,25.4,0,118651.0,16,10/09/23 11:04:41,2023-07-25,2023-10-05,72.0
1608,7126,5432,2023-10-07,0,328717,26.5,0,30134.0,16,10/09/23 11:05:25,2023-07-29,2023-10-07,70.0
1609,7127,5440,2023-10-07,1,159576,21.719999,0,9738.0,16,10/09/23 11:06:11,2023-08-19,,49.0
1610,7128,5465,2023-09-25,0,999091,1.1,0,0.0,16,10/09/23 17:40:43,2023-09-04,2023-09-25,21.0
